"url","post_id","user_url","user_username_raw","content","date_posted","hashtags","num_comments","num_shares","num_likes_type","page_name","profile_id","page_intro","page_category","page_logo","page_external_website","page_likes","page_followers","page_is_verified","original_post","attachments","other_posts_url","post_external_link","post_external_title","post_external_image","page_url","header_image","avatar_image_url","profile_handle","has_handshake","is_sponsored","sponsor_name","shortcode","video_view_count","likes","days_range","num_of_posts","post_image","posts_to_not_include","until_date","from_date","post_type","following","start_date","end_date","link_description_text","count_reactions_type","is_page","include_profile_data","page_phone","page_email","page_creation_time","page_reviews_score","page_reviewers_amount","page_price_range","timestamp","input","error","error_code","warning","warning_code"
"https://www.facebook.com/thongtinchinhphu/posts/pfbid02XiCPdxrAUZRPG74BZ3qsJNBmVDZjcGDqRJii2LzXYwXhWj4vThCz8tVry4DRRv33l","991088489722598","https://www.facebook.com/thongtinchinhphu","Thông tin Chính phủ","🇻🇳 ✈ 🇷🇺 Thủ tướng Phạm Minh Chính tới Nga, bắt đầu chuyến công tác tham dự Hội nghị BRICS mở rộng

---
️🎉 Ngay khi Thủ tướng bước xuống cầu thang máy bay, trên thảm đỏ, giữa hai hàng tiêu binh, các bạn Nga đón Thủ tướng với nghi thức truyền thống đặc biệt mời khách quý ăn bánh mì muối và kẹo ngọt trắc-trắc.","2024-10-23T09:17:37.000Z",,1,169,"{""type"":""Like"",""num"":10794}","Thông tin Chính phủ","100064643681682","Cập nhật tới đồng bào về hoạt động, chỉ đạo điều hành của Chính phủ, Thủ tướng Chính phủ và các thông tin quan trọng khác","Government organization","https://scontent.fbnx1-1.fna.fbcdn.net/v/t39.30808-1/452958737_925975866233861_1316250170357088183_n.jpg?stp=dst-jpg_s200x200_tt6&_nc_cat=1&ccb=1-7&_nc_sid=2d3e12&_nc_ohc=2EReX7b7AV4Q7kNvgFMDTKQ&_nc_oc=Adib9lfECsGP3fHvmZZFm-XWE6G2tz5ZkrtJgLOXPqf6GF_B3PCdOW4ZRGT__bfMb8c&_nc_zt=24&_nc_ht=scontent.fbnx1-1.fna&_nc_gid=AZ_l1xwojuM6Kdr8hqJ0fqq&oh=00_AYG2w02NE5TO2XiArWOLKLocoqjw-QkvftOv5CXF1uOoWg&oe=67D87446",,,6200000,false,,,,,,,"https://www.facebook.com/thongtinchinhphu","https://scontent.fbnx1-1.fna.fbcdn.net/v/t39.30808-6/459177468_957930123038435_2430169465116552305_n.jpg?stp=dst-jpg_s960x960_tt6&_nc_cat=111&ccb=1-7&_nc_sid=cc71e4&_nc_ohc=CysjJ0ZKmr4Q7kNvgHy-Uy3&_nc_oc=AdgXcBHTMEikTMLEsuoNRUSLFwN2GAO2PHUy1ZlKSz769q3ngeGDCnQ8vtl5UF7llJg&_nc_zt=23&_nc_ht=scontent.fbnx1-1.fna&_nc_gid=AZ_l1xwojuM6Kdr8hqJ0fqq&oh=00_AYGW7-kK6PeTkl4qrZNAHjbuOyHwITdvsP0bZJnXBzE-TA&oe=67D88FB7","https://scontent.fbnx1-1.fna.fbcdn.net/v/t39.30808-1/452958737_925975866233861_1316250170357088183_n.jpg?stp=dst-jpg_s200x200_tt6&_nc_cat=1&ccb=1-7&_nc_sid=2d3e12&_nc_ohc=2EReX7b7AV4Q7kNvgFMDTKQ&_nc_oc=Adib9lfECsGP3fHvmZZFm-XWE6G2tz5ZkrtJgLOXPqf6GF_B3PCdOW4ZRGT__bfMb8c&_nc_zt=24&_nc_ht=scontent.fbnx1-1.fna&_nc_gid=AZ_l1xwojuM6Kdr8hqJ0fqq&oh=00_AYG2w02NE5TO2XiArWOLKLocoqjw-QkvftOv5CXF1uOoWg&oe=67D87446","thongtinchinhphu",,false,,"991088489722598",,12933,,,,,,,"Post",,,,,"[{""type"":""Like"",""reaction_count"":10794},{""type"":""Love"",""reaction_count"":2054},{""type"":""Care"",""reaction_count"":63},{""type"":""Haha"",""reaction_count"":15},{""type"":""Wow"",""reaction_count"":6},{""type"":""Angry"",""reaction_count"":1}]",true,,,,"2015-10-01T00:00:00.000Z",,,,"2025-03-13T10:20:21.923Z","{""url"":""https://www.facebook.com/thongtinchinhphu"",""num_of_posts"":"""",""start_date"":""2024-09-01T09:59:16.000Z"",""end_date"":""2024-10-23T09:59:16.000Z""}",,,,
"https://www.facebook.com/thongtinchinhphu/posts/pfbid02Uhnfs4tz2bY219dAgtbiN9vQzH7XVKrxjbWiiEQ3PQrvNbowswof5FE6armtXm3jl","991111156386998","https://www.facebook.com/thongtinchinhphu","Thông tin Chính phủ","️🐕‍🦺🎖️
 Kết quả kiểm tra những “CHIẾN SĨ ĐẶC BIỆT”!","2024-10-23T09:59:16.000Z",,1,29,"{""type"":""Like"",""num"":2582}","Thông tin Chính phủ","100064643681682","Cập nhật tới đồng bào về hoạt động, chỉ đạo điều hành của Chính phủ, Thủ tướng Chính phủ và các thông tin quan trọng khác","Government organization","https://scontent.fbnx1-1.fna.fbcdn.net/v/t39.30808-1/452958737_925975866233861_1316250170357088183_n.jpg?stp=dst-jpg_s200x200_tt6&_nc_cat=1&ccb=1-7&_nc_sid=2d3e12&_nc_ohc=2EReX7b7AV4Q7kNvgFMDTKQ&_nc_oc=Adib9lfECsGP3fHvmZZFm-XWE6G2tz5ZkrtJgLOXPqf6GF_B3PCdOW4ZRGT__bfMb8c&_nc_zt=24&_nc_ht=scontent.fbnx1-1.fna&_nc_gid=AZ_l1xwojuM6Kdr8hqJ0fqq&oh=00_AYG2w02NE5TO2XiArWOLKLocoqjw-QkvftOv5CXF1uOoWg&oe=67D87446",,,6200000,false,,,,,,,"https://www.facebook.com/thongtinchinhphu","https://scontent.fbnx1-1.fna.fbcdn.net/v/t39.30808-6/459177468_957930123038435_2430169465116552305_n.jpg?stp=dst-jpg_s960x960_tt6&_nc_cat=111&ccb=1-7&_nc_sid=cc71e4&_nc_ohc=CysjJ0ZKmr4Q7kNvgHy-Uy3&_nc_oc=AdgXcBHTMEikTMLEsuoNRUSLFwN2GAO2PHUy1ZlKSz769q3ngeGDCnQ8vtl5UF7llJg&_nc_zt=23&_nc_ht=scontent.fbnx1-1.fna&_nc_gid=AZ_l1xwojuM6Kdr8hqJ0fqq&oh=00_AYGW7-kK6PeTkl4qrZNAHjbuOyHwITdvsP0bZJnXBzE-TA&oe=67D88FB7","https://scontent.fbnx1-1.fna.fbcdn.net/v/t39.30808-1/452958737_925975866233861_1316250170357088183_n.jpg?stp=dst-jpg_s200x200_tt6&_nc_cat=1&ccb=1-7&_nc_sid=2d3e12&_nc_ohc=2EReX7b7AV4Q7kNvgFMDTKQ&_nc_oc=Adib9lfECsGP3fHvmZZFm-XWE6G2tz5ZkrtJgLOXPqf6GF_B3PCdOW4ZRGT__bfMb8c&_nc_zt=24&_nc_ht=scontent.fbnx1-1.fna&_nc_gid=AZ_l1xwojuM6Kdr8hqJ0fqq&oh=00_AYG2w02NE5TO2XiArWOLKLocoqjw-QkvftOv5CXF1uOoWg&oe=67D87446","thongtinchinhphu",,false,,"991111156386998",,3019,,,,,,,"Post",,,,,"[{""type"":""Like"",""reaction_count"":2582},{""type"":""Love"",""reaction_count"":417},{""type"":""Care"",""reaction_count"":15},{""type"":""Haha"",""reaction_count"":2},{""type"":""Sad"",""reaction_count"":2},{""type"":""Angry"",""reaction_count"":1}]",true,,,,"2015-10-01T00:00:00.000Z",,,,"2025-03-13T10:20:21.923Z","{""url"":""https://www.facebook.com/thongtinchinhphu"",""num_of_posts"":"""",""start_date"":""2024-09-01T09:59:16.000Z"",""end_date"":""2024-10-23T09:59:16.000Z""}",,,,
"https://www.facebook.com/thongtinchinhphu/posts/pfbid02fJkUSHougLNHmMHnUGRhDvatjb7sGaU3fWGKRX3wJFqGyFYckCdxQPj1ZhsdCehBl","990866646411449","https://www.facebook.com/thongtinchinhphu","Thông tin Chính phủ","🤔 HƯỚNG TUYẾN ĐƯỜNG SẮT TỐC ĐỘ CAO CÓ ĐANG 'VÒNG' QUA NAM ĐỊNH ❓

---
🚅 Chính phủ vừa trình Quốc hội hồ sơ chủ trương đầu tư dự án đường sắt tốc độ cao trên trục Bắc - Nam. Theo Báo cáo nghiên cứu tiền khả thi dự án (báo cáo NCTKT), dự án xây dựng mới tuyến đường sắt tốc độ cao dài 1.541km, đường đôi, khổ 1.435mm, tốc độ thiết kế 350 km/h, tải trọng 22,5 tấn/trục.

Một trong những vấn đề được dư luận xã hội rất quan tâm là việc tuyến đường sắt này sẽ đi qua tỉnh Nam Định. Vị trí ga gần trung tâm TP Nam Định. 

Tuy nhiên, nhiều ý kiến cho rằng, hướng tuyến như vậy là đi ""vòng"", ảnh hưởng đến chi phí đầu tư cũng như chi phí vận hành khai thác. Đồng thời, không đáp ứng được chỉ đạo của Thủ tướng Phạm Minh Chính và Phó thủ tướng Trần Hồng Hà là ""bảo đảm hướng tuyến thẳng nhất có thể"".

Cụ thể, theo báo cáo NCTKT, ga Phủ Lý đặt tại xã Liêm Tuyền và xã Liêm Tiết, TP. Phủ Lý gần khu vực nút Liêm Tuyền, phía Đông đường bộ cao tốc. Từ sau ga Phủ Lý, tuyến cơ bản đi theo hướng đường sắt hiện tại và QL21 về phía TP Nam Định. Ga Nam Định đặt tại xã Mỹ Hưng, huyện Mỹ Lộc (gần ga Đặng Xá đường sắt hiện tại).

Sau ga Nam Định, tuyến đi về phía Ninh Bình, vượt sông Đáy tại khu vực phía Đông khu công nghiệp Khánh Phú (TP Ninh Bình). Tại Nam Định sẽ đặt một trạm tại xã Vĩnh Hào, huyện Vụ Bản, được sử dụng để dồn dịch các phương tiện bảo trì (máy đầm, máy nâng giật chèn đường, máy điều hòa ba lát...) và chứa vật tư, vật liệu cho khu gian Nam Định - Ninh Bình.

---
🧑‍✈️ Đại diện Ban Quản lý dự án đường sắt cho biết, hướng tuyến được nghiên cứu phải đảm bảo các yếu tố: 

Phụ thuộc quy hoạch ngành quốc gia, vùng, tỉnh, chuyên ngành liên quan đến dự án; đáp ứng các yêu cầu về điểm khống chế; đảm bảo chiều dài tuyến giữa các điểm khống chế là ngắn nhất, đáp ứng yêu cầu kỹ thuật của tuyến.

Mặt khác, phải phù hợp với điều kiện địa hình khu vực; hạn chế đi qua các khu vực nhạy cảm về môi trường tự nhiên, môi trường xã hội, các khu di tích, danh lam thắng cảnh... Đồng thời, hạn chế khối lượng giải phóng mặt bằng, tránh các khu vực dân cư tập trung đông đúc, giảm thiểu ảnh hưởng đến các công trình hiện hữu.

Về vị trí ga đường sắt tốc độ cao, nghiên cứu được xác định trên những nguyên tắc cơ bản: Phù hợp với điều kiện hiện trạng, quy hoạch phát triển của địa phương; tiếp cận khu vực trung tâm đô thị, khu vực quy hoạch có tiềm năng phát triển mới; có khả năng kết nối tốt với hệ thống giao thông công cộng, giao thông khác và khai thác có hiệu quả hạ tầng, phương tiện.

""Như vậy, nhà ga chính là điểm khống chế quan trọng trên tuyến đường sắt tốc độ cao. Giữa các nhà ga, hướng tuyến được nghiên cứu đáp ứng yêu cầu kỹ thuật tương ứng với cấp tốc độ thiết kế"", đại diện Ban Quản lý dự án đường sắt cho hay.

Với vị trí hướng tuyến đường sắt tốc độ cao qua tỉnh Nam Định, tư vấn cho biết, do vị trí ga nằm về phía Đông so với trục Bắc - Nam nên hướng tuyến vòng qua khu vực Nam Định sẽ khó đáp ứng tiêu chí ""thẳng nhất có thể"".

Tuy nhiên, vị trí ga Nam Định đã được nghiên cứu đảm bảo phù hợp với quy hoạch ngành quốc gia, quy hoạch vùng và quy hoạch tỉnh; đáp ứng yêu cầu kinh tế - kỹ thuật của tuyến.

Phương án hướng tuyến nghiên cứu cũng đã được hỗ trợ của tư vấn quốc tế để phân tích, đánh giá và thỏa thuận thống nhất với các địa phương, trong đó tỉnh Nam Định thống nhất phương án tuyến.

Về kết nối, gom và giải tỏa hành khách, theo tư vấn, ngoài phục vụ nhu cầu vận tải cho tỉnh Nam Định, tuyến đường sắt tốc độ cao còn phục vụ cho cả vùng gồm tỉnh Thái Bình, một phần phía Đông Nam khu vực Hải Dương, Hưng Yên với quy mô khoảng 4 triệu dân.

""Trường hợp hướng tuyến không đi qua tỉnh Nam Định sẽ không phát huy được hiệu quả kết nối, không phù hợp với các quy hoạch đã được duyệt"", tư vấn khẳng định.

Mặt khác, hướng tuyến đường sắt tốc độ cao ""vòng"" qua Nam Định sẽ hiệu quả về vận tải bởi Nam Định là khu vực phát triển công nghiệp dệt may, đông dân cư, nhu cầu đi lại cao. 

Đồng thời, đặt ga tại Nam Định sẽ kết nối thuận lợi với các tuyến đường sắt. 

Khi đó, ngoài tuyến đường sắt hiện hữu, đường sắt tốc độ cao trong tương lai sẽ kết nối với tuyến đường sắt ven biển Nam Định - Thái Bình - Hải Phòng - Quảng Ninh (quy hoạch mạng lưới đường sắt thời kỳ 2021-2030, tầm nhìn đến năm 2050 đã định hướng sẽ đầu tư tuyến này khổ 1.435mm sau năm 2030). 

Khi đó, sẽ kết nối được các tỉnh duyên hải phía Bắc với đường sắt tốc độ cao Bắc - Nam, tăng hiệu quả khai thác vận tải.

Lý giải thêm, đại diện Ban Quản lý dự án đường sắt cho hay, 💯 GA NAM ĐỊNH NGOÀI VAI TRÒ TRUNG TÂM CỦA TỈNH NAM ĐỊNH CÒN LÀ ĐIỂM KẾT NỐI ĐẾN MỘT SỐ ĐỊA PHƯƠNG LÂN CẬN TRONG KHU VỰC ĐỒNG BẰNG SÔNG HỒNG NHƯ THÁI BÌNH, HƯNG YÊN... VỚI DÂN SỐ HÀNG TRIỆU NGƯỜI. 

Do đó, ga Nam Định trên tuyến đường sắt hiện tại có vai trò quan trọng để kết nối hành lang Bắc - Nam với khu vực đồng bằng sông Hồng.

Trong quá trình nghiên cứu, cập nhật hướng tuyến đường sắt tốc độ cao, Bộ GTVT đã phối hợp rất chặt chẽ với các địa phương dọc tuyến. Kết quả rà soát thời gian qua đã tối ưu hóa hướng tuyến, giảm chiều dài toàn tuyến khoảng 4km.

Hướng tuyến này đã được báo cáo các cơ quan thẩm quyền, được các địa phương cập nhật trong quy hoạch tỉnh mà Bộ Kế hoạch & Đầu tư thẩm định, chấp thuận và Thủ tướng Chính phủ đã phê duyệt. Như vậy hướng tuyến đã được nghiên cứu kỹ càng theo cách ""thẳng nhất có thể"".

""Trường hợp điều chỉnh hướng tuyến, sẽ không đáp ứng yêu cầu về sự phù hợp với quy hoạch và các tiêu chí về vị trí ga và hướng tuyến.Tuy nhiên, trong giai đoạn triển khai tiếp theo, trên cơ sở số liệu khảo sát chi tiết, hướng tuyến sẽ tiếp tục được rà soát, điều chỉnh cục bộ nếu cần"", Ban Quản lý dự án đường sắt cho biết.","2024-10-23T01:47:09.000Z",,5,92,"{""type"":""Like"",""num"":2408}","Thông tin Chính phủ","100064643681682","Cập nhật tới đồng bào về hoạt động, chỉ đạo điều hành của Chính phủ, Thủ tướng Chính phủ và các thông tin quan trọng khác","Government organization","https://scontent.fbnx1-1.fna.fbcdn.net/v/t39.30808-1/452958737_925975866233861_1316250170357088183_n.jpg?stp=dst-jpg_s200x200_tt6&_nc_cat=1&ccb=1-7&_nc_sid=2d3e12&_nc_ohc=2EReX7b7AV4Q7kNvgFMDTKQ&_nc_oc=Adib9lfECsGP3fHvmZZFm-XWE6G2tz5ZkrtJgLOXPqf6GF_B3PCdOW4ZRGT__bfMb8c&_nc_zt=24&_nc_ht=scontent.fbnx1-1.fna&_nc_gid=AZ_l1xwojuM6Kdr8hqJ0fqq&oh=00_AYG2w02NE5TO2XiArWOLKLocoqjw-QkvftOv5CXF1uOoWg&oe=67D87446",,,6200000,false,,"[{""id"":""990863936411720"",""type"":""Photo"",""url"":""https://scontent.fbnx1-1.fna.fbcdn.net/v/t39.30808-6/464316160_990863939745053_1640665513761781630_n.jpg?stp=dst-jpg_p180x540_tt6&_nc_cat=101&ccb=1-7&_nc_sid=127cfc&_nc_ohc=Ot8nKQVILL0Q7kNvgFtEskL&_nc_oc=AdiZV-LHQzBwCESdf91XbcuW6Fl_H6b2UFqevcKekpLjaBG89GUX09PIsa_SUlId7iU&_nc_zt=23&_nc_ht=scontent.fbnx1-1.fna&_nc_gid=ANSloagncWb9HwJN-fWA0ax&oh=00_AYFocOb2hoLnGooI7qLVvA2tUWX7EJfh6r0nQc9RUTErBA&oe=67D86A93"",""video_url"":null}]",,,,,"https://www.facebook.com/thongtinchinhphu","https://scontent.fbnx1-1.fna.fbcdn.net/v/t39.30808-6/459177468_957930123038435_2430169465116552305_n.jpg?stp=dst-jpg_s960x960_tt6&_nc_cat=111&ccb=1-7&_nc_sid=cc71e4&_nc_ohc=CysjJ0ZKmr4Q7kNvgHy-Uy3&_nc_oc=AdgXcBHTMEikTMLEsuoNRUSLFwN2GAO2PHUy1ZlKSz769q3ngeGDCnQ8vtl5UF7llJg&_nc_zt=23&_nc_ht=scontent.fbnx1-1.fna&_nc_gid=AZ_l1xwojuM6Kdr8hqJ0fqq&oh=00_AYGW7-kK6PeTkl4qrZNAHjbuOyHwITdvsP0bZJnXBzE-TA&oe=67D88FB7","https://scontent.fbnx1-1.fna.fbcdn.net/v/t39.30808-1/452958737_925975866233861_1316250170357088183_n.jpg?stp=dst-jpg_s200x200_tt6&_nc_cat=1&ccb=1-7&_nc_sid=2d3e12&_nc_ohc=2EReX7b7AV4Q7kNvgFMDTKQ&_nc_oc=Adib9lfECsGP3fHvmZZFm-XWE6G2tz5ZkrtJgLOXPqf6GF_B3PCdOW4ZRGT__bfMb8c&_nc_zt=24&_nc_ht=scontent.fbnx1-1.fna&_nc_gid=AZ_l1xwojuM6Kdr8hqJ0fqq&oh=00_AYG2w02NE5TO2XiArWOLKLocoqjw-QkvftOv5CXF1uOoWg&oe=67D87446","thongtinchinhphu",,false,,"990866646411449",,2558,,,"https://scontent.fbnx1-1.fna.fbcdn.net/v/t39.30808-6/464316160_990863939745053_1640665513761781630_n.jpg?stp=dst-jpg_p180x540_tt6&_nc_cat=101&ccb=1-7&_nc_sid=127cfc&_nc_ohc=Ot8nKQVILL0Q7kNvgFtEskL&_nc_oc=AdiZV-LHQzBwCESdf91XbcuW6Fl_H6b2UFqevcKekpLjaBG89GUX09PIsa_SUlId7iU&_nc_zt=23&_nc_ht=scontent.fbnx1-1.fna&_nc_gid=ANSloagncWb9HwJN-fWA0ax&oh=00_AYFocOb2hoLnGooI7qLVvA2tUWX7EJfh6r0nQc9RUTErBA&oe=67D86A93",,,,"Post",,,,,"[{""type"":""Like"",""reaction_count"":2408},{""type"":""Love"",""reaction_count"":95},{""type"":""Haha"",""reaction_count"":27},{""type"":""Care"",""reaction_count"":15},{""type"":""Wow"",""reaction_count"":9},{""type"":""Sad"",""reaction_count"":2},{""type"":""Angry"",""reaction_count"":2}]",true,,,,"2015-10-01T00:00:00.000Z",,,,"2025-03-13T10:20:21.923Z","{""url"":""https://www.facebook.com/thongtinchinhphu"",""num_of_posts"":"""",""start_date"":""2024-09-01T09:59:16.000Z"",""end_date"":""2024-10-23T09:59:16.000Z""}",,,,
"https://www.facebook.com/thongtinchinhphu/posts/pfbid02r6JiaQa5DYVBMpQ4VFoDRWQy9ss8bYZEeUADh3szrRqojdxiiyfEM3x7oRu8xzTtl","991108859720561","https://www.facebook.com/thongtinchinhphu","Thông tin Chính phủ","🇻🇳
Đã có hơn 2.135 tỷ đồng tiền ủng hộ đồng bào chịu ảnh hưởng bởi bão số 3 

---
Ban Vận động cứu trợ Trung ương","2024-10-23T09:54:31.000Z",,3,69,"{""type"":""Like"",""num"":4720}","Thông tin Chính phủ","100064643681682","Cập nhật tới đồng bào về hoạt động, chỉ đạo điều hành của Chính phủ, Thủ tướng Chính phủ và các thông tin quan trọng khác","Government organization","https://scontent.fbnx1-1.fna.fbcdn.net/v/t39.30808-1/452958737_925975866233861_1316250170357088183_n.jpg?stp=dst-jpg_s200x200_tt6&_nc_cat=1&ccb=1-7&_nc_sid=2d3e12&_nc_ohc=2EReX7b7AV4Q7kNvgFMDTKQ&_nc_oc=Adib9lfECsGP3fHvmZZFm-XWE6G2tz5ZkrtJgLOXPqf6GF_B3PCdOW4ZRGT__bfMb8c&_nc_zt=24&_nc_ht=scontent.fbnx1-1.fna&_nc_gid=AZ_l1xwojuM6Kdr8hqJ0fqq&oh=00_AYG2w02NE5TO2XiArWOLKLocoqjw-QkvftOv5CXF1uOoWg&oe=67D87446",,,6200000,false,,,,,,,"https://www.facebook.com/thongtinchinhphu","https://scontent.fbnx1-1.fna.fbcdn.net/v/t39.30808-6/459177468_957930123038435_2430169465116552305_n.jpg?stp=dst-jpg_s960x960_tt6&_nc_cat=111&ccb=1-7&_nc_sid=cc71e4&_nc_ohc=CysjJ0ZKmr4Q7kNvgHy-Uy3&_nc_oc=AdgXcBHTMEikTMLEsuoNRUSLFwN2GAO2PHUy1ZlKSz769q3ngeGDCnQ8vtl5UF7llJg&_nc_zt=23&_nc_ht=scontent.fbnx1-1.fna&_nc_gid=AZ_l1xwojuM6Kdr8hqJ0fqq&oh=00_AYGW7-kK6PeTkl4qrZNAHjbuOyHwITdvsP0bZJnXBzE-TA&oe=67D88FB7","https://scontent.fbnx1-1.fna.fbcdn.net/v/t39.30808-1/452958737_925975866233861_1316250170357088183_n.jpg?stp=dst-jpg_s200x200_tt6&_nc_cat=1&ccb=1-7&_nc_sid=2d3e12&_nc_ohc=2EReX7b7AV4Q7kNvgFMDTKQ&_nc_oc=Adib9lfECsGP3fHvmZZFm-XWE6G2tz5ZkrtJgLOXPqf6GF_B3PCdOW4ZRGT__bfMb8c&_nc_zt=24&_nc_ht=scontent.fbnx1-1.fna&_nc_gid=AZ_l1xwojuM6Kdr8hqJ0fqq&oh=00_AYG2w02NE5TO2XiArWOLKLocoqjw-QkvftOv5CXF1uOoWg&oe=67D87446","thongtinchinhphu",,false,,"991108859720561",,5378,,,,,,,"Post",,,,,"[{""type"":""Like"",""reaction_count"":4720},{""type"":""Love"",""reaction_count"":610},{""type"":""Care"",""reaction_count"":34},{""type"":""Haha"",""reaction_count"":7},{""type"":""Wow"",""reaction_count"":5},{""type"":""Sad"",""reaction_count"":1},{""type"":""Angry"",""reaction_count"":1}]",true,,,,"2015-10-01T00:00:00.000Z",,,,"2025-03-13T10:20:21.923Z","{""url"":""https://www.facebook.com/thongtinchinhphu"",""num_of_posts"":"""",""start_date"":""2024-09-01T09:59:16.000Z"",""end_date"":""2024-10-23T09:59:16.000Z""}",,,,
"https://www.facebook.com/thongtinchinhphu/posts/pfbid026b7epjXzL3W2NTbSFnevURWFo2waGK9KvhRj5Z1b1pqoLYRGs4CZAQ6AKESQeB6yl","991040179727429","https://www.facebook.com/thongtinchinhphu","Thông tin Chính phủ","🚨 TẠM GIAM CỰU HIỆU TRƯỞNG TRƯỜNG PTDTBT TIỂU HỌC HOÀNG THU PHỐ 1 LIÊN QUAN VỤ ""11 HỌC SINH ĂN 2 GÓI MÌ TÔM CHAN CƠM""","2024-10-23T07:41:56.000Z",,0,427,"{""type"":""Like"",""num"":6820}","Thông tin Chính phủ","100064643681682","Cập nhật tới đồng bào về hoạt động, chỉ đạo điều hành của Chính phủ, Thủ tướng Chính phủ và các thông tin quan trọng khác","Government organization","https://scontent.fbnx1-1.fna.fbcdn.net/v/t39.30808-1/452958737_925975866233861_1316250170357088183_n.jpg?stp=dst-jpg_s200x200_tt6&_nc_cat=1&ccb=1-7&_nc_sid=2d3e12&_nc_ohc=2EReX7b7AV4Q7kNvgFMDTKQ&_nc_oc=Adib9lfECsGP3fHvmZZFm-XWE6G2tz5ZkrtJgLOXPqf6GF_B3PCdOW4ZRGT__bfMb8c&_nc_zt=24&_nc_ht=scontent.fbnx1-1.fna&_nc_gid=AZ_l1xwojuM6Kdr8hqJ0fqq&oh=00_AYG2w02NE5TO2XiArWOLKLocoqjw-QkvftOv5CXF1uOoWg&oe=67D87446",,,6200000,false,,"[{""id"":""783077327223417"",""type"":""Video"",""url"":""https://scontent.fbnx1-1.fna.fbcdn.net/v/t15.5256-10/464313631_783086207222529_8101836076661415208_n.jpg?_nc_cat=101&ccb=1-7&_nc_sid=7965db&_nc_ohc=FMNE_SG9KZcQ7kNvgEuZene&_nc_oc=AdgUwMOx1QXD3gZiJdwxHA65G5STtV9nHDMRKpoMMi6tdDTMkUNyzOeOW5cNUlENdqY&_nc_zt=23&_nc_ht=scontent.fbnx1-1.fna&_nc_gid=AMP0irtqUBaPVwW2WIVpgYB&oh=00_AYGYjqR-jmr4zc8uN4vIAc98b2L5SEdS6i-vRdzz14E3dw&oe=67D888F2"",""attachment_url"":""https://www.facebook.com/thongtinchinhphu/videos/783077327223417/"",""video_url"":""https://video.fbnx1-1.fna.fbcdn.net/o1/v/t2/f2/m69/AQMpP7VoNQjdw3nuuGpRN7vJyVan3RIhgA8XP5v3ndFPO8M2V3Z6ipxevKVs01XS2d2Z1XQyo_itvBNfOcAF_cfg.mp4?strext=1&_nc_cat=111&_nc_oc=AdjrbxUdT8RSFEtI9b8wfmq24AqbVuPdvEsuo7YoHbF0s5VVWq4JWR3lJk1l5OgEix0&_nc_sid=5e9851&_nc_ht=video.fbnx1-1.fna.fbcdn.net&_nc_ohc=aoK1x--MUyYQ7kNvgEL80oT&efg=eyJ2ZW5jb2RlX3RhZyI6Inhwdl9wcm9ncmVzc2l2ZS5GQUNFQk9PSy4uQzMuMTI4MC5kYXNoX2gyNjQtYmFzaWMtZ2VuMl83MjBwIiwieHB2X2Fzc2V0X2lkIjoxMDk3NjkzNTI4MzkwNTYwLCJ2aV91c2VjYXNlX2lkIjoxMDEyMiwiZHVyYXRpb25fcyI6MTE4LCJ1cmxnZW5fc291cmNlIjoid3d3In0%3D&ccb=17-1&vs=66775a59571ddfdd&_nc_vs=HBksFQIYOnBhc3N0aHJvdWdoX2V2ZXJzdG9yZS9HTmI3UXh3dDN6NUNfVklEQUdOdFMweFBiaE43Ym1kakFBQUYVAALIAQAVAhg6cGFzc3Rocm91Z2hfZXZlcnN0b3JlL0dBUC1xeHU4b0hQdWtxNEJBRWNLSEhqd2ZTOE1idjRHQUFBRhUCAsgBACgAGAAbAogHdXNlX29pbAExEnByb2dyZXNzaXZlX3JlY2lwZQExFQAAJsDup42WlvMDFQIoAkMzLBdAXZAxJul41RgZZGFzaF9oMjY0LWJhc2ljLWdlbjJfNzIwcBEAdQIA&_nc_zt=28&oh=00_AYF2VpiVex_77o45XUfcc2zInQI-DmCxr1k2fbBer9WRdQ&oe=67D89F8F""},{""id"":""991039649727482"",""type"":""Photo"",""url"":""https://scontent.fbnx1-1.fna.fbcdn.net/v/t39.30808-6/464294035_991039653060815_3214936966280859474_n.jpg?_nc_cat=102&ccb=1-7&_nc_sid=127cfc&_nc_ohc=pRg7zfngKowQ7kNvgF1KTvo&_nc_oc=AdiUuAb90V0vsYsboHF2bgD2G2rWNWSyaWg5PVakhbuMkPlbqRFaDs98me3JP8CQB-8&_nc_zt=23&_nc_ht=scontent.fbnx1-1.fna&_nc_gid=AMP0irtqUBaPVwW2WIVpgYB&oh=00_AYG3tg0tv_SibgEvnLEQ28IqXC8YW0eXiAAetPXif7uBig&oe=67D8973B"",""attachment_url"":""https://www.facebook.com/photo.php?fbid=991039649727482&set=a.249070910591030&type=3"",""video_url"":null},{""id"":""991041663060614"",""type"":""Photo"",""url"":""https://scontent.fbnx1-1.fna.fbcdn.net/v/t39.30808-6/464416070_991041666393947_7739282296589413973_n.jpg?_nc_cat=106&ccb=1-7&_nc_sid=127cfc&_nc_ohc=VffrXUMq9v0Q7kNvgEAz07_&_nc_oc=AdheqkTw4m_OwGKCIaxovU_ZSM3y4ZqtHIHBBW0vaMaLNF7PMMkNs69QpR7z8xgWvM0&_nc_zt=23&_nc_ht=scontent.fbnx1-1.fna&_nc_gid=AMP0irtqUBaPVwW2WIVpgYB&oh=00_AYHadI51hQO7ZRBlywmDHSKqSlzWyBH--wsN2xAUURFyMw&oe=67D87A5D"",""attachment_url"":""https://www.facebook.com/photo.php?fbid=991041663060614&set=a.249070910591030&type=3"",""video_url"":null}]",,,,,"https://www.facebook.com/thongtinchinhphu","https://scontent.fbnx1-1.fna.fbcdn.net/v/t39.30808-6/459177468_957930123038435_2430169465116552305_n.jpg?stp=dst-jpg_s960x960_tt6&_nc_cat=111&ccb=1-7&_nc_sid=cc71e4&_nc_ohc=CysjJ0ZKmr4Q7kNvgHy-Uy3&_nc_oc=AdgXcBHTMEikTMLEsuoNRUSLFwN2GAO2PHUy1ZlKSz769q3ngeGDCnQ8vtl5UF7llJg&_nc_zt=23&_nc_ht=scontent.fbnx1-1.fna&_nc_gid=AZ_l1xwojuM6Kdr8hqJ0fqq&oh=00_AYGW7-kK6PeTkl4qrZNAHjbuOyHwITdvsP0bZJnXBzE-TA&oe=67D88FB7","https://scontent.fbnx1-1.fna.fbcdn.net/v/t39.30808-1/452958737_925975866233861_1316250170357088183_n.jpg?stp=dst-jpg_s200x200_tt6&_nc_cat=1&ccb=1-7&_nc_sid=2d3e12&_nc_ohc=2EReX7b7AV4Q7kNvgFMDTKQ&_nc_oc=Adib9lfECsGP3fHvmZZFm-XWE6G2tz5ZkrtJgLOXPqf6GF_B3PCdOW4ZRGT__bfMb8c&_nc_zt=24&_nc_ht=scontent.fbnx1-1.fna&_nc_gid=AZ_l1xwojuM6Kdr8hqJ0fqq&oh=00_AYG2w02NE5TO2XiArWOLKLocoqjw-QkvftOv5CXF1uOoWg&oe=67D87446","thongtinchinhphu",,false,,"991040179727429",,7613,,,"https://scontent.fbnx1-1.fna.fbcdn.net/v/t39.30808-6/464294035_991039653060815_3214936966280859474_n.jpg?_nc_cat=102&ccb=1-7&_nc_sid=127cfc&_nc_ohc=pRg7zfngKowQ7kNvgF1KTvo&_nc_oc=AdiUuAb90V0vsYsboHF2bgD2G2rWNWSyaWg5PVakhbuMkPlbqRFaDs98me3JP8CQB-8&_nc_zt=23&_nc_ht=scontent.fbnx1-1.fna&_nc_gid=AMP0irtqUBaPVwW2WIVpgYB&oh=00_AYG3tg0tv_SibgEvnLEQ28IqXC8YW0eXiAAetPXif7uBig&oe=67D8973B",,,,"Post",,,,,"[{""type"":""Like"",""reaction_count"":6820},{""type"":""Love"",""reaction_count"":494},{""type"":""Haha"",""reaction_count"":118},{""type"":""Angry"",""reaction_count"":65},{""type"":""Sad"",""reaction_count"":50},{""type"":""Wow"",""reaction_count"":45},{""type"":""Care"",""reaction_count"":21}]",true,,,,"2015-10-01T00:00:00.000Z",,,,"2025-03-13T10:20:21.923Z","{""url"":""https://www.facebook.com/thongtinchinhphu"",""num_of_posts"":"""",""start_date"":""2024-09-01T09:59:16.000Z"",""end_date"":""2024-10-23T09:59:16.000Z""}",,,,
