"url","post_id","user_url","user_username_raw","content","date_posted","hashtags","num_comments","num_shares","num_likes_type","page_name","profile_id","page_intro","page_category","page_logo","page_external_website","page_likes","page_followers","page_is_verified","original_post","attachments","other_posts_url","post_external_link","post_external_title","post_external_image","page_url","header_image","avatar_image_url","profile_handle","has_handshake","is_sponsored","sponsor_name","shortcode","video_view_count","likes","days_range","num_of_posts","post_image","posts_to_not_include","until_date","from_date","post_type","following","start_date","end_date","link_description_text","count_reactions_type","is_page","include_profile_data","page_phone","page_email","page_creation_time","page_reviews_score","page_reviewers_amount","page_price_range","timestamp","input","error","error_code","warning","warning_code"
"https://www.facebook.com/thongtinchinhphu/posts/pfbid02DRz34kxnLuWjYma5QpHZHSizo51m1pd8W96FGrnpXyd2ejeSJ26R3xsidmMAtGT3l","994288226069291","https://www.facebook.com/thongtinchinhphu","Thông tin Chính phủ","🇻🇳 Thủ tướng Phạm Minh Chính cùng Phu nhân với các em nhỏ và cộng đồng người Việt tại UAE 

---
💞 Cộng đồng người Việt tại UAE luôn nỗ lực vươn lên, có nhiều hoạt động phong phú giữ gìn, phát huy bản sắc văn hóa Việt Nam, hướng về quê hương, đất nước như về nước dự Hội nghị Việt kiều, tổ chức lớp dạy tiếng Việt, tổ chức cuộc thi ""Thiếu nhi Việt Nam tại UAE với Bác Hồ"". 

Vừa qua, bà con đã quyên góp được 200 triệu đồng ủng hộ đồng bào bị thiệt hại do bão số 3.

Anh Vũ Trọng Thư, Giảng viên Đại học Công nghệ cao (HCT) ở UAE cho biết các trí thức Việt Nam tại UAE đã có những nghiên cứu, đóng góp liên quan đến công nghệ lọc nước biển thành nước ngọt tại Trường Sa, ứng dụng công nghệ để dự báo, cảnh báo sạt lở đất sau trận sạt lở ở Làng Nủ (Lào Cai)…

Chị Phạm Thị Luyến, chủ chuỗi nhà hàng Vietnamese Pho (Phở Việt Nam) ở UAE cho biết đến nay đã có 4 cửa hàng với hơn 100 nhân viên người Việt. 

Tại sự kiện 79 năm Quốc khánh nước Việt Nam tại Abu Dhabi mới đây do Đại sứ quán Việt Nam tổ chức với sự tham dự của 500 vị khách, các món phở, bánh cuốn, nem, bánh mì… đã được khách quý thưởng thức và khen ngợi.

""400 bát phở và nhiều phần nem, bánh cuốn đã được các khách quý dùng hết. Chúng tôi tự hào vì những món ăn mang thương hiệu Việt Nam ngày càng được người dân bản địa, các vị khách, đại sứ các nước yêu thích"", chị nói.

Hội đồng Doanh nghiệp Việt Nam tại UAE đã được thành lập; ngày càng có nhiều nhà hàng Việt Nam được mở; nhiều sinh viên Việt Nam tới học tập tại UAE; văn hóa, hình ảnh đất nước, con người Việt Nam được quảng bá, lan tỏa mạnh mẽ...","2024-10-27T15:04:20.000Z",,4,187,"{""type"":""Like"",""num"":3795}","Thông tin Chính phủ","100064643681682","Cập nhật tới đồng bào về hoạt động, chỉ đạo điều hành của Chính phủ, Thủ tướng Chính phủ và các thông tin quan trọng khác","Government organization","https://scontent.fsof10-1.fna.fbcdn.net/v/t39.30808-1/452958737_925975866233861_1316250170357088183_n.jpg?stp=dst-jpg_s200x200_tt6&_nc_cat=1&ccb=1-7&_nc_sid=2d3e12&_nc_ohc=2EReX7b7AV4Q7kNvgGIA4mT&_nc_oc=Adhng_rIcRkfuWN-nIOCAoXvYQmRhsh3-2O_taUo7-imm62c1sRyQEN_AVookvvdqTg&_nc_zt=24&_nc_ht=scontent.fsof10-1.fna&_nc_gid=Arjea6bqj3ZPzC7OYvyS5Hr&oh=00_AYEIwHAR9pnKB45s7I8UQJZ-kdjM31IUrhj-X7bzBed6KQ&oe=67D60986",,,6200000,false,,,,,,,"https://www.facebook.com/thongtinchinhphu","https://scontent.fsof10-1.fna.fbcdn.net/v/t39.30808-6/459177468_957930123038435_2430169465116552305_n.jpg?stp=dst-jpg_s960x960_tt6&_nc_cat=111&ccb=1-7&_nc_sid=cc71e4&_nc_ohc=CysjJ0ZKmr4Q7kNvgEyU4tN&_nc_oc=AdgK_efR5RsaG0-s4TtlAqj1J1WnWNhSmqByiWiGxgeLVkVVqMJWQBJcZLmLpvo-kpo&_nc_zt=23&_nc_ht=scontent.fsof10-1.fna&_nc_gid=Arjea6bqj3ZPzC7OYvyS5Hr&oh=00_AYHaxUpb2KPyLxBPzQuLs09qYWGL8qWpUfqWxhqvPcTsYw&oe=67D624F7","https://scontent.fsof10-1.fna.fbcdn.net/v/t39.30808-1/452958737_925975866233861_1316250170357088183_n.jpg?stp=dst-jpg_s200x200_tt6&_nc_cat=1&ccb=1-7&_nc_sid=2d3e12&_nc_ohc=2EReX7b7AV4Q7kNvgGIA4mT&_nc_oc=Adhng_rIcRkfuWN-nIOCAoXvYQmRhsh3-2O_taUo7-imm62c1sRyQEN_AVookvvdqTg&_nc_zt=24&_nc_ht=scontent.fsof10-1.fna&_nc_gid=Arjea6bqj3ZPzC7OYvyS5Hr&oh=00_AYEIwHAR9pnKB45s7I8UQJZ-kdjM31IUrhj-X7bzBed6KQ&oe=67D60986","thongtinchinhphu",,false,,"994288226069291",,4717,,,,,,,"Post",,,,,"[{""type"":""Like"",""reaction_count"":3795},{""type"":""Love"",""reaction_count"":885},{""type"":""Care"",""reaction_count"":33},{""type"":""Wow"",""reaction_count"":3},{""type"":""Haha"",""reaction_count"":1}]",true,,,,"2015-10-01T00:00:00.000Z",,,,"2025-03-11T14:48:39.501Z","{""url"":""https://www.facebook.com/thongtinchinhphu"",""num_of_posts"":"""",""start_date"":""2024-10-01T15:14:41.000Z"",""end_date"":""2024-10-27T15:14:41.000Z""}",,,,
"https://www.facebook.com/thongtinchinhphu/posts/pfbid02YKubWXjAXrGRReUtWKiyETBPLdWbG1n17vHSPxX8dSEpBiWt8aBAnC3an6VKudgkl","994296086068505","https://www.facebook.com/thongtinchinhphu","Thông tin Chính phủ","⚠️⛈️ DỰ BÁO MƯA LỚN Ở KHU VỰC TỪ NAM HÀ TĨNH ĐẾN QUẢNG NGÃI VÀ KON TUM

---
🛑 Từ tối nay đến hết đêm 28/10, ở khu vực từ Nam Hà Tĩnh đến Thừa Thiên Huế có mưa to đến rất to với lượng mưa từ 150-250mm, cục bộ có nơi trên 400mm; cảnh báo nguy cơ có mưa cục bộ cường suất lớn (>100mm/3h).

🛑 Từ tối nay đến ngày 28/10, ở khu vực từ Đà Nẵng đến Quảng Ngãi và Kon Tum có mưa to, cục bộ có nơi mưa rất to với lượng mưa từ 50-100mm, cục bộ có nơi trên 180mm.

🛑  Ngày và đêm 29/10, ở khu vực từ Hà Tĩnh đến Thừa Thiên Huế tiếp tục có mưa vừa, mưa to, cục bộ có nơi mưa rất to với lượng mưa từ 30-60mm, cục bộ có nơi trên 100mm.

‼️ Cảnh báo cấp độ rủi ro thiên tai do mưa lớn, lốc, sét: cấp 1

---
🛰 NCHMF📡","2024-10-27T15:14:41.000Z",,10,66,"{""type"":""Like"",""num"":1843}","Thông tin Chính phủ","100064643681682","Cập nhật tới đồng bào về hoạt động, chỉ đạo điều hành của Chính phủ, Thủ tướng Chính phủ và các thông tin quan trọng khác","Government organization","https://scontent.fsof10-1.fna.fbcdn.net/v/t39.30808-1/452958737_925975866233861_1316250170357088183_n.jpg?stp=dst-jpg_s200x200_tt6&_nc_cat=1&ccb=1-7&_nc_sid=2d3e12&_nc_ohc=2EReX7b7AV4Q7kNvgGIA4mT&_nc_oc=Adhng_rIcRkfuWN-nIOCAoXvYQmRhsh3-2O_taUo7-imm62c1sRyQEN_AVookvvdqTg&_nc_zt=24&_nc_ht=scontent.fsof10-1.fna&_nc_gid=Arjea6bqj3ZPzC7OYvyS5Hr&oh=00_AYEIwHAR9pnKB45s7I8UQJZ-kdjM31IUrhj-X7bzBed6KQ&oe=67D60986",,,6200000,false,,"[{""id"":""994295829401864"",""type"":""Photo"",""url"":""https://scontent.fsof10-1.fna.fbcdn.net/v/t39.30808-6/464767515_994295832735197_2397759606502588420_n.jpg?stp=dst-jpg_p526x296_tt6&_nc_cat=104&ccb=1-7&_nc_sid=127cfc&_nc_ohc=LqdfIfXWYeQQ7kNvgH7l1JY&_nc_oc=Adga_3sSIwW3ylRnRvcFAgUl09YU4jpydNqxGMgp9xBh4-3eHg7Tk8pGobspXU74iE8&_nc_zt=23&_nc_ht=scontent.fsof10-1.fna&_nc_gid=AiGv_StYlm5kyK3jWMd5peF&oh=00_AYEDBdSkxCKTCc6lhx3OYzf4lqbwvUMqCcMHrBk3A94nfw&oe=67D62550"",""video_url"":null}]",,,,,"https://www.facebook.com/thongtinchinhphu","https://scontent.fsof10-1.fna.fbcdn.net/v/t39.30808-6/459177468_957930123038435_2430169465116552305_n.jpg?stp=dst-jpg_s960x960_tt6&_nc_cat=111&ccb=1-7&_nc_sid=cc71e4&_nc_ohc=CysjJ0ZKmr4Q7kNvgEyU4tN&_nc_oc=AdgK_efR5RsaG0-s4TtlAqj1J1WnWNhSmqByiWiGxgeLVkVVqMJWQBJcZLmLpvo-kpo&_nc_zt=23&_nc_ht=scontent.fsof10-1.fna&_nc_gid=Arjea6bqj3ZPzC7OYvyS5Hr&oh=00_AYHaxUpb2KPyLxBPzQuLs09qYWGL8qWpUfqWxhqvPcTsYw&oe=67D624F7","https://scontent.fsof10-1.fna.fbcdn.net/v/t39.30808-1/452958737_925975866233861_1316250170357088183_n.jpg?stp=dst-jpg_s200x200_tt6&_nc_cat=1&ccb=1-7&_nc_sid=2d3e12&_nc_ohc=2EReX7b7AV4Q7kNvgGIA4mT&_nc_oc=Adhng_rIcRkfuWN-nIOCAoXvYQmRhsh3-2O_taUo7-imm62c1sRyQEN_AVookvvdqTg&_nc_zt=24&_nc_ht=scontent.fsof10-1.fna&_nc_gid=Arjea6bqj3ZPzC7OYvyS5Hr&oh=00_AYEIwHAR9pnKB45s7I8UQJZ-kdjM31IUrhj-X7bzBed6KQ&oe=67D60986","thongtinchinhphu",,false,,"994296086068505",,1932,,,"https://scontent.fsof10-1.fna.fbcdn.net/v/t39.30808-6/464767515_994295832735197_2397759606502588420_n.jpg?stp=dst-jpg_p526x296_tt6&_nc_cat=104&ccb=1-7&_nc_sid=127cfc&_nc_ohc=LqdfIfXWYeQQ7kNvgH7l1JY&_nc_oc=Adga_3sSIwW3ylRnRvcFAgUl09YU4jpydNqxGMgp9xBh4-3eHg7Tk8pGobspXU74iE8&_nc_zt=23&_nc_ht=scontent.fsof10-1.fna&_nc_gid=AiGv_StYlm5kyK3jWMd5peF&oh=00_AYEDBdSkxCKTCc6lhx3OYzf4lqbwvUMqCcMHrBk3A94nfw&oe=67D62550",,,,"Post",,,,,"[{""type"":""Like"",""reaction_count"":1843},{""type"":""Sad"",""reaction_count"":43},{""type"":""Love"",""reaction_count"":31},{""type"":""Care"",""reaction_count"":10},{""type"":""Wow"",""reaction_count"":5}]",true,,,,"2015-10-01T00:00:00.000Z",,,,"2025-03-11T14:48:39.501Z","{""url"":""https://www.facebook.com/thongtinchinhphu"",""num_of_posts"":"""",""start_date"":""2024-10-01T15:14:41.000Z"",""end_date"":""2024-10-27T15:14:41.000Z""}",,,,
"https://www.facebook.com/thongtinchinhphu/posts/pfbid02KMn48ksJrP4Xeo5J5zXbnvvrpC5wVqhEUetr5ufhDrLR6h8etBUZSdN3vrZWXiXyl","994206636077450","https://www.facebook.com/thongtinchinhphu","Thông tin Chính phủ","🚸 PHỤ HUYNH, HỌC SINH Ở THỪA THIÊN HUẾ LƯU Ý!","2024-10-27T12:59:25.000Z",,19,34,"{""type"":""Like"",""num"":3270}","Thông tin Chính phủ","100064643681682","Cập nhật tới đồng bào về hoạt động, chỉ đạo điều hành của Chính phủ, Thủ tướng Chính phủ và các thông tin quan trọng khác","Government organization","https://scontent.fsof10-1.fna.fbcdn.net/v/t39.30808-1/452958737_925975866233861_1316250170357088183_n.jpg?stp=dst-jpg_s200x200_tt6&_nc_cat=1&ccb=1-7&_nc_sid=2d3e12&_nc_ohc=2EReX7b7AV4Q7kNvgGIA4mT&_nc_oc=Adhng_rIcRkfuWN-nIOCAoXvYQmRhsh3-2O_taUo7-imm62c1sRyQEN_AVookvvdqTg&_nc_zt=24&_nc_ht=scontent.fsof10-1.fna&_nc_gid=Arjea6bqj3ZPzC7OYvyS5Hr&oh=00_AYEIwHAR9pnKB45s7I8UQJZ-kdjM31IUrhj-X7bzBed6KQ&oe=67D60986",,,6200000,false,,"[{""id"":""994931366004977"",""type"":""Photo"",""url"":""https://scontent.fsof10-1.fna.fbcdn.net/v/t39.30808-6/464827115_994931369338310_3896538167212755740_n.jpg?stp=dst-jpg_s600x600_tt6&_nc_cat=111&ccb=1-7&_nc_sid=127cfc&_nc_ohc=NmmdoDS5hv0Q7kNvgFHytp7&_nc_oc=AdjYHHqCwkdBhXJ1_g5LKCg6M0wah2Kai2k27XRFBOnilUyRUGJ4EXDa1coiVzeqWps&_nc_zt=23&_nc_ht=scontent.fsof10-1.fna&_nc_gid=APUbm2rH-BsGWJ9ye9YPtqu&oh=00_AYGbo2XXT40kGNg3OT3qQBG_dxriHpo_HCrEACN0uR9XXQ&oe=67D62CB4"",""video_url"":null}]",,,,,"https://www.facebook.com/thongtinchinhphu","https://scontent.fsof10-1.fna.fbcdn.net/v/t39.30808-6/459177468_957930123038435_2430169465116552305_n.jpg?stp=dst-jpg_s960x960_tt6&_nc_cat=111&ccb=1-7&_nc_sid=cc71e4&_nc_ohc=CysjJ0ZKmr4Q7kNvgEyU4tN&_nc_oc=AdgK_efR5RsaG0-s4TtlAqj1J1WnWNhSmqByiWiGxgeLVkVVqMJWQBJcZLmLpvo-kpo&_nc_zt=23&_nc_ht=scontent.fsof10-1.fna&_nc_gid=Arjea6bqj3ZPzC7OYvyS5Hr&oh=00_AYHaxUpb2KPyLxBPzQuLs09qYWGL8qWpUfqWxhqvPcTsYw&oe=67D624F7","https://scontent.fsof10-1.fna.fbcdn.net/v/t39.30808-1/452958737_925975866233861_1316250170357088183_n.jpg?stp=dst-jpg_s200x200_tt6&_nc_cat=1&ccb=1-7&_nc_sid=2d3e12&_nc_ohc=2EReX7b7AV4Q7kNvgGIA4mT&_nc_oc=Adhng_rIcRkfuWN-nIOCAoXvYQmRhsh3-2O_taUo7-imm62c1sRyQEN_AVookvvdqTg&_nc_zt=24&_nc_ht=scontent.fsof10-1.fna&_nc_gid=Arjea6bqj3ZPzC7OYvyS5Hr&oh=00_AYEIwHAR9pnKB45s7I8UQJZ-kdjM31IUrhj-X7bzBed6KQ&oe=67D60986","thongtinchinhphu",,false,,"994206636077450",,3507,,,"https://scontent.fsof10-1.fna.fbcdn.net/v/t39.30808-6/464827115_994931369338310_3896538167212755740_n.jpg?stp=dst-jpg_s600x600_tt6&_nc_cat=111&ccb=1-7&_nc_sid=127cfc&_nc_ohc=NmmdoDS5hv0Q7kNvgFHytp7&_nc_oc=AdjYHHqCwkdBhXJ1_g5LKCg6M0wah2Kai2k27XRFBOnilUyRUGJ4EXDa1coiVzeqWps&_nc_zt=23&_nc_ht=scontent.fsof10-1.fna&_nc_gid=APUbm2rH-BsGWJ9ye9YPtqu&oh=00_AYGbo2XXT40kGNg3OT3qQBG_dxriHpo_HCrEACN0uR9XXQ&oe=67D62CB4",,,,"Post",,,,,"[{""type"":""Like"",""reaction_count"":3270},{""type"":""Love"",""reaction_count"":194},{""type"":""Care"",""reaction_count"":20},{""type"":""Sad"",""reaction_count"":20},{""type"":""Wow"",""reaction_count"":3}]",true,,,,"2015-10-01T00:00:00.000Z",,,,"2025-03-11T14:48:39.501Z","{""url"":""https://www.facebook.com/thongtinchinhphu"",""num_of_posts"":"""",""start_date"":""2024-10-01T15:14:41.000Z"",""end_date"":""2024-10-27T15:14:41.000Z""}",,,,
"https://www.facebook.com/thongtinchinhphu/posts/pfbid0NNBowe5YtT4kWXhQjKCvq9cU5mKRVohEtcJrxDeV5xwyZ9sABrV89M2rLxVZ9Pswl","994222686075845","https://www.facebook.com/thongtinchinhphu","Thông tin Chính phủ","🇻🇳 ⚓ 🇰🇷 TÀU CSB 8004 LÊN ĐƯỜNG ĐI THĂM VÀ GIAO LƯU TẠI HÀN QUỐC

---
✍️ Chu Anh/QĐND","2024-10-27T13:25:39.000Z",,8,91,"{""type"":""Like"",""num"":3129}","Thông tin Chính phủ","100064643681682","Cập nhật tới đồng bào về hoạt động, chỉ đạo điều hành của Chính phủ, Thủ tướng Chính phủ và các thông tin quan trọng khác","Government organization","https://scontent.fsof10-1.fna.fbcdn.net/v/t39.30808-1/452958737_925975866233861_1316250170357088183_n.jpg?stp=dst-jpg_s200x200_tt6&_nc_cat=1&ccb=1-7&_nc_sid=2d3e12&_nc_ohc=2EReX7b7AV4Q7kNvgGIA4mT&_nc_oc=Adhng_rIcRkfuWN-nIOCAoXvYQmRhsh3-2O_taUo7-imm62c1sRyQEN_AVookvvdqTg&_nc_zt=24&_nc_ht=scontent.fsof10-1.fna&_nc_gid=Arjea6bqj3ZPzC7OYvyS5Hr&oh=00_AYEIwHAR9pnKB45s7I8UQJZ-kdjM31IUrhj-X7bzBed6KQ&oe=67D60986",,,6200000,false,,,,,,,"https://www.facebook.com/thongtinchinhphu","https://scontent.fsof10-1.fna.fbcdn.net/v/t39.30808-6/459177468_957930123038435_2430169465116552305_n.jpg?stp=dst-jpg_s960x960_tt6&_nc_cat=111&ccb=1-7&_nc_sid=cc71e4&_nc_ohc=CysjJ0ZKmr4Q7kNvgEyU4tN&_nc_oc=AdgK_efR5RsaG0-s4TtlAqj1J1WnWNhSmqByiWiGxgeLVkVVqMJWQBJcZLmLpvo-kpo&_nc_zt=23&_nc_ht=scontent.fsof10-1.fna&_nc_gid=Arjea6bqj3ZPzC7OYvyS5Hr&oh=00_AYHaxUpb2KPyLxBPzQuLs09qYWGL8qWpUfqWxhqvPcTsYw&oe=67D624F7","https://scontent.fsof10-1.fna.fbcdn.net/v/t39.30808-1/452958737_925975866233861_1316250170357088183_n.jpg?stp=dst-jpg_s200x200_tt6&_nc_cat=1&ccb=1-7&_nc_sid=2d3e12&_nc_ohc=2EReX7b7AV4Q7kNvgGIA4mT&_nc_oc=Adhng_rIcRkfuWN-nIOCAoXvYQmRhsh3-2O_taUo7-imm62c1sRyQEN_AVookvvdqTg&_nc_zt=24&_nc_ht=scontent.fsof10-1.fna&_nc_gid=Arjea6bqj3ZPzC7OYvyS5Hr&oh=00_AYEIwHAR9pnKB45s7I8UQJZ-kdjM31IUrhj-X7bzBed6KQ&oe=67D60986","thongtinchinhphu",,false,,"994222686075845",,3419,,,,,,,"Post",,,,,"[{""type"":""Like"",""reaction_count"":3129},{""type"":""Love"",""reaction_count"":272},{""type"":""Care"",""reaction_count"":12},{""type"":""Haha"",""reaction_count"":3},{""type"":""Wow"",""reaction_count"":3}]",true,,,,"2015-10-01T00:00:00.000Z",,,,"2025-03-11T14:48:39.501Z","{""url"":""https://www.facebook.com/thongtinchinhphu"",""num_of_posts"":"""",""start_date"":""2024-10-01T15:14:41.000Z"",""end_date"":""2024-10-27T15:14:41.000Z""}",,,,
"https://www.facebook.com/thongtinchinhphu/posts/pfbid0aukABp87gvdxHKnZzJAio7KhFakbx2fzHG9V83L1qNMiKqbfHGm3chyUTDxZMEfsl","994137582751022","https://www.facebook.com/thongtinchinhphu","Thông tin Chính phủ","🛫 🛫 🛫 🛫
ĐÃ CHO KHAI THÁC TRỞ LẠI 4 SÂN BAY Ở MIỀN TRUNG: ĐÀ NẴNG, PHÚ BÀI, CHU LAI, ĐỒNG HỚI","2024-10-27T10:57:31.000Z",,15,38,"{""type"":""Like"",""num"":3210}","Thông tin Chính phủ","100064643681682","Cập nhật tới đồng bào về hoạt động, chỉ đạo điều hành của Chính phủ, Thủ tướng Chính phủ và các thông tin quan trọng khác","Government organization","https://scontent.fsof10-1.fna.fbcdn.net/v/t39.30808-1/452958737_925975866233861_1316250170357088183_n.jpg?stp=dst-jpg_s200x200_tt6&_nc_cat=1&ccb=1-7&_nc_sid=2d3e12&_nc_ohc=2EReX7b7AV4Q7kNvgGIA4mT&_nc_oc=Adhng_rIcRkfuWN-nIOCAoXvYQmRhsh3-2O_taUo7-imm62c1sRyQEN_AVookvvdqTg&_nc_zt=24&_nc_ht=scontent.fsof10-1.fna&_nc_gid=Arjea6bqj3ZPzC7OYvyS5Hr&oh=00_AYEIwHAR9pnKB45s7I8UQJZ-kdjM31IUrhj-X7bzBed6KQ&oe=67D60986",,,6200000,false,,,,,,,"https://www.facebook.com/thongtinchinhphu","https://scontent.fsof10-1.fna.fbcdn.net/v/t39.30808-6/459177468_957930123038435_2430169465116552305_n.jpg?stp=dst-jpg_s960x960_tt6&_nc_cat=111&ccb=1-7&_nc_sid=cc71e4&_nc_ohc=CysjJ0ZKmr4Q7kNvgEyU4tN&_nc_oc=AdgK_efR5RsaG0-s4TtlAqj1J1WnWNhSmqByiWiGxgeLVkVVqMJWQBJcZLmLpvo-kpo&_nc_zt=23&_nc_ht=scontent.fsof10-1.fna&_nc_gid=Arjea6bqj3ZPzC7OYvyS5Hr&oh=00_AYHaxUpb2KPyLxBPzQuLs09qYWGL8qWpUfqWxhqvPcTsYw&oe=67D624F7","https://scontent.fsof10-1.fna.fbcdn.net/v/t39.30808-1/452958737_925975866233861_1316250170357088183_n.jpg?stp=dst-jpg_s200x200_tt6&_nc_cat=1&ccb=1-7&_nc_sid=2d3e12&_nc_ohc=2EReX7b7AV4Q7kNvgGIA4mT&_nc_oc=Adhng_rIcRkfuWN-nIOCAoXvYQmRhsh3-2O_taUo7-imm62c1sRyQEN_AVookvvdqTg&_nc_zt=24&_nc_ht=scontent.fsof10-1.fna&_nc_gid=Arjea6bqj3ZPzC7OYvyS5Hr&oh=00_AYEIwHAR9pnKB45s7I8UQJZ-kdjM31IUrhj-X7bzBed6KQ&oe=67D60986","thongtinchinhphu",,false,,"994137582751022",,3359,,,,,,,"Post",,,,,"[{""type"":""Like"",""reaction_count"":3210},{""type"":""Love"",""reaction_count"":136},{""type"":""Care"",""reaction_count"":9},{""type"":""Haha"",""reaction_count"":2},{""type"":""Wow"",""reaction_count"":1},{""type"":""Sad"",""reaction_count"":1}]",true,,,,"2015-10-01T00:00:00.000Z",,,,"2025-03-11T14:48:39.501Z","{""url"":""https://www.facebook.com/thongtinchinhphu"",""num_of_posts"":"""",""start_date"":""2024-10-01T15:14:41.000Z"",""end_date"":""2024-10-27T15:14:41.000Z""}",,,,
"https://www.facebook.com/thongtinchinhphu/posts/pfbid02KBQJmWAiewKwYoVFaFMbzcururHT8kSfFLM9evvd1mvD2wFMyVMifkbdYZpbPZbPl","994133069418140","https://www.facebook.com/thongtinchinhphu","Thông tin Chính phủ","🇻🇳 ✈ 🇦🇪 THỦ TƯỚNG ĐẾN THỦ ĐÔ ABU DHABI, BẮT ĐẦU CHUYẾN THĂM UAE

---
📈 UAE là nền kinh tế lớn thứ hai tại khu vực vùng Vịnh; là trung tâm tài chính - thương mại hàng đầu ở Trung Đông; quốc gia sản xuất dầu mỏ lớn thứ 4 trong Tổ chức các nước xuất khẩu dầu mỏ (OPEC).

UAE đang hướng đến phát triển bền vững, xác lập vị thế dẫn đầu trong các xu thế phát triển mới trên thế giới, thực hiện ""Tầm nhìn UAE 2031"" (We the UAE 2031), hướng tới mục tiêu đưa UAE trở thành trung tâm kinh tế toàn cầu và hình mẫu phát triển thành công của thế giới.

UAE có vai trò quan trọng tại khu vực Trung Đông - Bắc Phi; đề cao sự gắn kết với khối Arab và vùng Vịnh. 

Những năm gần đây, UAE tích cực triển khai chính sách ""Hướng Đông"", coi trọng quan hệ với các nước châu Á, trong đó có Việt Nam.","2024-10-27T10:49:41.000Z",,4,137,"{""type"":""Like"",""num"":5374}","Thông tin Chính phủ","100064643681682","Cập nhật tới đồng bào về hoạt động, chỉ đạo điều hành của Chính phủ, Thủ tướng Chính phủ và các thông tin quan trọng khác","Government organization","https://scontent.fsof10-1.fna.fbcdn.net/v/t39.30808-1/452958737_925975866233861_1316250170357088183_n.jpg?stp=dst-jpg_s200x200_tt6&_nc_cat=1&ccb=1-7&_nc_sid=2d3e12&_nc_ohc=2EReX7b7AV4Q7kNvgGIA4mT&_nc_oc=Adhng_rIcRkfuWN-nIOCAoXvYQmRhsh3-2O_taUo7-imm62c1sRyQEN_AVookvvdqTg&_nc_zt=24&_nc_ht=scontent.fsof10-1.fna&_nc_gid=Arjea6bqj3ZPzC7OYvyS5Hr&oh=00_AYEIwHAR9pnKB45s7I8UQJZ-kdjM31IUrhj-X7bzBed6KQ&oe=67D60986",,,6200000,false,,,,,,,"https://www.facebook.com/thongtinchinhphu","https://scontent.fsof10-1.fna.fbcdn.net/v/t39.30808-6/459177468_957930123038435_2430169465116552305_n.jpg?stp=dst-jpg_s960x960_tt6&_nc_cat=111&ccb=1-7&_nc_sid=cc71e4&_nc_ohc=CysjJ0ZKmr4Q7kNvgEyU4tN&_nc_oc=AdgK_efR5RsaG0-s4TtlAqj1J1WnWNhSmqByiWiGxgeLVkVVqMJWQBJcZLmLpvo-kpo&_nc_zt=23&_nc_ht=scontent.fsof10-1.fna&_nc_gid=Arjea6bqj3ZPzC7OYvyS5Hr&oh=00_AYHaxUpb2KPyLxBPzQuLs09qYWGL8qWpUfqWxhqvPcTsYw&oe=67D624F7","https://scontent.fsof10-1.fna.fbcdn.net/v/t39.30808-1/452958737_925975866233861_1316250170357088183_n.jpg?stp=dst-jpg_s200x200_tt6&_nc_cat=1&ccb=1-7&_nc_sid=2d3e12&_nc_ohc=2EReX7b7AV4Q7kNvgGIA4mT&_nc_oc=Adhng_rIcRkfuWN-nIOCAoXvYQmRhsh3-2O_taUo7-imm62c1sRyQEN_AVookvvdqTg&_nc_zt=24&_nc_ht=scontent.fsof10-1.fna&_nc_gid=Arjea6bqj3ZPzC7OYvyS5Hr&oh=00_AYEIwHAR9pnKB45s7I8UQJZ-kdjM31IUrhj-X7bzBed6KQ&oe=67D60986","thongtinchinhphu",,false,,"994133069418140",,6200,,,,,,,"Post",,,,,"[{""type"":""Like"",""reaction_count"":5374},{""type"":""Love"",""reaction_count"":798},{""type"":""Care"",""reaction_count"":22},{""type"":""Haha"",""reaction_count"":3},{""type"":""Wow"",""reaction_count"":3}]",true,,,,"2015-10-01T00:00:00.000Z",,,,"2025-03-11T14:48:39.501Z","{""url"":""https://www.facebook.com/thongtinchinhphu"",""num_of_posts"":"""",""start_date"":""2024-10-01T15:14:41.000Z"",""end_date"":""2024-10-27T15:14:41.000Z""}",,,,
"https://www.facebook.com/thongtinchinhphu/posts/pfbid02tjRAxqnoGtSoiD4mYBTnftEC95ggzgrysG5KGFZeAmUQxHR8x59zZiXhGAYpacP3l","994037159427731","https://www.facebook.com/thongtinchinhphu","Thông tin Chính phủ","🟢
NGƯỜI DÂN THỪA THIÊN HUẾ ĐƯỢC ĐI LẠI BÌNH THƯỜNG TỪ BÂY GIỜ (15 GIỜ)

⚠️ Tuy nhiên, bão chưa tan hẳn, khuyến cáo mọi người chủ động nâng cao cảnh giác, chủ động tránh trú đảm bảo an toàn khi có tình huống gió mạnh!

---
📝 Ban Chỉ huy PCTT&TKCN Thừa Thiên Huế","2024-10-27T08:00:08.000Z",,31,88,"{""type"":""Like"",""num"":5187}","Thông tin Chính phủ","100064643681682","Cập nhật tới đồng bào về hoạt động, chỉ đạo điều hành của Chính phủ, Thủ tướng Chính phủ và các thông tin quan trọng khác","Government organization","https://scontent.fsof10-1.fna.fbcdn.net/v/t39.30808-1/452958737_925975866233861_1316250170357088183_n.jpg?stp=dst-jpg_s200x200_tt6&_nc_cat=1&ccb=1-7&_nc_sid=2d3e12&_nc_ohc=2EReX7b7AV4Q7kNvgGIA4mT&_nc_oc=Adhng_rIcRkfuWN-nIOCAoXvYQmRhsh3-2O_taUo7-imm62c1sRyQEN_AVookvvdqTg&_nc_zt=24&_nc_ht=scontent.fsof10-1.fna&_nc_gid=Arjea6bqj3ZPzC7OYvyS5Hr&oh=00_AYEIwHAR9pnKB45s7I8UQJZ-kdjM31IUrhj-X7bzBed6KQ&oe=67D60986",,,6200000,false,,,,,,,"https://www.facebook.com/thongtinchinhphu","https://scontent.fsof10-1.fna.fbcdn.net/v/t39.30808-6/459177468_957930123038435_2430169465116552305_n.jpg?stp=dst-jpg_s960x960_tt6&_nc_cat=111&ccb=1-7&_nc_sid=cc71e4&_nc_ohc=CysjJ0ZKmr4Q7kNvgEyU4tN&_nc_oc=AdgK_efR5RsaG0-s4TtlAqj1J1WnWNhSmqByiWiGxgeLVkVVqMJWQBJcZLmLpvo-kpo&_nc_zt=23&_nc_ht=scontent.fsof10-1.fna&_nc_gid=Arjea6bqj3ZPzC7OYvyS5Hr&oh=00_AYHaxUpb2KPyLxBPzQuLs09qYWGL8qWpUfqWxhqvPcTsYw&oe=67D624F7","https://scontent.fsof10-1.fna.fbcdn.net/v/t39.30808-1/452958737_925975866233861_1316250170357088183_n.jpg?stp=dst-jpg_s200x200_tt6&_nc_cat=1&ccb=1-7&_nc_sid=2d3e12&_nc_ohc=2EReX7b7AV4Q7kNvgGIA4mT&_nc_oc=Adhng_rIcRkfuWN-nIOCAoXvYQmRhsh3-2O_taUo7-imm62c1sRyQEN_AVookvvdqTg&_nc_zt=24&_nc_ht=scontent.fsof10-1.fna&_nc_gid=Arjea6bqj3ZPzC7OYvyS5Hr&oh=00_AYEIwHAR9pnKB45s7I8UQJZ-kdjM31IUrhj-X7bzBed6KQ&oe=67D60986","thongtinchinhphu",,false,,"994037159427731",,5385,,,,,,,"Post",,,,,"[{""type"":""Like"",""reaction_count"":5187},{""type"":""Love"",""reaction_count"":163},{""type"":""Care"",""reaction_count"":27},{""type"":""Sad"",""reaction_count"":6},{""type"":""Haha"",""reaction_count"":1},{""type"":""Wow"",""reaction_count"":1}]",true,,,,"2015-10-01T00:00:00.000Z",,,,"2025-03-11T14:48:39.501Z","{""url"":""https://www.facebook.com/thongtinchinhphu"",""num_of_posts"":"""",""start_date"":""2024-10-01T15:14:41.000Z"",""end_date"":""2024-10-27T15:14:41.000Z""}",,,,
