"url","post_id","user_url","user_username_raw","content","date_posted","hashtags","num_comments","num_shares","num_likes_type","page_name","profile_id","page_intro","page_category","page_logo","page_external_website","page_likes","page_followers","page_is_verified","original_post","attachments","other_posts_url","post_external_link","post_external_title","post_external_image","page_url","header_image","avatar_image_url","profile_handle","has_handshake","is_sponsored","sponsor_name","shortcode","video_view_count","likes","days_range","num_of_posts","post_image","posts_to_not_include","until_date","from_date","post_type","following","start_date","end_date","link_description_text","count_reactions_type","is_page","include_profile_data","page_phone","page_email","page_creation_time","page_reviews_score","page_reviewers_amount","page_price_range","timestamp","input","error","error_code","warning","warning_code"
"https://www.facebook.com/thongtinchinhphu/posts/pfbid02Whf7qvUMq8o8Qtxs56aHgFUuTqtDf92KT8x3ZNRDS41FxBLzuu1a3AkSNyXFPt3al","928440529320728","https://www.facebook.com/thongtinchinhphu","Thông tin Chính phủ","🇻🇳 ✈ 🇮🇳 Tối nay, Thủ tướng Phạm Minh Chính lên đường thăm cấp Nhà nước tới Ấn Độ","2024-07-30T14:14:03.000Z",,1,76,"{""type"":""Like"",""num"":11174}","Thông tin Chính phủ","100064643681682","Cập nhật tới đồng bào về hoạt động, chỉ đạo điều hành của Chính phủ, Thủ tướng Chính phủ và các thông tin quan trọng khác","Government organization","https://scontent-waw2-1.xx.fbcdn.net/v/t39.30808-1/452958737_925975866233861_1316250170357088183_n.jpg?stp=dst-jpg_s200x200_tt6&_nc_cat=1&ccb=1-7&_nc_sid=2d3e12&_nc_ohc=3Fz2WR_ktWkQ7kNvgEq23c8&_nc_oc=Adh6qGz37dU0ytn-ezvU3zy0GjThqMQAeRI3K0bdqYPNd1d3bgxD-ZjNdeXXWHrvbS4&_nc_zt=24&_nc_ht=scontent-waw2-1.xx&_nc_gid=AAaZl2rODU-4RM_IxMmFv1R&oh=00_AYGBDBopSYfepfZoNg0ehIzgSC6GJrejfe5qwLpOUs74Lg&oe=67D36686",,,6200000,false,,,,,,,"https://www.facebook.com/thongtinchinhphu","https://scontent-waw2-1.xx.fbcdn.net/v/t39.30808-6/459177468_957930123038435_2430169465116552305_n.jpg?stp=dst-jpg_s960x960_tt6&_nc_cat=111&ccb=1-7&_nc_sid=cc71e4&_nc_ohc=t51uFdKKVqQQ7kNvgFQh4PX&_nc_oc=AdgnchIZRkOF0WXKLi_AOADSdk58kd3ktewhxfQAPNvl_eNNiPXShHfA9VXj_V7YuBE&_nc_zt=23&_nc_ht=scontent-waw2-1.xx&_nc_gid=AAaZl2rODU-4RM_IxMmFv1R&oh=00_AYEz92C1NVAcJzsDFlXrVOBzS7qJ0ux_JVBx7PzRu4h8yQ&oe=67D349B7","https://scontent-waw2-1.xx.fbcdn.net/v/t39.30808-1/452958737_925975866233861_1316250170357088183_n.jpg?stp=dst-jpg_s200x200_tt6&_nc_cat=1&ccb=1-7&_nc_sid=2d3e12&_nc_ohc=3Fz2WR_ktWkQ7kNvgEq23c8&_nc_oc=Adh6qGz37dU0ytn-ezvU3zy0GjThqMQAeRI3K0bdqYPNd1d3bgxD-ZjNdeXXWHrvbS4&_nc_zt=24&_nc_ht=scontent-waw2-1.xx&_nc_gid=AAaZl2rODU-4RM_IxMmFv1R&oh=00_AYGBDBopSYfepfZoNg0ehIzgSC6GJrejfe5qwLpOUs74Lg&oe=67D36686","thongtinchinhphu",,false,,"928440529320728",,13153,,,,,,,"Post",,,,,"[{""type"":""Like"",""reaction_count"":11174},{""type"":""Love"",""reaction_count"":1900},{""type"":""Care"",""reaction_count"":64},{""type"":""Wow"",""reaction_count"":9},{""type"":""Haha"",""reaction_count"":5},{""type"":""Angry"",""reaction_count"":1}]",true,,,,"2015-10-01T00:00:00.000Z",,,,"2025-03-09T12:01:00.387Z","{""url"":""https://www.facebook.com/thongtinchinhphu"",""num_of_posts"":200,""end_date"":""2024-07-30T15:46:39.000Z"",""start_date"":""""}",,,,
"https://www.facebook.com/thongtinchinhphu/posts/pfbid0Sgc2QemU86JbDpcE5f44Uuq5dWZkVMrQcYKXP6cBs1TbLAnrJPkKvGZ8UGRdngwxl","928383975993050","https://www.facebook.com/thongtinchinhphu","Thông tin Chính phủ","✍👩‍🎓 Hơn 733.000 thí sinh đăng ký xét tuyển trên Hệ thống của Bộ GDĐT","2024-07-30T12:29:11.000Z",,2,22,"{""type"":""Like"",""num"":1348}","Thông tin Chính phủ","100064643681682","Cập nhật tới đồng bào về hoạt động, chỉ đạo điều hành của Chính phủ, Thủ tướng Chính phủ và các thông tin quan trọng khác","Government organization","https://scontent-waw2-1.xx.fbcdn.net/v/t39.30808-1/452958737_925975866233861_1316250170357088183_n.jpg?stp=dst-jpg_s200x200_tt6&_nc_cat=1&ccb=1-7&_nc_sid=2d3e12&_nc_ohc=3Fz2WR_ktWkQ7kNvgEq23c8&_nc_oc=Adh6qGz37dU0ytn-ezvU3zy0GjThqMQAeRI3K0bdqYPNd1d3bgxD-ZjNdeXXWHrvbS4&_nc_zt=24&_nc_ht=scontent-waw2-1.xx&_nc_gid=AAaZl2rODU-4RM_IxMmFv1R&oh=00_AYGBDBopSYfepfZoNg0ehIzgSC6GJrejfe5qwLpOUs74Lg&oe=67D36686",,,6200000,false,,"[{""id"":""928383899326391"",""type"":""Photo"",""url"":""https://scontent-waw2-2.xx.fbcdn.net/v/t39.30808-6/453263572_928383895993058_3604886364446844332_n.jpg?stp=dst-jpg_s720x720_tt6&_nc_cat=105&ccb=1-7&_nc_sid=127cfc&_nc_ohc=W-z7-nOhwMwQ7kNvgFEo702&_nc_oc=AdgIkHAxnb5UQahGT7aOfJlSWKNyNEsA3eLwT6mIGVk5EGVwM8xLeopysZ6XR5Kb44U&_nc_zt=23&_nc_ht=scontent-waw2-2.xx&_nc_gid=AH7fUHEjKhpA7k6v7sFAvH0&oh=00_AYF72iCSQOjbo0rzumoJMIXCDl81NbwlF1my-DKiijhEhw&oe=67D3650C"",""video_url"":null}]",,,,,"https://www.facebook.com/thongtinchinhphu","https://scontent-waw2-1.xx.fbcdn.net/v/t39.30808-6/459177468_957930123038435_2430169465116552305_n.jpg?stp=dst-jpg_s960x960_tt6&_nc_cat=111&ccb=1-7&_nc_sid=cc71e4&_nc_ohc=t51uFdKKVqQQ7kNvgFQh4PX&_nc_oc=AdgnchIZRkOF0WXKLi_AOADSdk58kd3ktewhxfQAPNvl_eNNiPXShHfA9VXj_V7YuBE&_nc_zt=23&_nc_ht=scontent-waw2-1.xx&_nc_gid=AAaZl2rODU-4RM_IxMmFv1R&oh=00_AYEz92C1NVAcJzsDFlXrVOBzS7qJ0ux_JVBx7PzRu4h8yQ&oe=67D349B7","https://scontent-waw2-1.xx.fbcdn.net/v/t39.30808-1/452958737_925975866233861_1316250170357088183_n.jpg?stp=dst-jpg_s200x200_tt6&_nc_cat=1&ccb=1-7&_nc_sid=2d3e12&_nc_ohc=3Fz2WR_ktWkQ7kNvgEq23c8&_nc_oc=Adh6qGz37dU0ytn-ezvU3zy0GjThqMQAeRI3K0bdqYPNd1d3bgxD-ZjNdeXXWHrvbS4&_nc_zt=24&_nc_ht=scontent-waw2-1.xx&_nc_gid=AAaZl2rODU-4RM_IxMmFv1R&oh=00_AYGBDBopSYfepfZoNg0ehIzgSC6GJrejfe5qwLpOUs74Lg&oe=67D36686","thongtinchinhphu",,false,,"928383975993050",,1467,,,"https://scontent-waw2-2.xx.fbcdn.net/v/t39.30808-6/453263572_928383895993058_3604886364446844332_n.jpg?stp=dst-jpg_s720x720_tt6&_nc_cat=105&ccb=1-7&_nc_sid=127cfc&_nc_ohc=W-z7-nOhwMwQ7kNvgFEo702&_nc_oc=AdgIkHAxnb5UQahGT7aOfJlSWKNyNEsA3eLwT6mIGVk5EGVwM8xLeopysZ6XR5Kb44U&_nc_zt=23&_nc_ht=scontent-waw2-2.xx&_nc_gid=AH7fUHEjKhpA7k6v7sFAvH0&oh=00_AYF72iCSQOjbo0rzumoJMIXCDl81NbwlF1my-DKiijhEhw&oe=67D3650C",,,,"Post",,,,,"[{""type"":""Like"",""reaction_count"":1348},{""type"":""Love"",""reaction_count"":106},{""type"":""Care"",""reaction_count"":8},{""type"":""Wow"",""reaction_count"":3},{""type"":""Sad"",""reaction_count"":2}]",true,,,,"2015-10-01T00:00:00.000Z",,,,"2025-03-09T12:01:00.387Z","{""url"":""https://www.facebook.com/thongtinchinhphu"",""num_of_posts"":200,""end_date"":""2024-07-30T15:46:39.000Z"",""start_date"":""""}",,,,
"https://www.facebook.com/thongtinchinhphu/posts/pfbid0MueXcgm1mxYjfw2m67vMLQFVYb92PNN1yw79fens7CPD8UqUaPKZ64Y4K5S5gcZAl","928490652649049","https://www.facebook.com/thongtinchinhphu","Thông tin Chính phủ","🇪🇺🤝🇻🇳 Chủ tịch nước Tô Lâm cảm ơn  Phó Chủ tịch Ủy ban Châu Âu (EC), Đại diện cấp cao của Liên minh Châu Âu (EU) về Chính sách đối ngoại và an ninh, ông Josep Borrell Fontelles đã đến dự Lễ quốc tang Tổng Bí thư Nguyễn Phú Trọng, thể hiện sự coi trọng của EU đối với những công lao to lớn của Tổng Bí thư đối với việc thúc đẩy quan hệ Việt Nam - EU thời gian qua.

Chủ tịch nước chúc mừng EU đã bầu Ban lãnh đạo mới, bày tỏ tin tưởng chuyến thăm của ông Josep Borrell sẽ tạo đà quan trọng thúc đẩy mạnh mẽ quan hệ Việt Nam - EU, đánh giá cao những đóng góp của ông cho quan hệ hai bên trong thời gian là Chủ tịch Nghị viện châu Âu nhiệm kỳ 2004 - 2007.

Khẳng định EU là đối tác rất quan trọng của Việt Nam, Chủ tịch nước bày tỏ hài lòng nhận thấy quan hệ giữa Việt Nam với EU thời gian qua phát triển tích cực, thể hiện qua việc hai bên tăng cường trao đổi đoàn, tiếp xúc cấp cao; triển khai hiệu quả nhiều thỏa thuận và cơ chế hợp tác, đối thoại. 

Hiệp định Thương mại tự do Việt Nam - EU (EVFTA) sau 4 năm thực thi đã tạo sức bật mới cho thương mại - đầu tư, đưa Việt Nam trở thành đối tác thương mại lớn nhất của EU trong số các nước ASEAN. Hợp tác du lịch, giáo dục - đào tạo, văn hóa - nghệ thuật và giao lưu nhân dân cũng rất sôi động, góp phần tăng cường sự hiểu biết lẫn nhau, qua đó thúc đẩy hợp tác trên các lĩnh vực khác.

Chủ tịch nước đề nghị hai bên tiếp tục đẩy mạnh trao đổi đoàn, nhất là cấp cao; triển khai hiệu quả Hiệp định Đối tác và Hợp tác toàn diện Việt Nam - EU (PCA), Hiệp định EVFTA cũng như các thỏa thuận, cơ chế hợp tác khác. 

Chủ tịch nước cũng đề nghị EU thúc đẩy các nước thành viên còn lại sớm phê chuẩn Hiệp định Bảo hộ đầu tư Việt Nam - EU (EVIPA); sớm gỡ bỏ “thẻ vàng” đối với xuất khẩu hải sản của Việt Nam trên cơ sở ghi nhận những nỗ lực và kết quả đạt được của Việt Nam trong phòng, chống khai thác hải sản trái phép, không khai báo và không đúng quy định (IUU); tiếp tục duy trì ODA cho Việt Nam, hỗ trợ Việt Nam triển khai hiệu quả Đối tác chuyển đổi năng lượng công bằng (JETP); tăng cường hợp tác về an ninh mạng, an ninh biển, phòng, chống thiên tai, khủng hoảng, phòng, chống tội phạm.

Hoan nghênh các chiến lược, sáng kiến hợp tác với khu vực Ấn Độ Dương - Thái Bình Dương của EU, Chủ tịch nước khẳng định Việt Nam sẵn sàng làm cầu nối của EU với khu vực, trong đó có việc tăng cường quan hệ Đối tác chiến lược ASEAN - EU.

Đại diện cấp cao chúc mừng Chủ tịch nước Tô Lâm được Quốc hội Việt Nam bầu giữ chức Chủ tịch nước; bày tỏ ấn tượng trước những thành tựu Đổi mới của Việt Nam; đánh giá cao Việt Nam có chính sách đối ngoại cân bằng, ủng hộ các mục tiêu phát triển của Việt Nam trở thành nước phát triển, thu nhập cao vào năm 2045 và trung hòa các-bon vào năm 2050. 

Khẳng định EU coi Việt Nam là đối tác hàng đầu tại khu vực, một trong những chủ thể quan trọng của quan hệ quốc tế hiện tại và trong tương lai, ông Borell cho biết EU đang triển khai mạnh mẽ một số chiến lược, sáng kiến hợp tác, trong đó có các dự án hợp tác với ASEAN và tại Việt Nam trong khuôn khổ Sáng kiến Cửa ngõ Toàn cầu của EU, mong muốn nâng cấp quan hệ Việt Nam - EU lên tầm cao mới.

Thông tin về tình hình Việt Nam, Chủ tịch nước nhấn mạnh những thành tựu kinh tế - xã hội của Việt Nam là phục vụ người dân; khẳng định Nhà nước Việt Nam coi con người là trung tâm, động lực phát triển kinh tế - xã hội bền vững; chính quyền là của dân, do dân và vì dân; mọi người dân ở Việt Nam được bảo đảm quyền tự do tôn giáo, tín ngưỡng và không tôn giáo, tín ngưỡng, được tiếp cận rộng rãi Internet, mạng xã hội…

Nhất trí với các đánh giá và đề nghị của Chủ tịch nước Tô Lâm, ông Josep Borrell bày tỏ tin tưởng, dưới sự quan tâm chỉ đạo của Chủ tịch nước, quan hệ Việt Nam - EU sẽ ngày càng phát triển mạnh mẽ, sâu rộng, vì lợi ích của cả hai bên.

Trao đổi các vấn đề quốc tế và khu vực, hai bên nhất trí các quốc gia cần có trách nhiệm đóng góp vào an ninh và phát triển ở khu vực và trên thế giới; các cuộc xung đột cần được giải quyết bằng các biện pháp hòa bình trên cơ sở luật pháp quốc tế và Hiến chương LHQ. Về vấn đề Biển Đông, Đại diện cấp cao EU nhấn mạnh vai trò quan trọng của Biển Đông trong thương mại quốc tế; hai bên khẳng định tiếp tục ủng hộ bảo đảm an ninh, an toàn và tự do hàng hải và hàng không, giải quyết các tranh chấp trên Biển Đông bằng biện pháp hòa bình, phù hợp với luật pháp quốc tế, đặc biệt là UNCLOS 1982, góp phần củng cố hòa bình, ổn định và thịnh vượng của khu vực.

---
✍️📸 VPCTN","2024-07-30T15:46:39.000Z",,0,50,"{""type"":""Like"",""num"":3246}","Thông tin Chính phủ","100064643681682","Cập nhật tới đồng bào về hoạt động, chỉ đạo điều hành của Chính phủ, Thủ tướng Chính phủ và các thông tin quan trọng khác","Government organization","https://scontent-waw2-1.xx.fbcdn.net/v/t39.30808-1/452958737_925975866233861_1316250170357088183_n.jpg?stp=dst-jpg_s200x200_tt6&_nc_cat=1&ccb=1-7&_nc_sid=2d3e12&_nc_ohc=3Fz2WR_ktWkQ7kNvgEq23c8&_nc_oc=Adh6qGz37dU0ytn-ezvU3zy0GjThqMQAeRI3K0bdqYPNd1d3bgxD-ZjNdeXXWHrvbS4&_nc_zt=24&_nc_ht=scontent-waw2-1.xx&_nc_gid=AAaZl2rODU-4RM_IxMmFv1R&oh=00_AYGBDBopSYfepfZoNg0ehIzgSC6GJrejfe5qwLpOUs74Lg&oe=67D36686",,,6200000,false,,"[{""id"":""928490262649088"",""type"":""Photo"",""url"":""https://scontent-waw2-1.xx.fbcdn.net/v/t39.30808-6/453182938_928490259315755_479076083180476821_n.jpg?_nc_cat=109&ccb=1-7&_nc_sid=127cfc&_nc_ohc=rSCILOTj3lAQ7kNvgHYQJjg&_nc_oc=AdgDkkgy7mwDQPA3mRukELpIfqkJ8HaYuEK1_9BQF7g6pbKOqJpJzoTdpAr1CA6h38k&_nc_zt=23&_nc_ht=scontent-waw2-1.xx&_nc_gid=AH7fUHEjKhpA7k6v7sFAvH0&oh=00_AYFTp3hOctombIrQKPWHUwJLzqW6xdtfqzmS1biwt3jJpw&oe=67D34051"",""attachment_url"":""https://www.facebook.com/photo.php?fbid=928490262649088&set=a.249070910591030&type=3"",""video_url"":null},{""id"":""928490555982392"",""type"":""Photo"",""url"":""https://scontent-waw2-1.xx.fbcdn.net/v/t39.30808-6/453292539_928490552649059_3206097213386133637_n.jpg?_nc_cat=108&ccb=1-7&_nc_sid=127cfc&_nc_ohc=-orVzSwokV0Q7kNvgEfGgQ1&_nc_oc=Adi90Z4_yBwwzJAmbFFV1BhwCli8aiuXRkNUMlNVvd64BCxgWLBkYJ6Wu1zFMxEiWlY&_nc_zt=23&_nc_ht=scontent-waw2-1.xx&_nc_gid=AH7fUHEjKhpA7k6v7sFAvH0&oh=00_AYEuabbgJ1nApxSfFNVr5KfuvMtrnBHvIGKzFt_q7MKWFQ&oe=67D34015"",""attachment_url"":""https://www.facebook.com/photo.php?fbid=928490555982392&set=a.249070910591030&type=3"",""video_url"":null},{""id"":""928488219315959"",""type"":""Photo"",""url"":""https://scontent-waw2-2.xx.fbcdn.net/v/t39.30808-6/453536190_928488215982626_7137329799987359205_n.jpg?_nc_cat=102&ccb=1-7&_nc_sid=127cfc&_nc_ohc=uIro2wLf00EQ7kNvgFECAaP&_nc_oc=AdivBo6a9uP6RmuiLniL_n9rQ43p6r5xvTNqgtlYwglNiBc8bNl8z1Z8T1_xYWTG6EA&_nc_zt=23&_nc_ht=scontent-waw2-2.xx&_nc_gid=AH7fUHEjKhpA7k6v7sFAvH0&oh=00_AYEQ0MKuV9xCd3FVAsBz5r4X_zgme-bpQrH8LusTJGm5rQ&oe=67D34DC5"",""attachment_url"":""https://www.facebook.com/photo.php?fbid=928488219315959&set=a.249070910591030&type=3"",""video_url"":null}]",,,,,"https://www.facebook.com/thongtinchinhphu","https://scontent-waw2-1.xx.fbcdn.net/v/t39.30808-6/459177468_957930123038435_2430169465116552305_n.jpg?stp=dst-jpg_s960x960_tt6&_nc_cat=111&ccb=1-7&_nc_sid=cc71e4&_nc_ohc=t51uFdKKVqQQ7kNvgFQh4PX&_nc_oc=AdgnchIZRkOF0WXKLi_AOADSdk58kd3ktewhxfQAPNvl_eNNiPXShHfA9VXj_V7YuBE&_nc_zt=23&_nc_ht=scontent-waw2-1.xx&_nc_gid=AAaZl2rODU-4RM_IxMmFv1R&oh=00_AYEz92C1NVAcJzsDFlXrVOBzS7qJ0ux_JVBx7PzRu4h8yQ&oe=67D349B7","https://scontent-waw2-1.xx.fbcdn.net/v/t39.30808-1/452958737_925975866233861_1316250170357088183_n.jpg?stp=dst-jpg_s200x200_tt6&_nc_cat=1&ccb=1-7&_nc_sid=2d3e12&_nc_ohc=3Fz2WR_ktWkQ7kNvgEq23c8&_nc_oc=Adh6qGz37dU0ytn-ezvU3zy0GjThqMQAeRI3K0bdqYPNd1d3bgxD-ZjNdeXXWHrvbS4&_nc_zt=24&_nc_ht=scontent-waw2-1.xx&_nc_gid=AAaZl2rODU-4RM_IxMmFv1R&oh=00_AYGBDBopSYfepfZoNg0ehIzgSC6GJrejfe5qwLpOUs74Lg&oe=67D36686","thongtinchinhphu",,false,,"928490652649049",,3660,,,"https://scontent-waw2-1.xx.fbcdn.net/v/t39.30808-6/453182938_928490259315755_479076083180476821_n.jpg?_nc_cat=109&ccb=1-7&_nc_sid=127cfc&_nc_ohc=rSCILOTj3lAQ7kNvgHYQJjg&_nc_oc=AdgDkkgy7mwDQPA3mRukELpIfqkJ8HaYuEK1_9BQF7g6pbKOqJpJzoTdpAr1CA6h38k&_nc_zt=23&_nc_ht=scontent-waw2-1.xx&_nc_gid=AH7fUHEjKhpA7k6v7sFAvH0&oh=00_AYFTp3hOctombIrQKPWHUwJLzqW6xdtfqzmS1biwt3jJpw&oe=67D34051",,,,"Post",,,,,"[{""type"":""Like"",""reaction_count"":3246},{""type"":""Love"",""reaction_count"":393},{""type"":""Care"",""reaction_count"":15},{""type"":""Wow"",""reaction_count"":3},{""type"":""Haha"",""reaction_count"":2},{""type"":""Sad"",""reaction_count"":1}]",true,,,,"2015-10-01T00:00:00.000Z",,,,"2025-03-09T12:01:00.387Z","{""url"":""https://www.facebook.com/thongtinchinhphu"",""num_of_posts"":200,""end_date"":""2024-07-30T15:46:39.000Z"",""start_date"":""""}",,,,
"https://www.facebook.com/thongtinchinhphu/posts/pfbid0Sgc2QemU86JbDpcE5f44Uuq5dWZkVMrQcYKXP6cBs1TbLAnrJPkKvGZ8UGRdngwxl","928383975993050","https://www.facebook.com/thongtinchinhphu","Thông tin Chính phủ","✍👩‍🎓 Hơn 733.000 thí sinh đăng ký xét tuyển trên Hệ thống của Bộ GDĐT","2024-07-30T12:29:11.000Z",,2,22,"{""type"":""Like"",""num"":1348}","Thông tin Chính phủ","100064643681682","Cập nhật tới đồng bào về hoạt động, chỉ đạo điều hành của Chính phủ, Thủ tướng Chính phủ và các thông tin quan trọng khác","Government organization","https://scontent.fmvd3-1.fna.fbcdn.net/v/t39.30808-1/452958737_925975866233861_1316250170357088183_n.jpg?stp=dst-jpg_s200x200_tt6&_nc_cat=111&ccb=1-7&_nc_sid=2d3e12&_nc_ohc=3Fz2WR_ktWkQ7kNvgHirE0U&_nc_oc=AdiGO6kwe068JoesFvXVgER1F9P_toaRLNZ58MCS3mzJHbhmD1C72ByqEgUGqGbeFD0&_nc_zt=24&_nc_ht=scontent.fmvd3-1.fna&_nc_gid=AxUiL4TDfc0d4u5E2ehHqDt&oh=00_AYF3rBiavaR19rYIAUslmdmn4pvJ-4hBJ0mm5DjQfyuNFA&oe=67D36686",,,6200000,false,,"[{""id"":""928383899326391"",""type"":""Photo"",""url"":""https://scontent.fmvd3-1.fna.fbcdn.net/v/t39.30808-6/453263572_928383895993058_3604886364446844332_n.jpg?stp=dst-jpg_s720x720_tt6&_nc_cat=105&ccb=1-7&_nc_sid=127cfc&_nc_ohc=W-z7-nOhwMwQ7kNvgEcDyig&_nc_oc=AdgljRTy4XG2_CqSf2E-411rEzOT_h6UpZ6HOekV23U0ygkRPLSqjtAOlFAt3MOOwCY&_nc_zt=23&_nc_ht=scontent.fmvd3-1.fna&_nc_gid=Ap3dXzfxe6tfM4QR2wb_sur&oh=00_AYFeqLJ15u77U2Uhyzj2Oz2u7haIxbiDb-nvD2qjoszs-w&oe=67D3650C"",""video_url"":null}]",,,,,"https://www.facebook.com/thongtinchinhphu","https://scontent.fmvd3-1.fna.fbcdn.net/v/t39.30808-6/459177468_957930123038435_2430169465116552305_n.jpg?stp=dst-jpg_s960x960_tt6&_nc_cat=111&ccb=1-7&_nc_sid=cc71e4&_nc_ohc=t51uFdKKVqQQ7kNvgHMijBZ&_nc_oc=AdgAaV2zF6K6ArVzGcXdwMGiOSmsXl0S3JTisXVJeXldNKz-2NWB7bqup8o7hjp02Mw&_nc_zt=23&_nc_ht=scontent.fmvd3-1.fna&_nc_gid=AxUiL4TDfc0d4u5E2ehHqDt&oh=00_AYFw3xEgtuiGZNPSu_Dbt96JjX06oLnLXVbGskmdSbg7AA&oe=67D349B7","https://scontent.fmvd3-1.fna.fbcdn.net/v/t39.30808-1/452958737_925975866233861_1316250170357088183_n.jpg?stp=dst-jpg_s200x200_tt6&_nc_cat=111&ccb=1-7&_nc_sid=2d3e12&_nc_ohc=3Fz2WR_ktWkQ7kNvgHirE0U&_nc_oc=AdiGO6kwe068JoesFvXVgER1F9P_toaRLNZ58MCS3mzJHbhmD1C72ByqEgUGqGbeFD0&_nc_zt=24&_nc_ht=scontent.fmvd3-1.fna&_nc_gid=AxUiL4TDfc0d4u5E2ehHqDt&oh=00_AYF3rBiavaR19rYIAUslmdmn4pvJ-4hBJ0mm5DjQfyuNFA&oe=67D36686","thongtinchinhphu",,false,,"928383975993050",,1467,,,"https://scontent.fmvd3-1.fna.fbcdn.net/v/t39.30808-6/453263572_928383895993058_3604886364446844332_n.jpg?stp=dst-jpg_s720x720_tt6&_nc_cat=105&ccb=1-7&_nc_sid=127cfc&_nc_ohc=W-z7-nOhwMwQ7kNvgEcDyig&_nc_oc=AdgljRTy4XG2_CqSf2E-411rEzOT_h6UpZ6HOekV23U0ygkRPLSqjtAOlFAt3MOOwCY&_nc_zt=23&_nc_ht=scontent.fmvd3-1.fna&_nc_gid=Ap3dXzfxe6tfM4QR2wb_sur&oh=00_AYFeqLJ15u77U2Uhyzj2Oz2u7haIxbiDb-nvD2qjoszs-w&oe=67D3650C",,,,"Post",,,,,"[{""type"":""Like"",""reaction_count"":1348},{""type"":""Love"",""reaction_count"":106},{""type"":""Care"",""reaction_count"":8},{""type"":""Wow"",""reaction_count"":3},{""type"":""Sad"",""reaction_count"":2}]",true,,,,"2015-10-01T00:00:00.000Z",,,,"2025-03-09T12:03:09.663Z","{""url"":""https://www.facebook.com/thongtinchinhphu"",""num_of_posts"":200,""end_date"":""2024-07-30T15:46:39.000Z"",""start_date"":""""}",,,,
"https://www.facebook.com/thongtinchinhphu/posts/pfbid0TCXbJBZiViksAYBpZ7ykc1EQT1wkehA6qzdHPMUc8n73hzTKk2mEH6WnCnVpgv7Xl","928292462668868","https://www.facebook.com/thongtinchinhphu","Thông tin Chính phủ","🛑 PHÚ THỌ CHÚ Ý!","2024-07-30T09:17:04.000Z",,1,55,"{""type"":""Like"",""num"":1711}","Thông tin Chính phủ","100064643681682","Cập nhật tới đồng bào về hoạt động, chỉ đạo điều hành của Chính phủ, Thủ tướng Chính phủ và các thông tin quan trọng khác","Government organization","https://scontent.fmvd3-1.fna.fbcdn.net/v/t39.30808-1/452958737_925975866233861_1316250170357088183_n.jpg?stp=dst-jpg_s200x200_tt6&_nc_cat=111&ccb=1-7&_nc_sid=2d3e12&_nc_ohc=3Fz2WR_ktWkQ7kNvgHirE0U&_nc_oc=AdiGO6kwe068JoesFvXVgER1F9P_toaRLNZ58MCS3mzJHbhmD1C72ByqEgUGqGbeFD0&_nc_zt=24&_nc_ht=scontent.fmvd3-1.fna&_nc_gid=AxUiL4TDfc0d4u5E2ehHqDt&oh=00_AYF3rBiavaR19rYIAUslmdmn4pvJ-4hBJ0mm5DjQfyuNFA&oe=67D36686",,,6200000,false,,"[{""id"":""928292416002206"",""type"":""Photo"",""url"":""https://scontent.fmvd3-1.fna.fbcdn.net/v/t39.30808-6/453485634_928292412668873_3244268306468570583_n.jpg?stp=dst-jpg_s600x600_tt6&_nc_cat=102&ccb=1-7&_nc_sid=127cfc&_nc_ohc=07el3-SflS4Q7kNvgGjCFso&_nc_oc=Adhy_L7XLEMUZqIGSsV1yibo-l9aseUA98YJo886jfED-sp4V8xvfXjZXKWetDE5mRo&_nc_zt=23&_nc_ht=scontent.fmvd3-1.fna&_nc_gid=AjIlRjxwfC0o_huKM6NKYU1&oh=00_AYEonmSwan7dhb9-jJ0yenJVOi0k9Rum_v2JKIVUCdFmig&oe=67D36C38"",""video_url"":null}]",,,,,"https://www.facebook.com/thongtinchinhphu","https://scontent.fmvd3-1.fna.fbcdn.net/v/t39.30808-6/459177468_957930123038435_2430169465116552305_n.jpg?stp=dst-jpg_s960x960_tt6&_nc_cat=111&ccb=1-7&_nc_sid=cc71e4&_nc_ohc=t51uFdKKVqQQ7kNvgHMijBZ&_nc_oc=AdgAaV2zF6K6ArVzGcXdwMGiOSmsXl0S3JTisXVJeXldNKz-2NWB7bqup8o7hjp02Mw&_nc_zt=23&_nc_ht=scontent.fmvd3-1.fna&_nc_gid=AxUiL4TDfc0d4u5E2ehHqDt&oh=00_AYFw3xEgtuiGZNPSu_Dbt96JjX06oLnLXVbGskmdSbg7AA&oe=67D349B7","https://scontent.fmvd3-1.fna.fbcdn.net/v/t39.30808-1/452958737_925975866233861_1316250170357088183_n.jpg?stp=dst-jpg_s200x200_tt6&_nc_cat=111&ccb=1-7&_nc_sid=2d3e12&_nc_ohc=3Fz2WR_ktWkQ7kNvgHirE0U&_nc_oc=AdiGO6kwe068JoesFvXVgER1F9P_toaRLNZ58MCS3mzJHbhmD1C72ByqEgUGqGbeFD0&_nc_zt=24&_nc_ht=scontent.fmvd3-1.fna&_nc_gid=AxUiL4TDfc0d4u5E2ehHqDt&oh=00_AYF3rBiavaR19rYIAUslmdmn4pvJ-4hBJ0mm5DjQfyuNFA&oe=67D36686","thongtinchinhphu",,false,,"928292462668868",,1783,,,"https://scontent.fmvd3-1.fna.fbcdn.net/v/t39.30808-6/453485634_928292412668873_3244268306468570583_n.jpg?stp=dst-jpg_s600x600_tt6&_nc_cat=102&ccb=1-7&_nc_sid=127cfc&_nc_ohc=07el3-SflS4Q7kNvgGjCFso&_nc_oc=Adhy_L7XLEMUZqIGSsV1yibo-l9aseUA98YJo886jfED-sp4V8xvfXjZXKWetDE5mRo&_nc_zt=23&_nc_ht=scontent.fmvd3-1.fna&_nc_gid=AjIlRjxwfC0o_huKM6NKYU1&oh=00_AYEonmSwan7dhb9-jJ0yenJVOi0k9Rum_v2JKIVUCdFmig&oe=67D36C38",,,,"Post",,,,,"[{""type"":""Like"",""reaction_count"":1711},{""type"":""Sad"",""reaction_count"":29},{""type"":""Love"",""reaction_count"":24},{""type"":""Care"",""reaction_count"":15},{""type"":""Wow"",""reaction_count"":3},{""type"":""Angry"",""reaction_count"":1}]",true,,,,"2015-10-01T00:00:00.000Z",,,,"2025-03-09T12:03:09.663Z","{""url"":""https://www.facebook.com/thongtinchinhphu"",""num_of_posts"":200,""end_date"":""2024-07-30T15:46:39.000Z"",""start_date"":""""}",,,,
