"url","post_id","user_url","user_username_raw","content","date_posted","hashtags","num_comments","num_shares","num_likes_type","page_name","profile_id","page_intro","page_category","page_logo","page_external_website","page_likes","page_followers","page_is_verified","original_post","attachments","other_posts_url","post_external_link","post_external_title","post_external_image","page_url","header_image","avatar_image_url","profile_handle","has_handshake","is_sponsored","sponsor_name","shortcode","video_view_count","likes","days_range","num_of_posts","post_image","posts_to_not_include","until_date","from_date","post_type","following","start_date","end_date","link_description_text","count_reactions_type","is_page","include_profile_data","page_phone","page_email","page_creation_time","page_reviews_score","page_reviewers_amount","page_price_range","timestamp","input","error","error_code","warning","warning_code"
"https://www.facebook.com/thongtinchinhphu/posts/pfbid0BNcuSArab37HXbLPaCYcbbRtnf5MFYRAp6oAzGpuSr4st5noUWiQPwVQcLosKVR1l","1007588548072592","https://www.facebook.com/thongtinchinhphu","Thông tin Chính phủ","🛣 🇻🇳
Thủ tướng: Hoàn thành 2 tuyến cao tốc tại Cao Bằng-Lạng Sơn ngay trong 2025","2024-11-14T14:03:02.000Z",,5,87,"{""type"":""Like"",""num"":1867}","Thông tin Chính phủ","100064643681682","Cập nhật tới đồng bào về hoạt động, chỉ đạo điều hành của Chính phủ, Thủ tướng Chính phủ và các thông tin quan trọng khác","Government organisation","https://scontent.futp2-1.fna.fbcdn.net/v/t39.30808-1/452958737_925975866233861_1316250170357088183_n.jpg?stp=dst-jpg_s200x200_tt6&_nc_cat=1&ccb=1-7&_nc_sid=2d3e12&_nc_ohc=2EReX7b7AV4Q7kNvgHWW7M9&_nc_oc=AdgyWwXMQN-TH7V0IxS4YUpiYIk2Ab2UDLIyQ1cu4tcBl76eN2NZOD0YiXLcXyKDkzs&_nc_zt=24&_nc_ht=scontent.futp2-1.fna&_nc_gid=AoySDFPXTd_jieCIjRTBYC8&oh=00_AYEQHUv6b3jcjkBP9bKdLiayxuz2vZOWKS81rA76TkgJTg&oe=67D87446",,,6200000,false,,,,,,,"https://www.facebook.com/thongtinchinhphu","https://scontent.futp2-1.fna.fbcdn.net/v/t39.30808-6/459177468_957930123038435_2430169465116552305_n.jpg?stp=dst-jpg_s960x960_tt6&_nc_cat=111&ccb=1-7&_nc_sid=cc71e4&_nc_ohc=CysjJ0ZKmr4Q7kNvgGg04Bb&_nc_oc=Adjl_vrJbfblmPeHzWhsT6fNk3xpSEQRMmmjRUxbSmpONFDjV2kBumODvS0Ng6aHi1c&_nc_zt=23&_nc_ht=scontent.futp2-1.fna&_nc_gid=AoySDFPXTd_jieCIjRTBYC8&oh=00_AYHmtODQNvd1hP8itE8FyG-KwtKtdzHRH4Ys8AWCWnuAGA&oe=67D88FB7","https://scontent.futp2-1.fna.fbcdn.net/v/t39.30808-1/452958737_925975866233861_1316250170357088183_n.jpg?stp=dst-jpg_s200x200_tt6&_nc_cat=1&ccb=1-7&_nc_sid=2d3e12&_nc_ohc=2EReX7b7AV4Q7kNvgHWW7M9&_nc_oc=AdgyWwXMQN-TH7V0IxS4YUpiYIk2Ab2UDLIyQ1cu4tcBl76eN2NZOD0YiXLcXyKDkzs&_nc_zt=24&_nc_ht=scontent.futp2-1.fna&_nc_gid=AoySDFPXTd_jieCIjRTBYC8&oh=00_AYEQHUv6b3jcjkBP9bKdLiayxuz2vZOWKS81rA76TkgJTg&oe=67D87446","thongtinchinhphu",,false,,"1007588548072592",,2152,,,,,,,"Post",,,,,"[{""type"":""Like"",""reaction_count"":1867},{""type"":""Love"",""reaction_count"":266},{""type"":""Care"",""reaction_count"":12},{""type"":""Wow"",""reaction_count"":3},{""type"":""Angry"",""reaction_count"":3},{""type"":""Haha"",""reaction_count"":1}]",true,,,,"2015-10-01T00:00:00.000Z",,,,"2025-03-13T11:12:17.126Z","{""url"":""https://www.facebook.com/thongtinchinhphu"",""num_of_posts"":"""",""start_date"":""2024-10-07T14:03:02.000Z"",""end_date"":""2024-11-14T14:03:02.000Z""}",,,,
"https://www.facebook.com/thongtinchinhphu/posts/pfbid02FS5MHuAWinXnKSKqDazFSVCVdpz7hdHNmbP5WKy8GqtUCgucJZ2qK62QeDGuhTVol","1007527748078672","https://www.facebook.com/thongtinchinhphu","Thông tin Chính phủ","🇻🇳 TỔNG BÍ THƯ TÔ LÂM THĂM, KHẢO SÁT CUỘC SỐNG CỦA CÁN BỘ, NHÂN DÂN ĐANG SINH SỐNG, LÀM VIỆC TẠI HUYỆN ĐẢO BẠCH LONG VĨ","2024-11-14T12:25:48.000Z",,0,164,"{""type"":""Like"",""num"":3764}","Thông tin Chính phủ","100064643681682","Cập nhật tới đồng bào về hoạt động, chỉ đạo điều hành của Chính phủ, Thủ tướng Chính phủ và các thông tin quan trọng khác","Government organisation","https://scontent.futp2-1.fna.fbcdn.net/v/t39.30808-1/452958737_925975866233861_1316250170357088183_n.jpg?stp=dst-jpg_s200x200_tt6&_nc_cat=1&ccb=1-7&_nc_sid=2d3e12&_nc_ohc=2EReX7b7AV4Q7kNvgHWW7M9&_nc_oc=AdgyWwXMQN-TH7V0IxS4YUpiYIk2Ab2UDLIyQ1cu4tcBl76eN2NZOD0YiXLcXyKDkzs&_nc_zt=24&_nc_ht=scontent.futp2-1.fna&_nc_gid=AoySDFPXTd_jieCIjRTBYC8&oh=00_AYEQHUv6b3jcjkBP9bKdLiayxuz2vZOWKS81rA76TkgJTg&oe=67D87446",,,6200000,false,,"[{""id"":""1007522164745897"",""type"":""Photo"",""url"":""https://scontent.futp2-1.fna.fbcdn.net/v/t39.30808-6/466913895_1007522168079230_5996334221435637719_n.jpg?_nc_cat=110&ccb=1-7&_nc_sid=127cfc&_nc_ohc=tantvmD63A4Q7kNvgHR17gM&_nc_oc=AdiDlS7hHvtLydXbidZZ-ehPi-HpIEFc5i6u1FDdJ8ErhWQDdArVrEyApyKR-luemLQ&_nc_zt=23&_nc_ht=scontent.futp2-1.fna&_nc_gid=AHxS_JIyZgMfkTJMIiEH5Dh&oh=00_AYE1_e_bfKofRsfo6QCSNTFWDXGzpWzD_LJiant5eJK1kA&oe=67D88532"",""attachment_url"":""https://www.facebook.com/photo.php?fbid=1007522164745897&set=a.249070910591030&type=3"",""video_url"":null},{""id"":""1007522284745885"",""type"":""Photo"",""url"":""https://scontent.futp2-1.fna.fbcdn.net/v/t39.30808-6/466974762_1007522288079218_3917748762210825506_n.jpg?_nc_cat=110&ccb=1-7&_nc_sid=127cfc&_nc_ohc=sMch7yuaJGQQ7kNvgFEHiO9&_nc_oc=AdiRPOK8Mm2Dgdtff1Ys-CO10M8JWQwZaZ5CBDtWWAovraZ7aibbhKig7xQOFSHPj3Q&_nc_zt=23&_nc_ht=scontent.futp2-1.fna&_nc_gid=AHxS_JIyZgMfkTJMIiEH5Dh&oh=00_AYF0fI0IT-Th2eEr8TS3cGX4w8_aKNPDYU-lC3a0Wftd7g&oe=67D887AA"",""attachment_url"":""https://www.facebook.com/photo.php?fbid=1007522284745885&set=a.249070910591030&type=3"",""video_url"":null},{""id"":""1007522181412562"",""type"":""Photo"",""url"":""https://scontent.futp2-1.fna.fbcdn.net/v/t39.30808-6/466924486_1007522184745895_7355870906279642270_n.jpg?_nc_cat=107&ccb=1-7&_nc_sid=127cfc&_nc_ohc=WFcvzhisDB4Q7kNvgHjOJsh&_nc_oc=Adgc5oLNLsO3klzTmtA07XXbTyn-kgGDxEJPeqitI-4-WZ9Nr7ONe9IztKfDmQ4sfyo&_nc_zt=23&_nc_ht=scontent.futp2-1.fna&_nc_gid=AHxS_JIyZgMfkTJMIiEH5Dh&oh=00_AYHG3vb_m63tyigIY3YgpYBq5qP04y65WEi2x--VY4za0g&oe=67D8A25D"",""attachment_url"":""https://www.facebook.com/photo.php?fbid=1007522181412562&set=a.249070910591030&type=3"",""video_url"":null},{""id"":""1007522108079236"",""type"":""Photo"",""url"":""https://scontent.futp2-1.fna.fbcdn.net/v/t39.30808-6/466979521_1007522118079235_6525689068399817603_n.jpg?_nc_cat=103&ccb=1-7&_nc_sid=127cfc&_nc_ohc=ibFDlxPKUjMQ7kNvgFwgjP1&_nc_oc=AdhONS0BltKRMsFMNuX0kb_rSW8yicCiwcV2X6cUSh6XgHpsEojk3u-kWE0_19wwQkI&_nc_zt=23&_nc_ht=scontent.futp2-1.fna&_nc_gid=AHxS_JIyZgMfkTJMIiEH5Dh&oh=00_AYHTnKUTHR_7trE0G7Jgv_Du0aGmj08ae3oGrs9L4CJ9mg&oe=67D88E0F"",""attachment_url"":""https://www.facebook.com/photo.php?fbid=1007522108079236&set=a.249070910591030&type=3"",""video_url"":null},{""id"":""1007522244745889"",""type"":""Photo"",""url"":""https://scontent.futp2-1.fna.fbcdn.net/v/t39.30808-6/467150226_1007522248079222_3994327095197730691_n.jpg?_nc_cat=106&ccb=1-7&_nc_sid=127cfc&_nc_ohc=c7owie30zHsQ7kNvgEu2ZnP&_nc_oc=AdjFY1FxcGTVk961irRrWvOnsD7v1Y2i2tDrdeKdJ42IRetBv7JQaIum-2L37GYBcTA&_nc_zt=23&_nc_ht=scontent.futp2-1.fna&_nc_gid=AHxS_JIyZgMfkTJMIiEH5Dh&oh=00_AYGtN2FFahPcC7Q1XOZm_eJI8IA6xs0oKoE2RbTvuFCAbg&oe=67D88949"",""attachment_url"":""https://www.facebook.com/photo.php?fbid=1007522244745889&set=a.249070910591030&type=3"",""video_url"":null}]",,,,,"https://www.facebook.com/thongtinchinhphu","https://scontent.futp2-1.fna.fbcdn.net/v/t39.30808-6/459177468_957930123038435_2430169465116552305_n.jpg?stp=dst-jpg_s960x960_tt6&_nc_cat=111&ccb=1-7&_nc_sid=cc71e4&_nc_ohc=CysjJ0ZKmr4Q7kNvgGg04Bb&_nc_oc=Adjl_vrJbfblmPeHzWhsT6fNk3xpSEQRMmmjRUxbSmpONFDjV2kBumODvS0Ng6aHi1c&_nc_zt=23&_nc_ht=scontent.futp2-1.fna&_nc_gid=AoySDFPXTd_jieCIjRTBYC8&oh=00_AYHmtODQNvd1hP8itE8FyG-KwtKtdzHRH4Ys8AWCWnuAGA&oe=67D88FB7","https://scontent.futp2-1.fna.fbcdn.net/v/t39.30808-1/452958737_925975866233861_1316250170357088183_n.jpg?stp=dst-jpg_s200x200_tt6&_nc_cat=1&ccb=1-7&_nc_sid=2d3e12&_nc_ohc=2EReX7b7AV4Q7kNvgHWW7M9&_nc_oc=AdgyWwXMQN-TH7V0IxS4YUpiYIk2Ab2UDLIyQ1cu4tcBl76eN2NZOD0YiXLcXyKDkzs&_nc_zt=24&_nc_ht=scontent.futp2-1.fna&_nc_gid=AoySDFPXTd_jieCIjRTBYC8&oh=00_AYEQHUv6b3jcjkBP9bKdLiayxuz2vZOWKS81rA76TkgJTg&oe=67D87446","thongtinchinhphu",,false,,"1007527748078672",,4324,,,"https://scontent.futp2-1.fna.fbcdn.net/v/t39.30808-6/466913895_1007522168079230_5996334221435637719_n.jpg?_nc_cat=110&ccb=1-7&_nc_sid=127cfc&_nc_ohc=tantvmD63A4Q7kNvgHR17gM&_nc_oc=AdiDlS7hHvtLydXbidZZ-ehPi-HpIEFc5i6u1FDdJ8ErhWQDdArVrEyApyKR-luemLQ&_nc_zt=23&_nc_ht=scontent.futp2-1.fna&_nc_gid=AHxS_JIyZgMfkTJMIiEH5Dh&oh=00_AYE1_e_bfKofRsfo6QCSNTFWDXGzpWzD_LJiant5eJK1kA&oe=67D88532",,,,"Post",,,,,"[{""type"":""Like"",""reaction_count"":3764},{""type"":""Love"",""reaction_count"":529},{""type"":""Care"",""reaction_count"":22},{""type"":""Haha"",""reaction_count"":6},{""type"":""Angry"",""reaction_count"":2},{""type"":""Wow"",""reaction_count"":1}]",true,,,,"2015-10-01T00:00:00.000Z",,,,"2025-03-13T11:12:17.126Z","{""url"":""https://www.facebook.com/thongtinchinhphu"",""num_of_posts"":"""",""start_date"":""2024-10-07T14:03:02.000Z"",""end_date"":""2024-11-14T14:03:02.000Z""}",,,,
"https://www.facebook.com/thongtinchinhphu/posts/pfbid037PdxRr9pP25wbZUWc2MMAfyMz5tT7oQZj573Vpx8nc6jGkFzc5KGzSJ77jAkhs8fl","1007498941414886","https://www.facebook.com/thongtinchinhphu","Thông tin Chính phủ","✅📑📲 Bộ trưởng, Chủ nhiệm VPCP Trần Văn Sơn phát biểu chỉ đạo kết luận Hội nghị kết nối thông tin chỉ đạo, điều hành của Chính phủ, Thủ tướng Chính phủ trên môi trường mạng với Cổng Thông tin điện tử các bộ ngành, địa phương năm 2024: 

Về cơ bản, tôi nhất trí với Báo cáo của Tổng Giám đốc Cổng TTĐT Chính phủ Nguyễn Hồng Sâm; bài phát biểu chào mừng của đồng chí Hà Minh Hải, Phó Chủ tịch UBND TP. Hà Nội; bài phát biểu chỉ đạo của đồng chí Bùi Hoàng Phương, Thứ trưởng Bộ Thông tin và Truyền thông và ý kiến phát biểu tham gia của các đồng chí đại diện cho một số Cổng TTĐT các bộ ngành, địa phương. Các báo cáo và các bài phát biểu đã nói rõ, đầy đủ những kết quả thực hiện, khó khăn, vướng mắc và những nhiệm vụ, giải pháp trong thời gian tới.

Hiện nay, chúng ta đang có 2 Cổng ở các bộ, cơ quan: Cổng Dịch vụ công Quốc gia và Cổng TTĐT Bộ ngành, địa phương.

Cổng Dịch vụ công Quốc gia có 3 nhiệm vụ chính: (i) Tích hợp và cung cấp các thông tin trong quá trình tiếp nhận, giải quyết các thủ tục hành chính: Hiện nay, chúng ta có khoảng hơn 6.300 thủ tục hành chính ở 4 cấp chính quyền ; (ii) Cung cấp các dịch vụ công trực tuyến: Ta đã cung cấp dịch vụ công trực tuyến trong đó có cả toàn trình; mức độ 1, 2 triển khai được khoảng 70% trong số 6.300 thủ tục hành chính ; (iii) Tiếp nhận xử lý các phản ánh kiến nghị của người dân, các tổ chức, trong đó cả doanh nghiệp. Chính phủ thường xuyên có Báo cáo về các hoạt động này kể cả công tác cải cách thủ tục hành chính.

Hôm nay, chúng ta bàn về việc Cổng TTĐT Chính phủ kết nối, chia sẻ, liên thông với các Cổng TTĐT bộ ngành, địa phương phục vụ không những sự chỉ đạo của Chính phủ, Thủ tướng Chính phủ mà còn phục vụ chỉ đạo của các bộ ngành, địa phương. Nhiệm vụ rất nhiều nhưng với 2 nhiệm vụ trọng tâm là: Truyền thông chính sách kịp thời đến người dân và doanh nghiệp; phục vụ sự chỉ đạo không chỉ của Chính phủ, Thủ tướng Chính phủ mà còn của các bộ ngành, địa phương).

Theo báo cáo, trong 89 bộ ngành, địa phương, có 26 bộ, cơ quan ngang bộ, cơ quan thuộc Chính phủ (trong đó có 14/18 bộ và cơ quan ngang bộ; 6/8 cơ quan thuộc Chính phủ) đã cung cấp đầy đủ thông tin. Các cơ quan bộ ngành còn lại chưa cung cấp đầy đủ thông tin ; đề nghị các đồng chí báo cáo lãnh đạo trong thời gian sớm nhất cung cấp đầy đủ.

Trong 63 tỉnh, thành phố, có 57 tỉnh, thành phố trực thuộc Trung ương đã cung cấp đầy đủ các thông tin. Chúng ta còn 6 địa phương; đề nghị sau Hội nghị này, các đồng chí báo cáo với lãnh đạo địa phương mình khẩn trương hoàn thiện, hoàn thành nhiệm vụ này.

Đã có 57 tỉnh, thành phố trực thuộc Trung ương cung cấp kịp thông tin đến cấp huyện và có 29 tỉnh, thành phố Trung ương cung cấp thông tin đến cấp xã, phường, thị trấn. 

Đề nghị các đồng chí báo cáo với lãnh đạo địa phương quan tâm để sự chỉ đạo điều hành của Chính phủ, Thủ tướng Chính phủ, các bộ ngành, địa phương đến kịp thời người dân; để kết nối thông tin nhanh, trực tiếp, hiệu quả.

Hiện nay, chúng ta có 43 Cổng TTĐT các bộ ngành, địa phương đã tích hợp đầy đủ với các Trang, Cổng TTĐT. Những bộ ngành, địa phương nào chưa làm được thì cố gắng tích hợp. Tất nhiên, còn vấn đề nguồn lực đầu tư và nguồn nhân lực để vận hành, không khác gì thời kỳ chúng ta phấn đấu 1 cửa cải cách thủ tục hành chính, rồi phấn đấu 1 cửa liên thông, xong thành lập Trung tâm hành chính công các tỉnh, thành phố. Ngoài biên chế ở Trung tâm dịch vụ công, các sở ngành liên quan phải cử người kiêm nghiệm giải quyết công việc.

Sau bước tiến nữa, các bộ phận 1 cửa liên thông này không phụ thuộc vào địa giới hành chính nữa. Năm 2024 có 5 địa phương thí điểm Trung tâm dịch vụ hành chính công 1 cấp trong đó có Hà Nội. 

Phát biểu của đồng chí Phó Chủ tịch UBND Thành phố Hà Nội nói tương đối rõ điều này. 5 tỉnh, thành phố Trung ương làm rất tốt việc này, trong đó có Bắc Ninh. Bắc Ninh giải quyết các thủ tục hành chính trên môi trường điện tử (dịch vụ hành chính công) là một những tỉnh đứng đầu cả nước, kể cả mức độ công khai, minh bạch kết quả giải quyết thủ tục hành chính. 

Vấn đề số hóa, hồ sơ ở Bắc Ninh cũng rất cao. Mức độ phản ánh và xử lý kiến nghị ở Bắc Ninh cũng làm rất tốt. Còn nhiều tỉnh nữa nhưng hôm nay có đại diện Cổng TTĐT tỉnh Bắc Ninh phát biểu nên tôi nói thêm.

Trong báo cáo của Tổng Giám đốc Cổng TTĐT Chính phủ, các bài tham luận của các đơn vị và bài phát biểu của Thứ trưởng Bộ Thông tin và Truyền thông cũng đã nói rõ, thời gian tới, để phục vụ 2 nhiệm vụ căn bản (Truyền thông chính sách kịp thời đến người dân và doanh nghiệp; phục vụ sự chỉ đạo không chỉ của Chính phủ, Thủ tướng Chính phủ mà còn của các Bộ ngành, địa phương), tôi đề xuất mấy nhiệm vụ sau:

Một là, đề nghị các đồng chí báo cáo lãnh đạo các bộ ngành, địa phương, nhất là các đồng chí đứng đầu phải quan tâm; có kế hoạch đầu tư, nâng cấp hệ thống thông tin. Đây là vấn đề mấu chốt. Chúng ta nâng cấp hệ thống thông tin ở các bộ ngành, địa phương sau đó mới kết nối, liên thông, chia sẻ. 

Mục tiêu ta đang đi là: Hiện nay, ta thành lập ở 5 tỉnh, thành phố trực thuộc Trung ương, trong đó có thành phố Hà Nội, Bắc Ninh, Trung tâm dịch vụ hành chính công 1 cấp để sau này người dân ở xã chỉ cần đến xã là có thể giải quyết được các thủ tục hành chính mà kết nối được với Trung ương, không phải về Trung ương nữa. 

Vậy, Cổng TTĐT của chúng ta cũng phải thế.

Về cơ chế chính sách, Chính phủ đã ban hành Nghị định cho phép dùng vốn chi thường xuyên để đầu tư, nâng cấp các hệ thống thông tin; trong đó có việc kết nối, liên thông thông tin. 

Do vậy, vấn đề về vốn không mắc nữa. Nên chúng ta phải đầu tư, nâng cấp đồng bộ hệ thống thông tin để phục vụ tích hợp, kết nối thông tin.

Thứ hai, phải đầu tư nhân lực, đặc biệt nguồn nhân lực làm việc trực tiếp.

Thứ ba, về tổ chức, đề nghị các bộ ngành, địa phương thống nhất Cổng TTĐT trực thuộc Văn phòng. Ở địa phương, Cổng TTĐT trực thuộc Văn phòng của UBND tỉnh, thành phố còn ở Bộ thì trực thuộc Văn phòng Bộ. 

Hiện nay, chúng ta có bộ phận 1 cửa ở Văn phòng cấp Bộ. Ở địa phương thì có địa phương nằm ở một số sở; có địa phương thì có Trung tâm dịch vụ hành chính công. Việc này phải triển khai ngay vì Nghị định 42 ban hành và triển khai từ năm 2022 rồi.

Thứ tư, những kiến nghị hôm nay tương đối nhiều về các khó khăn, vướng mắc. Đề nghị Cổng TTĐT Chính phủ tổng hợp lại; phân nhóm kiến nghị, khó khăn vướng mắc thuộc thẩm quyền của cấp nào thì đề nghị cấp đó xem xét, xử lý. 

Cổng TTĐT tổng hợp lại những kiến nghị và báo cáo hôm nay của Cổng TTĐT Chính phủ, cũng như phát biểu một số đồng chí đại diện cho một số Bộ ngành, địa phương.

Thứ năm, đề nghị Cổng TTĐT các bộ ngành, địa phương phối hợp với Cổng TTĐT Chính phủ không những truyền thông chính sách một cách kịp thời mà còn phải xử lý những kiến nghị, phản ánh của người dân một cách kịp thời; đồng thời, phối hợp với các bộ ngành làm tốt các chức năng, nhiệm vụ. 

Nghị định 42 đã nói và trong bài phát biểu chỉ đạo của Thứ trưởng Bộ Thông tin và Truyền thông Bùi Hoàng Phương cũng đã nói rõ từng nhiệm vụ với mục tiêu là không những truyền thông chính sách mà tiếp nhận những phản ánh, kiến nghị, bức xúc nhất của người dân và doanh nghiệp để báo cáo với Chính phủ, Thủ tướng Chính phủ xử lý kịp thời. Thực chất việc này cũng giúp Chính phủ trong công tác chỉ đạo điều hành.

Thay mặt cho các đồng chí lãnh đạo Văn phòng Chính phủ, xin cảm ơn các đồng chí lãnh đạo các bộ ngành, UBND TP. Hà Nội và các đồng chí đại diện các Cổng TTĐT của các bộ ngành, địa phương đã đến dự Hội nghị rất quan trọng này. 

Sau Hội nghị này, chúng ta về triển khai các công việc tốt hơn. Chúc nhiệm vụ kết nối, liên thông các thông tin để phục vụ sự chỉ đạo, điều hành của Chính phủ, Thủ tướng Chính phủ và các bộ ngành, địa phương ngày càng tốt hơn.","2024-11-14T11:36:41.000Z",,0,116,"{""type"":""Like"",""num"":5425}","Thông tin Chính phủ","100064643681682","Cập nhật tới đồng bào về hoạt động, chỉ đạo điều hành của Chính phủ, Thủ tướng Chính phủ và các thông tin quan trọng khác","Government organisation","https://scontent.futp2-1.fna.fbcdn.net/v/t39.30808-1/452958737_925975866233861_1316250170357088183_n.jpg?stp=dst-jpg_s200x200_tt6&_nc_cat=1&ccb=1-7&_nc_sid=2d3e12&_nc_ohc=2EReX7b7AV4Q7kNvgHWW7M9&_nc_oc=AdgyWwXMQN-TH7V0IxS4YUpiYIk2Ab2UDLIyQ1cu4tcBl76eN2NZOD0YiXLcXyKDkzs&_nc_zt=24&_nc_ht=scontent.futp2-1.fna&_nc_gid=AoySDFPXTd_jieCIjRTBYC8&oh=00_AYEQHUv6b3jcjkBP9bKdLiayxuz2vZOWKS81rA76TkgJTg&oe=67D87446",,,6200000,false,,"[{""id"":""1008422147989232"",""type"":""Photo"",""url"":""https://scontent.futp2-1.fna.fbcdn.net/v/t39.30808-6/466677387_1008422154655898_5146703531997689745_n.jpg?stp=dst-jpg_s600x600_tt6&_nc_cat=111&ccb=1-7&_nc_sid=127cfc&_nc_ohc=0obmMva97AQQ7kNvgHw2TJZ&_nc_oc=Adi8UnvUDdNu1LUoU4qghQTkMENlM3QlTsutW7kzIvDRA8pj7CHzLFA5YkRnUcE_51M&_nc_zt=23&_nc_ht=scontent.futp2-1.fna&_nc_gid=AHxS_JIyZgMfkTJMIiEH5Dh&oh=00_AYE6fdM_DZh1JZRCAqvU14fDFndhEuatVbWbKTB6ZHAS_w&oe=67D87562"",""video_url"":null}]",,,,,"https://www.facebook.com/thongtinchinhphu","https://scontent.futp2-1.fna.fbcdn.net/v/t39.30808-6/459177468_957930123038435_2430169465116552305_n.jpg?stp=dst-jpg_s960x960_tt6&_nc_cat=111&ccb=1-7&_nc_sid=cc71e4&_nc_ohc=CysjJ0ZKmr4Q7kNvgGg04Bb&_nc_oc=Adjl_vrJbfblmPeHzWhsT6fNk3xpSEQRMmmjRUxbSmpONFDjV2kBumODvS0Ng6aHi1c&_nc_zt=23&_nc_ht=scontent.futp2-1.fna&_nc_gid=AoySDFPXTd_jieCIjRTBYC8&oh=00_AYHmtODQNvd1hP8itE8FyG-KwtKtdzHRH4Ys8AWCWnuAGA&oe=67D88FB7","https://scontent.futp2-1.fna.fbcdn.net/v/t39.30808-1/452958737_925975866233861_1316250170357088183_n.jpg?stp=dst-jpg_s200x200_tt6&_nc_cat=1&ccb=1-7&_nc_sid=2d3e12&_nc_ohc=2EReX7b7AV4Q7kNvgHWW7M9&_nc_oc=AdgyWwXMQN-TH7V0IxS4YUpiYIk2Ab2UDLIyQ1cu4tcBl76eN2NZOD0YiXLcXyKDkzs&_nc_zt=24&_nc_ht=scontent.futp2-1.fna&_nc_gid=AoySDFPXTd_jieCIjRTBYC8&oh=00_AYEQHUv6b3jcjkBP9bKdLiayxuz2vZOWKS81rA76TkgJTg&oe=67D87446","thongtinchinhphu",,false,,"1007498941414886",,5979,,,"https://scontent.futp2-1.fna.fbcdn.net/v/t39.30808-6/466677387_1008422154655898_5146703531997689745_n.jpg?stp=dst-jpg_s600x600_tt6&_nc_cat=111&ccb=1-7&_nc_sid=127cfc&_nc_ohc=0obmMva97AQQ7kNvgHw2TJZ&_nc_oc=Adi8UnvUDdNu1LUoU4qghQTkMENlM3QlTsutW7kzIvDRA8pj7CHzLFA5YkRnUcE_51M&_nc_zt=23&_nc_ht=scontent.futp2-1.fna&_nc_gid=AHxS_JIyZgMfkTJMIiEH5Dh&oh=00_AYE6fdM_DZh1JZRCAqvU14fDFndhEuatVbWbKTB6ZHAS_w&oe=67D87562",,,,"Post",,,,,"[{""type"":""Like"",""reaction_count"":5425},{""type"":""Love"",""reaction_count"":503},{""type"":""Haha"",""reaction_count"":19},{""type"":""Care"",""reaction_count"":13},{""type"":""Wow"",""reaction_count"":8},{""type"":""Angry"",""reaction_count"":6},{""type"":""Sad"",""reaction_count"":5}]",true,,,,"2015-10-01T00:00:00.000Z",,,,"2025-03-13T11:12:17.126Z","{""url"":""https://www.facebook.com/thongtinchinhphu"",""num_of_posts"":"""",""start_date"":""2024-10-07T14:03:02.000Z"",""end_date"":""2024-11-14T14:03:02.000Z""}",,,,
"https://www.facebook.com/thongtinchinhphu/posts/pfbid02qRRis2FCstJygtzdJL1AtG667LaP1GjmMVnzfTRkeEEQrMnyoQWbKtXN8XLHimeRl","1007537774744336","https://www.facebook.com/thongtinchinhphu","Thông tin Chính phủ","📲 📈
Qua theo dõi trên mạng xã hội đưa tin, bài của Cổng TTĐT Chính phủ cho thấy, có những tin bài lên hàng chục triệu người xem. 

Đây là cách thức thông tin hiệu quả. Do đó, các Cổng/Trang TTĐT của Bộ, ngành, địa phương nên nghiên cứu thêm, triển khai rộng rãi hơn!

---
Thứ trưởng Bộ TT&TT Bùi Hoàng Phương","2024-11-14T12:41:48.000Z",,3,51,"{""type"":""Like"",""num"":5581}","Thông tin Chính phủ","100064643681682","Cập nhật tới đồng bào về hoạt động, chỉ đạo điều hành của Chính phủ, Thủ tướng Chính phủ và các thông tin quan trọng khác","Government organisation","https://scontent.futp2-1.fna.fbcdn.net/v/t39.30808-1/452958737_925975866233861_1316250170357088183_n.jpg?stp=dst-jpg_s200x200_tt6&_nc_cat=1&ccb=1-7&_nc_sid=2d3e12&_nc_ohc=2EReX7b7AV4Q7kNvgHWW7M9&_nc_oc=AdgyWwXMQN-TH7V0IxS4YUpiYIk2Ab2UDLIyQ1cu4tcBl76eN2NZOD0YiXLcXyKDkzs&_nc_zt=24&_nc_ht=scontent.futp2-1.fna&_nc_gid=AoySDFPXTd_jieCIjRTBYC8&oh=00_AYEQHUv6b3jcjkBP9bKdLiayxuz2vZOWKS81rA76TkgJTg&oe=67D87446",,,6200000,false,,,,,,,"https://www.facebook.com/thongtinchinhphu","https://scontent.futp2-1.fna.fbcdn.net/v/t39.30808-6/459177468_957930123038435_2430169465116552305_n.jpg?stp=dst-jpg_s960x960_tt6&_nc_cat=111&ccb=1-7&_nc_sid=cc71e4&_nc_ohc=CysjJ0ZKmr4Q7kNvgGg04Bb&_nc_oc=Adjl_vrJbfblmPeHzWhsT6fNk3xpSEQRMmmjRUxbSmpONFDjV2kBumODvS0Ng6aHi1c&_nc_zt=23&_nc_ht=scontent.futp2-1.fna&_nc_gid=AoySDFPXTd_jieCIjRTBYC8&oh=00_AYHmtODQNvd1hP8itE8FyG-KwtKtdzHRH4Ys8AWCWnuAGA&oe=67D88FB7","https://scontent.futp2-1.fna.fbcdn.net/v/t39.30808-1/452958737_925975866233861_1316250170357088183_n.jpg?stp=dst-jpg_s200x200_tt6&_nc_cat=1&ccb=1-7&_nc_sid=2d3e12&_nc_ohc=2EReX7b7AV4Q7kNvgHWW7M9&_nc_oc=AdgyWwXMQN-TH7V0IxS4YUpiYIk2Ab2UDLIyQ1cu4tcBl76eN2NZOD0YiXLcXyKDkzs&_nc_zt=24&_nc_ht=scontent.futp2-1.fna&_nc_gid=AoySDFPXTd_jieCIjRTBYC8&oh=00_AYEQHUv6b3jcjkBP9bKdLiayxuz2vZOWKS81rA76TkgJTg&oe=67D87446","thongtinchinhphu",,false,,"1007537774744336",,6049,,,,,,,"Post",,,,,"[{""type"":""Like"",""reaction_count"":5581},{""type"":""Love"",""reaction_count"":431},{""type"":""Care"",""reaction_count"":19},{""type"":""Haha"",""reaction_count"":13},{""type"":""Angry"",""reaction_count"":3},{""type"":""Wow"",""reaction_count"":2}]",true,,,,"2015-10-01T00:00:00.000Z",,,,"2025-03-13T11:12:17.126Z","{""url"":""https://www.facebook.com/thongtinchinhphu"",""num_of_posts"":"""",""start_date"":""2024-10-07T14:03:02.000Z"",""end_date"":""2024-11-14T14:03:02.000Z""}",,,,
