"url","post_id","user_url","user_username_raw","content","date_posted","hashtags","num_comments","num_shares","num_likes_type","page_name","profile_id","page_intro","page_category","page_logo","page_external_website","page_likes","page_followers","page_is_verified","original_post","attachments","other_posts_url","post_external_link","post_external_title","post_external_image","page_url","header_image","avatar_image_url","profile_handle","has_handshake","is_sponsored","sponsor_name","shortcode","video_view_count","likes","days_range","num_of_posts","post_image","posts_to_not_include","until_date","from_date","post_type","following","start_date","end_date","link_description_text","count_reactions_type","is_page","include_profile_data","page_phone","page_email","page_creation_time","page_reviews_score","page_reviewers_amount","page_price_range","timestamp","input","error","error_code","warning","warning_code"
"https://www.facebook.com/thongtinchinhphu/posts/pfbid02VCQ1F3t2hy6urGTg2sVFz5dprHYt85pv58rniJcq4dCTFXAccRoU5eH8y6MkdZckl","1084514177046695","https://www.facebook.com/thongtinchinhphu","Thông tin Chính phủ","🇻🇳 Nhiệt liệt chào đón Hòa thượng, GS.TS. Phra Brahmapundit, Chủ tịch Ủy ban Tổ chức quốc tế Đại lễ Vesak LHQ (ICDV) cùng các vị chức sắc tôn giáo Đoàn ICDV đến thăm, làm việc tại Việt Nam, Phó Thủ tướng Thường trực Chính phủ Nguyễn Hòa Bình cho rằng:

Chuyến thăm của đoàn không chỉ thể hiện sự hợp tác chặt chẽ giữa ICDV với Giáo hội Phật giáo Việt Nam, mà còn là minh chứng sinh động cho tinh thần đoàn kết, hoà hợp giữa các quốc gia trong việc thúc đẩy những giá trị tốt đẹp của Phật giáo trên toàn thế giới.

Phật giáo du nhập và gắn liền với dân tộc Việt Nam từ 2.000 năm trước. Với Việt Nam, Phật giáo đã trở thành đời sống tâm linh rất rộng dãi và phổ biến, là một phần của đời sống văn hóa người dân có nhiều đóng góp trong xây dựng và phát triển đất nước.

Với tư cách là một thành viên trách nhiệm, Giáo hội Phật giáo Việt Nam có những đóng góp thiết thực, tích cực đối với các hoạt động Phật giáo toàn cầu. 

Các cơ quan chức năng của Việt Nam nói chung và Giáo hội Phật giáo Việt Nam nói riêng đã phối hợp tốt với ICDV trong đăng cai và tổ chức thành công 3 Đại lễ Vesak LHQ vào các năm 2008, 2014 và 2019.

Đại lễ Vesak LHQ 2025 do Giáo hội Phật giáo Việt Nam đăng cai tổ chức lần này cũng được các cơ quan chức năng của Việt Nam, Giáo hội Phật giáo Việt Nam đặc biệt quan tâm chỉ đạo, chuẩn bị một cách chu đáo nhất. 

* Đại lễ Vesak LHQ 2025 do Giáo hội Phật giáo Việt Nam đăng cai tổ chức từ ngày 6-8/5/2025 tại TPHCM với chủ đề ""Đoàn kết và bao dung vì nhân phẩm con người: Tuệ giác Phật giáo vì hòa bình thế giới và phát triển bền vững"" với các mục đích: 

Nuôi dưỡng bình an nội tâm vì hòa bình thế giới; Tha thứ và chữa lành bằng chánh niệm: Con đường hòa giải; Từ bi Phật giáo trong hành động: Trách nhiệm chung vì sự phát triển con người; Chánh niệm trong giáo dục vì tương lai nhân ái và bền vững; Thúc đẩy đoàn kết: Nỗ lực hợp tác vì hòa hợp toàn cầu.

---
Phó Thủ tướng Thường trực cho biết, vừa qua, tại TPHCM, ông cũng đã có buổi làm việc với các bộ, ngành hữu quan, địa phương, cũng như Giáo hội Phật giáo Việt Nam để chỉ đạo các nội dung về công tác chuẩn bị, công tác phối hợp cho Đại lễ Vesak LHQ 2025, bảo đảm cho Đại lễ được diễn ra thành công tốt đẹp.

Phó Thủ tướng Nguyễn Hòa Bình cũng đánh giá cao chủ đề của Đại lễ Vesak LHQ 2025 với các mục tiêu hướng tới, trong đó có vấn đề về biến đổi khí hậu, hòa bình, phát triển bền vững… 

Đây là những vấn đề lớn toàn cầu mà các nước đang chung tay hợp tác, thúc đẩy. Đại lễ Vesak LHQ 2025 lần này được tổ chức thành công sẽ là một đóng góp lớn, rất thiết thực cho nhân loại, toàn cầu.

Cảm ơn Phó Thủ tướng Thường trực Chính phủ Nguyễn Hòa Bình đã dành thời gian tiếp Đoàn, Hòa thượng, GS.TS. Phra Brahmapundit đánh giá cao các hoạt động Phật giáo tại Việt Nam, cũng như những đóng góp thiết thực, tích cực, có trách nhiệm của Giáo hội Phật giáo Việt Nam đối với các hoạt động phật giáo quốc tế.

Hòa thượng cho rằng Phật giáo Việt Nam luôn chủ động, tích cực hội nhập quốc tế, góp phần thúc đẩy những giá trị tốt đẹp của Phật giáo trên thế giới. 

Đồng thời cảm ơn sự hỗ trợ, phối hợp chặt chẽ của Chính phủ, các cơ quan chức năng năng của Việt Nam trong công tác chuẩn bị và tổ chức Đại lễ Vesak LHQ 2025.

Hòa thượng Phra Brahmapundit tin tưởng, với kinh nghiệm 3 lần đăng cai, tổ chức thành công Đại lễ Vesak LHQ, trong lần thứ tư này, Đại lễ Vesak LHQ 2025 tại Việt Nam sẽ được diễn ra thành công, để lại dấu ấn tốt đẹp đối với các đại biểu và bạn bè quốc tế, cũng như lan tỏa những giá trị đạo đức, văn hóa, tinh thần nhân văn, nhân ái của Phật giáo trong cộng đồng quốc tế.

Phó Thủ tướng Thường trực Chính phủ Nguyễn Hòa Bình khẳng định các cơ quan chức năng của Việt Nam, Giáo hội Phật giáo Việt Nam sẽ tiếp tục phối hợp chặt chẽ với ICDV thực hiện chu đáo, chuyên nghiệp công tác chuẩn bị, bảo đảm cho Đại lễ Vesak LHQ 2025 diễn ra thành công tốt đẹp.","2025-02-27T15:25:20.000Z",,4,1556,"{""type"":""Like"",""num"":8455}","Thông tin Chính phủ","100064643681682","Cập nhật tới đồng bào về hoạt động, chỉ đạo điều hành của Chính phủ, Thủ tướng Chính phủ và các thông tin quan trọng khác","Government organisation","https://scontent.fkwi2-2.fna.fbcdn.net/v/t39.30808-1/452958737_925975866233861_1316250170357088183_n.jpg?stp=dst-jpg_s200x200_tt6&_nc_cat=1&ccb=1-7&_nc_sid=2d3e12&_nc_ohc=iyrfzVTZ56IQ7kNvgExpXyS&_nc_oc=AdjVSuL2Ds_UpRZY34qZkRWHwzcojwWQtEYs0X9AvIe8xOewPIyRgI6g7D-SwawWkv0&_nc_zt=24&_nc_ht=scontent.fkwi2-2.fna&_nc_gid=AKO-EW9-hoOm-VDy_IfYO01&oh=00_AYDGmSVynSUStJBKvFd48qZPjDc_Afrr31Bh09AKjvrtLQ&oe=67CF7206",,,6100000,false,,"[{""id"":""1084507693714010"",""type"":""Photo"",""url"":""https://scontent.fkwi2-2.fna.fbcdn.net/v/t39.30808-6/480951204_1084507697047343_8887619680148606035_n.jpg?_nc_cat=100&ccb=1-7&_nc_sid=127cfc&_nc_ohc=1K4FB1-0aEUQ7kNvgHsZp5W&_nc_oc=AdhZHLH2HGp9l0RElcn_9VvMZg8CFi9bwuACylsLF3XUTHB4lHvBpqucp3c58Lsx1UE&_nc_zt=23&_nc_ht=scontent.fkwi2-2.fna&_nc_gid=AHOl4MLHc__MVRHFjKas-GE&oh=00_AYA6feSnVIyXoWZdefuO4XNn3EuxG9pAjh0-Vva_A2HesQ&oe=67CF9C0B"",""attachment_url"":""https://www.facebook.com/photo.php?fbid=1084507693714010&set=a.249070910591030&type=3"",""video_url"":null},{""id"":""1084507617047351"",""type"":""Photo"",""url"":""https://scontent.fkwi2-2.fna.fbcdn.net/v/t39.30808-6/481220765_1084507623714017_6317118377050921110_n.jpg?_nc_cat=103&ccb=1-7&_nc_sid=127cfc&_nc_ohc=i0bnkskMsmMQ7kNvgE44MgC&_nc_oc=AdifONkWdgCEcgh58cRqvM9nQBB6PFdX5Vh_NJ3JJRAWMAbhZXO0NnDRGLNnxSMEEPs&_nc_zt=23&_nc_ht=scontent.fkwi2-2.fna&_nc_gid=AHOl4MLHc__MVRHFjKas-GE&oh=00_AYAI48W0qTrwRAHsYoUyUBxkPtpGLet0VOgW0kB2a3AVhA&oe=67CF98D9"",""attachment_url"":""https://www.facebook.com/photo.php?fbid=1084507617047351&set=a.249070910591030&type=3"",""video_url"":null},{""id"":""1084507607047352"",""type"":""Photo"",""url"":""https://scontent.fkwi2-2.fna.fbcdn.net/v/t39.30808-6/481247686_1084507620380684_6698731446544784205_n.jpg?_nc_cat=107&ccb=1-7&_nc_sid=127cfc&_nc_ohc=KWiuK7X04sMQ7kNvgF2ZFV2&_nc_oc=AdhMfzB7ao0sv3IqduRS_uc05_UUsThPvFMD4SJEbCPNHCFNpdmpwL_YCrAXzZoJotU&_nc_zt=23&_nc_ht=scontent.fkwi2-2.fna&_nc_gid=AHOl4MLHc__MVRHFjKas-GE&oh=00_AYBF58qJ7WPASbLyCW95DwXkmvtUeq2hmht55ko2BIblcw&oe=67CF74CB"",""attachment_url"":""https://www.facebook.com/photo.php?fbid=1084507607047352&set=a.249070910591030&type=3"",""video_url"":null}]",,,,,"https://www.facebook.com/thongtinchinhphu","https://scontent.fkwi2-2.fna.fbcdn.net/v/t39.30808-6/459177468_957930123038435_2430169465116552305_n.jpg?stp=dst-jpg_s960x960_tt6&_nc_cat=111&ccb=1-7&_nc_sid=cc71e4&_nc_ohc=4orniL68KiEQ7kNvgESzwIz&_nc_oc=AdiHbOFvZS_hvYq-yaF5N1LARAcqT8zdzwuoegwh8YhCt1fzjQwixJbdsx4jHAf5jDs&_nc_zt=23&_nc_ht=scontent.fkwi2-2.fna&_nc_gid=AKO-EW9-hoOm-VDy_IfYO01&oh=00_AYBSRa-xFdGRp_Kw4COMji0NgtnNfLdQbpNWsNlFqkOuQA&oe=67CF8D77","https://scontent.fkwi2-2.fna.fbcdn.net/v/t39.30808-1/452958737_925975866233861_1316250170357088183_n.jpg?stp=dst-jpg_s200x200_tt6&_nc_cat=1&ccb=1-7&_nc_sid=2d3e12&_nc_ohc=iyrfzVTZ56IQ7kNvgExpXyS&_nc_oc=AdjVSuL2Ds_UpRZY34qZkRWHwzcojwWQtEYs0X9AvIe8xOewPIyRgI6g7D-SwawWkv0&_nc_zt=24&_nc_ht=scontent.fkwi2-2.fna&_nc_gid=AKO-EW9-hoOm-VDy_IfYO01&oh=00_AYDGmSVynSUStJBKvFd48qZPjDc_Afrr31Bh09AKjvrtLQ&oe=67CF7206","thongtinchinhphu",,false,,"1084514177046695",,9970,,,"https://scontent.fkwi2-2.fna.fbcdn.net/v/t39.30808-6/480951204_1084507697047343_8887619680148606035_n.jpg?_nc_cat=100&ccb=1-7&_nc_sid=127cfc&_nc_ohc=1K4FB1-0aEUQ7kNvgHsZp5W&_nc_oc=AdhZHLH2HGp9l0RElcn_9VvMZg8CFi9bwuACylsLF3XUTHB4lHvBpqucp3c58Lsx1UE&_nc_zt=23&_nc_ht=scontent.fkwi2-2.fna&_nc_gid=AHOl4MLHc__MVRHFjKas-GE&oh=00_AYA6feSnVIyXoWZdefuO4XNn3EuxG9pAjh0-Vva_A2HesQ&oe=67CF9C0B",,,,"Post",,,,,"[{""type"":""Like"",""reaction_count"":8455},{""type"":""Love"",""reaction_count"":1406},{""type"":""Care"",""reaction_count"":70},{""type"":""Haha"",""reaction_count"":28},{""type"":""Angry"",""reaction_count"":6},{""type"":""Wow"",""reaction_count"":5}]",true,,,,"2015-10-01T00:00:00.000Z",,,,"2025-03-06T14:34:52.093Z","{""url"":""https://web.facebook.com/thongtinchinhphu"",""num_of_posts"":"""",""start_date"":""07-01-2024"",""end_date"":""02-28-2025""}",,,,
"https://www.facebook.com/thongtinchinhphu/posts/pfbid02MorgZ1wVd11xunhcPm9pPB6hfjVPqU4MhXLRvXcyVYJQNxRj1kmyzBYmCbTiZCLml","1085166493648130","https://www.facebook.com/thongtinchinhphu","Thông tin Chính phủ","🏦👏 KienlongBank dành 3.000 tỷ hỗ trợ vay vốn ổn định sản xuất kinh doanh, vay mua nhà và 1.000 tỷ cho phụ nữ chủ doanh nghiệp.

---
Hoan nghênh việc KienlongBank đã chủ động điều chỉnh giảm lãi suất huy động, tiết giảm chi phí vận hành thông qua việc đẩy mạnh ứng dụng công nghệ. 

Việc này giúp tăng dư địa cho các chương trình ưu đãi lãi suất, bám sát tinh thần chỉ đạo của Chính phủ, cơ quan chức năng.","2025-02-28T12:13:26.000Z",,3,260,"{""type"":""Like"",""num"":4905}","Thông tin Chính phủ","100064643681682","Cập nhật tới đồng bào về hoạt động, chỉ đạo điều hành của Chính phủ, Thủ tướng Chính phủ và các thông tin quan trọng khác","Government organisation","https://scontent.fkwi2-2.fna.fbcdn.net/v/t39.30808-1/452958737_925975866233861_1316250170357088183_n.jpg?stp=dst-jpg_s200x200_tt6&_nc_cat=1&ccb=1-7&_nc_sid=2d3e12&_nc_ohc=iyrfzVTZ56IQ7kNvgExpXyS&_nc_oc=AdjVSuL2Ds_UpRZY34qZkRWHwzcojwWQtEYs0X9AvIe8xOewPIyRgI6g7D-SwawWkv0&_nc_zt=24&_nc_ht=scontent.fkwi2-2.fna&_nc_gid=AKO-EW9-hoOm-VDy_IfYO01&oh=00_AYDGmSVynSUStJBKvFd48qZPjDc_Afrr31Bh09AKjvrtLQ&oe=67CF7206",,,6100000,false,,,,,,,"https://www.facebook.com/thongtinchinhphu","https://scontent.fkwi2-2.fna.fbcdn.net/v/t39.30808-6/459177468_957930123038435_2430169465116552305_n.jpg?stp=dst-jpg_s960x960_tt6&_nc_cat=111&ccb=1-7&_nc_sid=cc71e4&_nc_ohc=4orniL68KiEQ7kNvgESzwIz&_nc_oc=AdiHbOFvZS_hvYq-yaF5N1LARAcqT8zdzwuoegwh8YhCt1fzjQwixJbdsx4jHAf5jDs&_nc_zt=23&_nc_ht=scontent.fkwi2-2.fna&_nc_gid=AKO-EW9-hoOm-VDy_IfYO01&oh=00_AYBSRa-xFdGRp_Kw4COMji0NgtnNfLdQbpNWsNlFqkOuQA&oe=67CF8D77","https://scontent.fkwi2-2.fna.fbcdn.net/v/t39.30808-1/452958737_925975866233861_1316250170357088183_n.jpg?stp=dst-jpg_s200x200_tt6&_nc_cat=1&ccb=1-7&_nc_sid=2d3e12&_nc_ohc=iyrfzVTZ56IQ7kNvgExpXyS&_nc_oc=AdjVSuL2Ds_UpRZY34qZkRWHwzcojwWQtEYs0X9AvIe8xOewPIyRgI6g7D-SwawWkv0&_nc_zt=24&_nc_ht=scontent.fkwi2-2.fna&_nc_gid=AKO-EW9-hoOm-VDy_IfYO01&oh=00_AYDGmSVynSUStJBKvFd48qZPjDc_Afrr31Bh09AKjvrtLQ&oe=67CF7206","thongtinchinhphu",,false,,"1085166493648130",,5107,,,,,,,"Post",,,,,"[{""type"":""Like"",""reaction_count"":4905},{""type"":""Love"",""reaction_count"":156},{""type"":""Haha"",""reaction_count"":27},{""type"":""Care"",""reaction_count"":9},{""type"":""Angry"",""reaction_count"":5},{""type"":""Wow"",""reaction_count"":4},{""type"":""Sad"",""reaction_count"":1}]",true,,,,"2015-10-01T00:00:00.000Z",,,,"2025-03-06T14:34:52.093Z","{""url"":""https://web.facebook.com/thongtinchinhphu"",""num_of_posts"":"""",""start_date"":""07-01-2024"",""end_date"":""02-28-2025""}",,,,
"https://www.facebook.com/thongtinchinhphu/posts/pfbid0a4hxhQQhp3SwuGn3xAD7wVoUMUowGqvdTfLb4bkmQQYb3pfXAMbHFdtWLeCPkyvTl","1084386777059435","https://www.facebook.com/thongtinchinhphu","Thông tin Chính phủ","💙 ""KHI SỨC KHỎE BỆNH NHÂN ỔN ĐỊNH CŨNG LÀ LÚC BÁC ĐỨNG KHÔNG CÒN VỮNG""

---
💎 Hình ảnh bác sĩ Lô Văn Minh, 63 tuổi, mượn cây truyền dịch của bệnh nhân làm điểm tựa sau ca phẫu thuật kéo dài 5 tiếng, đã gây xúc động mạnh trên mạng xã hội.

Bức ảnh được một đồng nghiệp của ông chụp lại và đăng tải ngày 27/2. 

Bác sĩ Minh vẫn mặc nguyên bộ đồ phẫu thuật, chân đi dép lê, tay vịn vào cây truyền dịch, nở nụ cười nhẹ nhàng. 

""Khi sức khỏe bệnh nhân ổn định cũng là lúc bác đứng không còn vững"", dòng chú thích đi kèm bức ảnh viết. Hình ảnh này nhanh chóng lan tỏa, nhận được nhiều lời tri ân và cảm ơn từ mạng xã hội dành cho sự tận tụy của đội ngũ y bác sĩ.

🏥 Theo bác sĩ Lê Thị Ngọc Anh, Phó giám đốc Bệnh viện Đa khoa Cửa Đông, bức ảnh được chụp sau khi bác sĩ Minh cùng đồng nghiệp hoàn thành ca phẫu thuật kéo dài từ 12h đến 17h ngày 26/2, cho một bệnh nhân ung thư dạ dày. 

Do có tiền sử thoát vị đĩa đệm, bác sĩ Minh thường bị đau nhức lưng nghiêm trọng sau những ca mổ kéo dài, khiến ông khó đứng thẳng. 

Vì vậy, bác sĩ đã mượn cây truyền dịch của một bệnh nhân vừa mổ ruột thừa để làm điểm tựa khi rời phòng mổ.

---
✍️ VnE","2025-02-27T12:56:25.000Z",,362,429,"{""type"":""Like"",""num"":21743}","Thông tin Chính phủ","100064643681682","Cập nhật tới đồng bào về hoạt động, chỉ đạo điều hành của Chính phủ, Thủ tướng Chính phủ và các thông tin quan trọng khác","Government organisation","https://scontent.fkwi2-2.fna.fbcdn.net/v/t39.30808-1/452958737_925975866233861_1316250170357088183_n.jpg?stp=dst-jpg_s200x200_tt6&_nc_cat=1&ccb=1-7&_nc_sid=2d3e12&_nc_ohc=iyrfzVTZ56IQ7kNvgExpXyS&_nc_oc=AdjVSuL2Ds_UpRZY34qZkRWHwzcojwWQtEYs0X9AvIe8xOewPIyRgI6g7D-SwawWkv0&_nc_zt=24&_nc_ht=scontent.fkwi2-2.fna&_nc_gid=AKO-EW9-hoOm-VDy_IfYO01&oh=00_AYDGmSVynSUStJBKvFd48qZPjDc_Afrr31Bh09AKjvrtLQ&oe=67CF7206",,,6100000,false,,"[{""id"":""1084384373726342"",""type"":""Photo"",""url"":""https://scontent.fkwi2-2.fna.fbcdn.net/v/t39.30808-6/481243799_1084384377059675_1908661948097995004_n.jpg?stp=dst-jpg_s600x600_tt6&_nc_cat=103&ccb=1-7&_nc_sid=127cfc&_nc_ohc=Vce6sYMk1LEQ7kNvgH84hii&_nc_oc=AdiA8cWF2HLeVUUgALXrdghyBLoOk-iiMgr0Q8KBrJwNjSPm6nLse3LHYDSIUdE_ZXQ&_nc_zt=23&_nc_ht=scontent.fkwi2-2.fna&_nc_gid=AHOl4MLHc__MVRHFjKas-GE&oh=00_AYC5tf7eF-sT9LkdWf5YHQZ0IKf1HssstSHA-M8t3Ip5VA&oe=67CF8C64"",""video_url"":null}]",,,,,"https://www.facebook.com/thongtinchinhphu","https://scontent.fkwi2-2.fna.fbcdn.net/v/t39.30808-6/459177468_957930123038435_2430169465116552305_n.jpg?stp=dst-jpg_s960x960_tt6&_nc_cat=111&ccb=1-7&_nc_sid=cc71e4&_nc_ohc=4orniL68KiEQ7kNvgESzwIz&_nc_oc=AdiHbOFvZS_hvYq-yaF5N1LARAcqT8zdzwuoegwh8YhCt1fzjQwixJbdsx4jHAf5jDs&_nc_zt=23&_nc_ht=scontent.fkwi2-2.fna&_nc_gid=AKO-EW9-hoOm-VDy_IfYO01&oh=00_AYBSRa-xFdGRp_Kw4COMji0NgtnNfLdQbpNWsNlFqkOuQA&oe=67CF8D77","https://scontent.fkwi2-2.fna.fbcdn.net/v/t39.30808-1/452958737_925975866233861_1316250170357088183_n.jpg?stp=dst-jpg_s200x200_tt6&_nc_cat=1&ccb=1-7&_nc_sid=2d3e12&_nc_ohc=iyrfzVTZ56IQ7kNvgExpXyS&_nc_oc=AdjVSuL2Ds_UpRZY34qZkRWHwzcojwWQtEYs0X9AvIe8xOewPIyRgI6g7D-SwawWkv0&_nc_zt=24&_nc_ht=scontent.fkwi2-2.fna&_nc_gid=AKO-EW9-hoOm-VDy_IfYO01&oh=00_AYDGmSVynSUStJBKvFd48qZPjDc_Afrr31Bh09AKjvrtLQ&oe=67CF7206","thongtinchinhphu",,false,,"1084386777059435",,33028,,,"https://scontent.fkwi2-2.fna.fbcdn.net/v/t39.30808-6/481243799_1084384377059675_1908661948097995004_n.jpg?stp=dst-jpg_s600x600_tt6&_nc_cat=103&ccb=1-7&_nc_sid=127cfc&_nc_ohc=Vce6sYMk1LEQ7kNvgH84hii&_nc_oc=AdiA8cWF2HLeVUUgALXrdghyBLoOk-iiMgr0Q8KBrJwNjSPm6nLse3LHYDSIUdE_ZXQ&_nc_zt=23&_nc_ht=scontent.fkwi2-2.fna&_nc_gid=AHOl4MLHc__MVRHFjKas-GE&oh=00_AYC5tf7eF-sT9LkdWf5YHQZ0IKf1HssstSHA-M8t3Ip5VA&oe=67CF8C64",,,,"Post",,,,,"[{""type"":""Like"",""reaction_count"":21743},{""type"":""Love"",""reaction_count"":10243},{""type"":""Care"",""reaction_count"":985},{""type"":""Sad"",""reaction_count"":38},{""type"":""Haha"",""reaction_count"":9},{""type"":""Wow"",""reaction_count"":8},{""type"":""Angry"",""reaction_count"":2}]",true,,,,"2015-10-01T00:00:00.000Z",,,,"2025-03-06T14:34:52.093Z","{""url"":""https://web.facebook.com/thongtinchinhphu"",""num_of_posts"":"""",""start_date"":""07-01-2024"",""end_date"":""02-28-2025""}",,,,
"https://www.facebook.com/thongtinchinhphu/posts/pfbid0u82G4c5hqeGdmNDoSg9Axt8iEkupnhfogKVw8BhHBt4k813vrPNnHv46Ah2wddXul","1084382950393151","https://www.facebook.com/thongtinchinhphu","Thông tin Chính phủ","🇻🇳
Các địa phương phải rà soát lại quy hoạch, thủ tục hành chính, xây dựng cơ chế, chính sách để phát huy vai trò kiến tạo, chứ không phải ""không quản được thì cấm"".

Lắng nghe, tiếp thu, cầu thị với các ý kiến của người dân, doanh nghiệp để tháo gỡ ngay các khó khăn, vướng mắc.","2025-02-27T12:50:11.000Z",,5,356,"{""type"":""Like"",""num"":8260}","Thông tin Chính phủ","100064643681682","Cập nhật tới đồng bào về hoạt động, chỉ đạo điều hành của Chính phủ, Thủ tướng Chính phủ và các thông tin quan trọng khác","Government organisation","https://scontent.fkwi2-2.fna.fbcdn.net/v/t39.30808-1/452958737_925975866233861_1316250170357088183_n.jpg?stp=dst-jpg_s200x200_tt6&_nc_cat=1&ccb=1-7&_nc_sid=2d3e12&_nc_ohc=iyrfzVTZ56IQ7kNvgExpXyS&_nc_oc=AdjVSuL2Ds_UpRZY34qZkRWHwzcojwWQtEYs0X9AvIe8xOewPIyRgI6g7D-SwawWkv0&_nc_zt=24&_nc_ht=scontent.fkwi2-2.fna&_nc_gid=AKO-EW9-hoOm-VDy_IfYO01&oh=00_AYDGmSVynSUStJBKvFd48qZPjDc_Afrr31Bh09AKjvrtLQ&oe=67CF7206",,,6100000,false,,,,,,,"https://www.facebook.com/thongtinchinhphu","https://scontent.fkwi2-2.fna.fbcdn.net/v/t39.30808-6/459177468_957930123038435_2430169465116552305_n.jpg?stp=dst-jpg_s960x960_tt6&_nc_cat=111&ccb=1-7&_nc_sid=cc71e4&_nc_ohc=4orniL68KiEQ7kNvgESzwIz&_nc_oc=AdiHbOFvZS_hvYq-yaF5N1LARAcqT8zdzwuoegwh8YhCt1fzjQwixJbdsx4jHAf5jDs&_nc_zt=23&_nc_ht=scontent.fkwi2-2.fna&_nc_gid=AKO-EW9-hoOm-VDy_IfYO01&oh=00_AYBSRa-xFdGRp_Kw4COMji0NgtnNfLdQbpNWsNlFqkOuQA&oe=67CF8D77","https://scontent.fkwi2-2.fna.fbcdn.net/v/t39.30808-1/452958737_925975866233861_1316250170357088183_n.jpg?stp=dst-jpg_s200x200_tt6&_nc_cat=1&ccb=1-7&_nc_sid=2d3e12&_nc_ohc=iyrfzVTZ56IQ7kNvgExpXyS&_nc_oc=AdjVSuL2Ds_UpRZY34qZkRWHwzcojwWQtEYs0X9AvIe8xOewPIyRgI6g7D-SwawWkv0&_nc_zt=24&_nc_ht=scontent.fkwi2-2.fna&_nc_gid=AKO-EW9-hoOm-VDy_IfYO01&oh=00_AYDGmSVynSUStJBKvFd48qZPjDc_Afrr31Bh09AKjvrtLQ&oe=67CF7206","thongtinchinhphu",,false,,"1084382950393151",,8716,,,,,,,"Post",,,,,"[{""type"":""Like"",""reaction_count"":8260},{""type"":""Love"",""reaction_count"":328},{""type"":""Haha"",""reaction_count"":95},{""type"":""Care"",""reaction_count"":23},{""type"":""Wow"",""reaction_count"":6},{""type"":""Angry"",""reaction_count"":3},{""type"":""Sad"",""reaction_count"":1}]",true,,,,"2015-10-01T00:00:00.000Z",,,,"2025-03-06T14:34:52.093Z","{""url"":""https://web.facebook.com/thongtinchinhphu"",""num_of_posts"":"""",""start_date"":""07-01-2024"",""end_date"":""02-28-2025""}",,,,
"https://www.facebook.com/thongtinchinhphu/posts/pfbid0q2GjhQ2LnDQLZCnrzL8d3oYJpD3UBchp3qqGaW8eFriJhaQqBs9EgJkS72FtsnqPl","1084363597061753","https://www.facebook.com/thongtinchinhphu","Thông tin Chính phủ","✍️ GIỚI THIỆU CHỮ KÝ CỦA PHÓ THỦ TƯỚNG CHÍNH PHỦ NGUYỄN CHÍ DŨNG","2025-02-27T12:15:13.000Z",,0,67,"{""type"":""Like"",""num"":10932}","Thông tin Chính phủ","100064643681682","Cập nhật tới đồng bào về hoạt động, chỉ đạo điều hành của Chính phủ, Thủ tướng Chính phủ và các thông tin quan trọng khác","Government organisation","https://scontent.fkwi2-2.fna.fbcdn.net/v/t39.30808-1/452958737_925975866233861_1316250170357088183_n.jpg?stp=dst-jpg_s200x200_tt6&_nc_cat=1&ccb=1-7&_nc_sid=2d3e12&_nc_ohc=iyrfzVTZ56IQ7kNvgExpXyS&_nc_oc=AdjVSuL2Ds_UpRZY34qZkRWHwzcojwWQtEYs0X9AvIe8xOewPIyRgI6g7D-SwawWkv0&_nc_zt=24&_nc_ht=scontent.fkwi2-2.fna&_nc_gid=AKO-EW9-hoOm-VDy_IfYO01&oh=00_AYDGmSVynSUStJBKvFd48qZPjDc_Afrr31Bh09AKjvrtLQ&oe=67CF7206",,,6100000,false,,"[{""id"":""1084363147061798"",""type"":""Photo"",""url"":""https://scontent.fkwi2-2.fna.fbcdn.net/v/t39.30808-6/481229890_1084363150395131_194491631124725017_n.jpg?_nc_cat=101&ccb=1-7&_nc_sid=127cfc&_nc_ohc=qrsxvtrX83cQ7kNvgEINHjn&_nc_oc=AdinhHO9K96cZ-zAH6y_xHUb_yGrIFzqXfZDTqKauE6Py4Ho8EuFtDG_bH-DeyGJBHo&_nc_zt=23&_nc_ht=scontent.fkwi2-2.fna&_nc_gid=AcSEl8ZgLFcOmu--DmLZ4LZ&oh=00_AYAd2xcS82RtVKU8pbvU996d_spLlsnvQkcTOVvhuYdSDQ&oe=67CF7337"",""video_url"":null}]",,,,,"https://www.facebook.com/thongtinchinhphu","https://scontent.fkwi2-2.fna.fbcdn.net/v/t39.30808-6/459177468_957930123038435_2430169465116552305_n.jpg?stp=dst-jpg_s960x960_tt6&_nc_cat=111&ccb=1-7&_nc_sid=cc71e4&_nc_ohc=4orniL68KiEQ7kNvgESzwIz&_nc_oc=AdiHbOFvZS_hvYq-yaF5N1LARAcqT8zdzwuoegwh8YhCt1fzjQwixJbdsx4jHAf5jDs&_nc_zt=23&_nc_ht=scontent.fkwi2-2.fna&_nc_gid=AKO-EW9-hoOm-VDy_IfYO01&oh=00_AYBSRa-xFdGRp_Kw4COMji0NgtnNfLdQbpNWsNlFqkOuQA&oe=67CF8D77","https://scontent.fkwi2-2.fna.fbcdn.net/v/t39.30808-1/452958737_925975866233861_1316250170357088183_n.jpg?stp=dst-jpg_s200x200_tt6&_nc_cat=1&ccb=1-7&_nc_sid=2d3e12&_nc_ohc=iyrfzVTZ56IQ7kNvgExpXyS&_nc_oc=AdjVSuL2Ds_UpRZY34qZkRWHwzcojwWQtEYs0X9AvIe8xOewPIyRgI6g7D-SwawWkv0&_nc_zt=24&_nc_ht=scontent.fkwi2-2.fna&_nc_gid=AKO-EW9-hoOm-VDy_IfYO01&oh=00_AYDGmSVynSUStJBKvFd48qZPjDc_Afrr31Bh09AKjvrtLQ&oe=67CF7206","thongtinchinhphu",,false,,"1084363597061753",,12047,,,"https://scontent.fkwi2-2.fna.fbcdn.net/v/t39.30808-6/481229890_1084363150395131_194491631124725017_n.jpg?_nc_cat=101&ccb=1-7&_nc_sid=127cfc&_nc_ohc=qrsxvtrX83cQ7kNvgEINHjn&_nc_oc=AdinhHO9K96cZ-zAH6y_xHUb_yGrIFzqXfZDTqKauE6Py4Ho8EuFtDG_bH-DeyGJBHo&_nc_zt=23&_nc_ht=scontent.fkwi2-2.fna&_nc_gid=AcSEl8ZgLFcOmu--DmLZ4LZ&oh=00_AYAd2xcS82RtVKU8pbvU996d_spLlsnvQkcTOVvhuYdSDQ&oe=67CF7337",,,,"Post",,,,,"[{""type"":""Like"",""reaction_count"":10932},{""type"":""Love"",""reaction_count"":1024},{""type"":""Haha"",""reaction_count"":44},{""type"":""Care"",""reaction_count"":31},{""type"":""Wow"",""reaction_count"":13},{""type"":""Angry"",""reaction_count"":2},{""type"":""Sad"",""reaction_count"":1}]",true,,,,"2015-10-01T00:00:00.000Z",,,,"2025-03-06T14:34:52.093Z","{""url"":""https://web.facebook.com/thongtinchinhphu"",""num_of_posts"":"""",""start_date"":""07-01-2024"",""end_date"":""02-28-2025""}",,,,
