"url","post_id","user_url","user_username_raw","content","date_posted","hashtags","num_comments","num_shares","num_likes_type","page_name","profile_id","page_intro","page_category","page_logo","page_external_website","page_likes","page_followers","page_is_verified","original_post","attachments","other_posts_url","post_external_link","post_external_title","post_external_image","page_url","header_image","avatar_image_url","profile_handle","has_handshake","is_sponsored","sponsor_name","shortcode","video_view_count","likes","days_range","num_of_posts","post_image","posts_to_not_include","until_date","from_date","post_type","following","start_date","end_date","link_description_text","count_reactions_type","is_page","include_profile_data","page_phone","page_email","page_creation_time","page_reviews_score","page_reviewers_amount","page_price_range","timestamp","input","error","error_code","warning","warning_code"
"https://www.facebook.com/thongtinchinhphu/posts/pfbid02fKJ7v4wgUkHRKSW8uaUZAWcU9cDT7gjamb5Y7cfJbBRNz92rE91Nygnj7BqPB11Ml","1043878117776968","https://www.facebook.com/thongtinchinhphu","Thông tin Chính phủ","🇻🇳️🎖️ Chiều nay, Đảng ủy Công an Trung ương, Bộ Công an trang trọng tổ chức Lễ công bố và trao Quyết định của Thủ tướng Chính phủ bổ nhiệm Thiếu tướng Đặng Hồng Đức, Ủy viên Đảng ủy Công an Trung ương, Chánh Văn phòng Bộ Công an giữ chức vụ Thứ trưởng Bộ Công an. 

Đại tướng Lương Tam Quang, Ủy viên Bộ Chính trị, Bí thư Đảng ủy Công an Trung ương, Bộ trưởng Bộ Công an chủ trì buổi Lễ.

Thừa ủy quyền của Thủ tướng Chính phủ, Bộ trưởng Lương Tam Quang đã trao Quyết định bổ nhiệm chức vụ Thứ trưởng Bộ Công an đối với đồng chí Thiếu tướng Đặng Hồng Đức.

Phát biểu tại buổi Lễ, chúc mừng đồng chí Thiếu tướng Đặng Hồng Đức vinh dự được Thủ tướng Chính phủ bổ nhiệm giữ chức vụ Thứ trưởng Bộ Công an, Bộ trưởng Lương Tam Quang nhấn mạnh: 

Quyết định bổ nhiệm đối với đồng chí Đặng Hồng Đức tiếp tục khẳng định sự chăm lo đặc biệt của Đảng, Nhà nước, Nhân dân đối với xây dựng lực lượng Công an nhân dân cách mạng; sự ghi nhận công lao, đóng góp của lực lượng Công an nhân dân và cá nhân đồng chí Đặng Hồng Đức trong sự nghiệp bảo vệ an ninh quốc gia, bảo đảm trật tự, an toàn xã hội; là niềm vinh dự, tự hào của cá nhân đồng chí, cũng là niềm vui, niềm vinh dự, tự hào chung của toàn lực lượng Công an nhân dân.

Bộ trưởng Lương Tam Quang khẳng định, trên mỗi cương vị công tác, dù ở bất kỳ hoàn cảnh nào, Thiếu tướng Đặng Hồng Đức cũng luôn nêu cao tinh thần trách nhiệm, phát huy vai trò gương mẫu đi đầu của người lãnh đạo, chỉ huy, tận tâm, tận lực, vượt qua mọi khó khăn thử thách, hoàn thành xuất sắc chức trách, nhiệm vụ được giao. 

Quá trình công tác, đồng chí đã có nhiều cống hiến cho sự nghiệp bảo vệ an ninh, trật tự, xây dựng và bảo vệ Tổ quốc, được Đảng, Nhà nước, Bộ Công an và Nhân dân ghi nhận, đánh giá cao và tặng nhiều phần thưởng, danh hiệu cao quý.

Bộ trưởng Lương Tam Quang mong muốn và tin tưởng, trên cương vị công tác mới, đồng chí Tân Thứ trưởng sẽ luôn giữ vững phẩm chất cách mạng, tuyệt đối trung thành với Tổ quốc, với Đảng, Nhà nước và Nhân dân; không ngừng nâng cao năng lực, trình độ về mọi mặt, nhất là tư duy chiến lược về an ninh - quốc phòng. 

Trong bất cứ hoàn cảnh nào cũng luôn nêu cao tinh thần trách nhiệm, thật sự là người lãnh đạo, chỉ huy gương mẫu đi đầu về mọi mặt, dám nghĩ, dám nói, dám làm, dám chịu trách nhiệm, dám hy sinh, quyết tâm hoàn thành xuất sắc mọi nhiệm vụ được giao; là tấm gương và chỗ dựa tin cậy để cán bộ, chiến sĩ học tập và noi theo; Đoàn kết cùng tập thể Đảng ủy Công an Trung ương, lãnh đạo Bộ Công an lãnh đạo, chỉ đạo lực lượng Công an nhân dân dưới sự lãnh đạo của Đảng giữ vững an ninh, trật tự, đóng góp tích cực vào sự nghiệp xây dựng và bảo vệ Tổ quốc Việt Nam xã hội chủ nghĩa trong giai đoạn cách mạng mới.","2025-01-03T11:53:05.000Z",,0,181,"{""type"":""Like"",""num"":4848}","Thông tin Chính phủ","100064643681682","Cập nhật tới đồng bào về hoạt động, chỉ đạo điều hành của Chính phủ, Thủ tướng Chính phủ và các thông tin quan trọng khác","Government organization","https://scontent.fqls3-1.fna.fbcdn.net/v/t39.30808-1/452958737_925975866233861_1316250170357088183_n.jpg?stp=dst-jpg_s200x200_tt6&_nc_cat=1&ccb=1-7&_nc_sid=2d3e12&_nc_ohc=2EReX7b7AV4Q7kNvgH1koy_&_nc_oc=Adi_wOyogFOn3fvq3CRvvA6_mAZXSU7vWtsFo8wytbLQtnEoC1AO7PhNQ-0-K1O-9rQ&_nc_zt=24&_nc_ht=scontent.fqls3-1.fna&_nc_gid=AkrousjXezaT9RYYf5f-1sS&oh=00_AYEvHczhs21Dtog3R2-UgCO396w2_Ixvw9ChKZjZ99C0Zg&oe=67D75B06",,,6200000,false,,,,,,,"https://www.facebook.com/thongtinchinhphu","https://scontent.fqls3-1.fna.fbcdn.net/v/t39.30808-6/459177468_957930123038435_2430169465116552305_n.jpg?stp=dst-jpg_s960x960_tt6&_nc_cat=111&ccb=1-7&_nc_sid=cc71e4&_nc_ohc=CysjJ0ZKmr4Q7kNvgEtdIkw&_nc_oc=AdhLlxIWEGBit_NNds8vyqrMlT3LwQKtKvD9tw5kzy_vEIRPGuNqj-byjyQWpmu-5Ek&_nc_zt=23&_nc_ht=scontent.fqls3-1.fna&_nc_gid=AkrousjXezaT9RYYf5f-1sS&oh=00_AYEz35sy2SOMas_5_1RT4mkA4VXvsQ8ZpCaczsWRMuG9Ow&oe=67D73E37","https://scontent.fqls3-1.fna.fbcdn.net/v/t39.30808-1/452958737_925975866233861_1316250170357088183_n.jpg?stp=dst-jpg_s200x200_tt6&_nc_cat=1&ccb=1-7&_nc_sid=2d3e12&_nc_ohc=2EReX7b7AV4Q7kNvgH1koy_&_nc_oc=Adi_wOyogFOn3fvq3CRvvA6_mAZXSU7vWtsFo8wytbLQtnEoC1AO7PhNQ-0-K1O-9rQ&_nc_zt=24&_nc_ht=scontent.fqls3-1.fna&_nc_gid=AkrousjXezaT9RYYf5f-1sS&oh=00_AYEvHczhs21Dtog3R2-UgCO396w2_Ixvw9ChKZjZ99C0Zg&oe=67D75B06","thongtinchinhphu",,false,,"1043878117776968",,5261,,,,,,,"Post",,,,,"[{""type"":""Like"",""reaction_count"":4848},{""type"":""Love"",""reaction_count"":377},{""type"":""Care"",""reaction_count"":15},{""type"":""Haha"",""reaction_count"":11},{""type"":""Wow"",""reaction_count"":5},{""type"":""Angry"",""reaction_count"":4},{""type"":""Sad"",""reaction_count"":1}]",true,,,,"2015-10-01T00:00:00.000Z",,,,"2025-03-12T11:26:55.013Z","{""url"":""https://www.facebook.com/thongtinchinhphu"",""num_of_posts"":"""",""start_date"":""2025-01-01T12:47:57.000Z"",""end_date"":""2025-01-03T12:47:57.000Z""}",,,,
"https://www.facebook.com/thongtinchinhphu/posts/pfbid0xjGjZZdbUUhiX8tBbDCJN9vWAM4kZmerWDqEXo1pDVcpsGYEof8QdaAz481KuB1Vl","1043919674439479","https://www.facebook.com/thongtinchinhphu","Thông tin Chính phủ","🎓 🇨🇺 🧳 ✈
CÓ 14 SUẤT HỌC BỔNG DU HỌC CUBA

---
(Trong đó có 7 chỉ tiêu thuộc ngành Y)","2025-01-03T12:47:57.000Z",,63,61,"{""type"":""Like"",""num"":3842}","Thông tin Chính phủ","100064643681682","Cập nhật tới đồng bào về hoạt động, chỉ đạo điều hành của Chính phủ, Thủ tướng Chính phủ và các thông tin quan trọng khác","Government organization","https://scontent.fqls3-1.fna.fbcdn.net/v/t39.30808-1/452958737_925975866233861_1316250170357088183_n.jpg?stp=dst-jpg_s200x200_tt6&_nc_cat=1&ccb=1-7&_nc_sid=2d3e12&_nc_ohc=2EReX7b7AV4Q7kNvgH1koy_&_nc_oc=Adi_wOyogFOn3fvq3CRvvA6_mAZXSU7vWtsFo8wytbLQtnEoC1AO7PhNQ-0-K1O-9rQ&_nc_zt=24&_nc_ht=scontent.fqls3-1.fna&_nc_gid=AkrousjXezaT9RYYf5f-1sS&oh=00_AYEvHczhs21Dtog3R2-UgCO396w2_Ixvw9ChKZjZ99C0Zg&oe=67D75B06",,,6200000,false,,,,,,,"https://www.facebook.com/thongtinchinhphu","https://scontent.fqls3-1.fna.fbcdn.net/v/t39.30808-6/459177468_957930123038435_2430169465116552305_n.jpg?stp=dst-jpg_s960x960_tt6&_nc_cat=111&ccb=1-7&_nc_sid=cc71e4&_nc_ohc=CysjJ0ZKmr4Q7kNvgEtdIkw&_nc_oc=AdhLlxIWEGBit_NNds8vyqrMlT3LwQKtKvD9tw5kzy_vEIRPGuNqj-byjyQWpmu-5Ek&_nc_zt=23&_nc_ht=scontent.fqls3-1.fna&_nc_gid=AkrousjXezaT9RYYf5f-1sS&oh=00_AYEz35sy2SOMas_5_1RT4mkA4VXvsQ8ZpCaczsWRMuG9Ow&oe=67D73E37","https://scontent.fqls3-1.fna.fbcdn.net/v/t39.30808-1/452958737_925975866233861_1316250170357088183_n.jpg?stp=dst-jpg_s200x200_tt6&_nc_cat=1&ccb=1-7&_nc_sid=2d3e12&_nc_ohc=2EReX7b7AV4Q7kNvgH1koy_&_nc_oc=Adi_wOyogFOn3fvq3CRvvA6_mAZXSU7vWtsFo8wytbLQtnEoC1AO7PhNQ-0-K1O-9rQ&_nc_zt=24&_nc_ht=scontent.fqls3-1.fna&_nc_gid=AkrousjXezaT9RYYf5f-1sS&oh=00_AYEvHczhs21Dtog3R2-UgCO396w2_Ixvw9ChKZjZ99C0Zg&oe=67D75B06","thongtinchinhphu",,false,,"1043919674439479",,4380,,,,,,,"Post",,,,,"[{""type"":""Like"",""reaction_count"":3842},{""type"":""Love"",""reaction_count"":467},{""type"":""Haha"",""reaction_count"":28},{""type"":""Care"",""reaction_count"":26},{""type"":""Wow"",""reaction_count"":14},{""type"":""Sad"",""reaction_count"":3}]",true,,,,"2015-10-01T00:00:00.000Z",,,,"2025-03-12T11:26:55.013Z","{""url"":""https://www.facebook.com/thongtinchinhphu"",""num_of_posts"":"""",""start_date"":""2025-01-01T12:47:57.000Z"",""end_date"":""2025-01-03T12:47:57.000Z""}",,,,
"https://www.facebook.com/thongtinchinhphu/posts/pfbid0Er7Rqd4ZkVt9TYUJgxJTAggWrWQjw7KSW5LkjLv9tFhr2TsVZMwtAZAmKn4WDHK7l","1043854284446018","https://www.facebook.com/thongtinchinhphu","Thông tin Chính phủ","🇻🇳️🎖️ THIẾU TƯỚNG ĐẶNG HỒNG ĐỨC GIỮ CHỨC THỨ TRƯỞNG BỘ CÔNG AN

---
📝 Ngày 3/1/2025, Thủ tướng Chính phủ Phạm Minh Chính ký Quyết định số 18/QĐ-TTg bổ nhiệm đồng chí Thiếu tướng Đặng Hồng Đức, Ủy viên Đảng ủy Công an Trung ương, Chánh Văn phòng Bộ Công an giữ chức Thứ trưởng Bộ Công an.

Quyết định có hiệu lực từ ngày 3/1/2025.

---
📸 Thiếu tướng Đặng Hồng Đức sinh năm 1977; quê quán ở huyện Nam Trực, tỉnh Nam Định.","2025-01-03T11:20:48.000Z",,0,167,"{""type"":""Like"",""num"":9153}","Thông tin Chính phủ","100064643681682","Cập nhật tới đồng bào về hoạt động, chỉ đạo điều hành của Chính phủ, Thủ tướng Chính phủ và các thông tin quan trọng khác","Government organization","https://scontent.fqls3-1.fna.fbcdn.net/v/t39.30808-1/452958737_925975866233861_1316250170357088183_n.jpg?stp=dst-jpg_s200x200_tt6&_nc_cat=1&ccb=1-7&_nc_sid=2d3e12&_nc_ohc=2EReX7b7AV4Q7kNvgH1koy_&_nc_oc=Adi_wOyogFOn3fvq3CRvvA6_mAZXSU7vWtsFo8wytbLQtnEoC1AO7PhNQ-0-K1O-9rQ&_nc_zt=24&_nc_ht=scontent.fqls3-1.fna&_nc_gid=AkrousjXezaT9RYYf5f-1sS&oh=00_AYEvHczhs21Dtog3R2-UgCO396w2_Ixvw9ChKZjZ99C0Zg&oe=67D75B06",,,6200000,false,,"[{""id"":""1043871664444280"",""type"":""Photo"",""url"":""https://scontent.fqls3-1.fna.fbcdn.net/v/t39.30808-6/472264385_1043871667777613_6363369787507585233_n.jpg?stp=dst-jpg_p552x414_tt6&_nc_cat=104&ccb=1-7&_nc_sid=127cfc&_nc_ohc=WkBZ-Uwec-AQ7kNvgEf6qsj&_nc_oc=AdiSV5c19lV_qFr9r5FRlVeUZd8F_riYIYlX1DGcTJfQGVn9xQQ5kJVR4-5LqSQdcvI&_nc_zt=23&_nc_ht=scontent.fqls3-1.fna&_nc_gid=AAAreaU1CtHB2w9HzEMmKNu&oh=00_AYEZmNAT2yesTQRCqYq0jm2Ept48ox2rEkh3NUMhstGX5g&oe=67D732B4"",""video_url"":null}]",,,,,"https://www.facebook.com/thongtinchinhphu","https://scontent.fqls3-1.fna.fbcdn.net/v/t39.30808-6/459177468_957930123038435_2430169465116552305_n.jpg?stp=dst-jpg_s960x960_tt6&_nc_cat=111&ccb=1-7&_nc_sid=cc71e4&_nc_ohc=CysjJ0ZKmr4Q7kNvgEtdIkw&_nc_oc=AdhLlxIWEGBit_NNds8vyqrMlT3LwQKtKvD9tw5kzy_vEIRPGuNqj-byjyQWpmu-5Ek&_nc_zt=23&_nc_ht=scontent.fqls3-1.fna&_nc_gid=AkrousjXezaT9RYYf5f-1sS&oh=00_AYEz35sy2SOMas_5_1RT4mkA4VXvsQ8ZpCaczsWRMuG9Ow&oe=67D73E37","https://scontent.fqls3-1.fna.fbcdn.net/v/t39.30808-1/452958737_925975866233861_1316250170357088183_n.jpg?stp=dst-jpg_s200x200_tt6&_nc_cat=1&ccb=1-7&_nc_sid=2d3e12&_nc_ohc=2EReX7b7AV4Q7kNvgH1koy_&_nc_oc=Adi_wOyogFOn3fvq3CRvvA6_mAZXSU7vWtsFo8wytbLQtnEoC1AO7PhNQ-0-K1O-9rQ&_nc_zt=24&_nc_ht=scontent.fqls3-1.fna&_nc_gid=AkrousjXezaT9RYYf5f-1sS&oh=00_AYEvHczhs21Dtog3R2-UgCO396w2_Ixvw9ChKZjZ99C0Zg&oe=67D75B06","thongtinchinhphu",,false,,"1043854284446018",,9936,,,"https://scontent.fqls3-1.fna.fbcdn.net/v/t39.30808-6/472264385_1043871667777613_6363369787507585233_n.jpg?stp=dst-jpg_p552x414_tt6&_nc_cat=104&ccb=1-7&_nc_sid=127cfc&_nc_ohc=WkBZ-Uwec-AQ7kNvgEf6qsj&_nc_oc=AdiSV5c19lV_qFr9r5FRlVeUZd8F_riYIYlX1DGcTJfQGVn9xQQ5kJVR4-5LqSQdcvI&_nc_zt=23&_nc_ht=scontent.fqls3-1.fna&_nc_gid=AAAreaU1CtHB2w9HzEMmKNu&oh=00_AYEZmNAT2yesTQRCqYq0jm2Ept48ox2rEkh3NUMhstGX5g&oe=67D732B4",,,,"Post",,,,,"[{""type"":""Like"",""reaction_count"":9153},{""type"":""Love"",""reaction_count"":714},{""type"":""Care"",""reaction_count"":26},{""type"":""Wow"",""reaction_count"":21},{""type"":""Haha"",""reaction_count"":20},{""type"":""Angry"",""reaction_count"":2}]",true,,,,"2015-10-01T00:00:00.000Z",,,,"2025-03-12T11:26:55.013Z","{""url"":""https://www.facebook.com/thongtinchinhphu"",""num_of_posts"":"""",""start_date"":""2025-01-01T12:47:57.000Z"",""end_date"":""2025-01-03T12:47:57.000Z""}",,,,
"https://www.facebook.com/thongtinchinhphu/posts/pfbid02AcPT4Q1VVFR4bgEdTHyME338Ko2XzdPNzRxwZ1vyZF2iES5R9fX9DdQ2zfHxbGZDl","1043863361111777","https://www.facebook.com/thongtinchinhphu","Thông tin Chính phủ","👩‍🏫 💯 🧑‍🏫
Vừa ban hành nhiều quy định mới về dạy thêm, học thêm.

Xác định chỉ cấm những hiện tượng tiêu cực chứ không cấm những nhu cầu có thực và chính đáng của cả người dạy và người học!","2025-01-03T11:37:55.000Z",,1,462,"{""type"":""Like"",""num"":12452}","Thông tin Chính phủ","100064643681682","Cập nhật tới đồng bào về hoạt động, chỉ đạo điều hành của Chính phủ, Thủ tướng Chính phủ và các thông tin quan trọng khác","Government organization","https://scontent.fqls3-1.fna.fbcdn.net/v/t39.30808-1/452958737_925975866233861_1316250170357088183_n.jpg?stp=dst-jpg_s200x200_tt6&_nc_cat=1&ccb=1-7&_nc_sid=2d3e12&_nc_ohc=2EReX7b7AV4Q7kNvgH1koy_&_nc_oc=Adi_wOyogFOn3fvq3CRvvA6_mAZXSU7vWtsFo8wytbLQtnEoC1AO7PhNQ-0-K1O-9rQ&_nc_zt=24&_nc_ht=scontent.fqls3-1.fna&_nc_gid=AkrousjXezaT9RYYf5f-1sS&oh=00_AYEvHczhs21Dtog3R2-UgCO396w2_Ixvw9ChKZjZ99C0Zg&oe=67D75B06",,,6200000,false,,,,,,,"https://www.facebook.com/thongtinchinhphu","https://scontent.fqls3-1.fna.fbcdn.net/v/t39.30808-6/459177468_957930123038435_2430169465116552305_n.jpg?stp=dst-jpg_s960x960_tt6&_nc_cat=111&ccb=1-7&_nc_sid=cc71e4&_nc_ohc=CysjJ0ZKmr4Q7kNvgEtdIkw&_nc_oc=AdhLlxIWEGBit_NNds8vyqrMlT3LwQKtKvD9tw5kzy_vEIRPGuNqj-byjyQWpmu-5Ek&_nc_zt=23&_nc_ht=scontent.fqls3-1.fna&_nc_gid=AkrousjXezaT9RYYf5f-1sS&oh=00_AYEz35sy2SOMas_5_1RT4mkA4VXvsQ8ZpCaczsWRMuG9Ow&oe=67D73E37","https://scontent.fqls3-1.fna.fbcdn.net/v/t39.30808-1/452958737_925975866233861_1316250170357088183_n.jpg?stp=dst-jpg_s200x200_tt6&_nc_cat=1&ccb=1-7&_nc_sid=2d3e12&_nc_ohc=2EReX7b7AV4Q7kNvgH1koy_&_nc_oc=Adi_wOyogFOn3fvq3CRvvA6_mAZXSU7vWtsFo8wytbLQtnEoC1AO7PhNQ-0-K1O-9rQ&_nc_zt=24&_nc_ht=scontent.fqls3-1.fna&_nc_gid=AkrousjXezaT9RYYf5f-1sS&oh=00_AYEvHczhs21Dtog3R2-UgCO396w2_Ixvw9ChKZjZ99C0Zg&oe=67D75B06","thongtinchinhphu",,false,,"1043863361111777",,13494,,,,,,,"Post",,,,,"[{""type"":""Like"",""reaction_count"":12452},{""type"":""Love"",""reaction_count"":934},{""type"":""Haha"",""reaction_count"":46},{""type"":""Care"",""reaction_count"":44},{""type"":""Wow"",""reaction_count"":12},{""type"":""Sad"",""reaction_count"":5},{""type"":""Angry"",""reaction_count"":1}]",true,,,,"2015-10-01T00:00:00.000Z",,,,"2025-03-12T11:26:55.013Z","{""url"":""https://www.facebook.com/thongtinchinhphu"",""num_of_posts"":"""",""start_date"":""2025-01-01T12:47:57.000Z"",""end_date"":""2025-01-03T12:47:57.000Z""}",,,,
"https://www.facebook.com/thongtinchinhphu/posts/pfbid031SyErzZzcDaJP4xq3W4zJErqWroFCxgiU5dVud4KkQfwcQLC4japmMpzzirTBU51l","1043778024453644","https://www.facebook.com/thongtinchinhphu","Thông tin Chính phủ","👏 KHEN THƯỞNG TÀI XẾ XE ÔM CÔNG NGHỆ DŨNG CẢM CAN NGĂN VỤ GÂY RỐI TRÊN ĐƯỜNG LÊ DUẨN (TPHCM)

---
🌟 Anh H.H.V (tài xế xe ôm công nghệ) chính là người đã đứng ra can ngăn vụ xung đột do va chạm giao thông trên đường Lê Duẩn vào đêm 31/12 vừa qua,  can ngăn hành vi vi phạm pháp luật của Dũng và Ngọc Anh, dẫn đến anh bị đánh gây thương tích.

Rất mong muốn mỗi công dân khi tham gia giao thông phải chấp hành nghiêm quy định pháp luật; ứng xử văn hóa, bình tĩnh khi xử lý các tình huống xảy ra và rất cần những tấm gương như anh V để xã hội được đảm bảo ANTT, người dân được an toàn, hạnh phúc.

---
️📸🎖️: Công an Quận 1 (TPHCM) đã tổ chức khen thưởng đột xuất với anh V vì có hành động dũng cảm ngăn chặn vụ gây rối trật tự công cộng trong đêm Giao thừa 31/12/2024.","2025-01-03T08:43:48.000Z",,187,123,"{""type"":""Like"",""num"":11710}","Thông tin Chính phủ","100064643681682","Cập nhật tới đồng bào về hoạt động, chỉ đạo điều hành của Chính phủ, Thủ tướng Chính phủ và các thông tin quan trọng khác","Government organization","https://scontent.fqls3-1.fna.fbcdn.net/v/t39.30808-1/452958737_925975866233861_1316250170357088183_n.jpg?stp=dst-jpg_s200x200_tt6&_nc_cat=1&ccb=1-7&_nc_sid=2d3e12&_nc_ohc=2EReX7b7AV4Q7kNvgH1koy_&_nc_oc=Adi_wOyogFOn3fvq3CRvvA6_mAZXSU7vWtsFo8wytbLQtnEoC1AO7PhNQ-0-K1O-9rQ&_nc_zt=24&_nc_ht=scontent.fqls3-1.fna&_nc_gid=AkrousjXezaT9RYYf5f-1sS&oh=00_AYEvHczhs21Dtog3R2-UgCO396w2_Ixvw9ChKZjZ99C0Zg&oe=67D75B06",,,6200000,false,,"[{""id"":""1043782257786554"",""type"":""Photo"",""url"":""https://scontent.fqls3-1.fna.fbcdn.net/v/t39.30808-6/472436208_1043782261119887_1880142884617389809_n.jpg?stp=dst-jpg_p180x540_tt6&_nc_cat=105&ccb=1-7&_nc_sid=127cfc&_nc_ohc=S1-LPWYMUiIQ7kNvgHUoiND&_nc_oc=Adh-8g3tGK9FtcUbwspTyFv4YmFZ8_MhbZCouFNBGdNskrVGDax1lx_oyhMVI4KKoms&_nc_zt=23&_nc_ht=scontent.fqls3-1.fna&_nc_gid=ACwcNNVGg9BZXH3ANFpfLpd&oh=00_AYHNWyMfUeJ_D0KUTley5cbbbgpuE7c9FoaAdh8ri2hXXQ&oe=67D7384C"",""video_url"":null}]",,,,,"https://www.facebook.com/thongtinchinhphu","https://scontent.fqls3-1.fna.fbcdn.net/v/t39.30808-6/459177468_957930123038435_2430169465116552305_n.jpg?stp=dst-jpg_s960x960_tt6&_nc_cat=111&ccb=1-7&_nc_sid=cc71e4&_nc_ohc=CysjJ0ZKmr4Q7kNvgEtdIkw&_nc_oc=AdhLlxIWEGBit_NNds8vyqrMlT3LwQKtKvD9tw5kzy_vEIRPGuNqj-byjyQWpmu-5Ek&_nc_zt=23&_nc_ht=scontent.fqls3-1.fna&_nc_gid=AkrousjXezaT9RYYf5f-1sS&oh=00_AYEz35sy2SOMas_5_1RT4mkA4VXvsQ8ZpCaczsWRMuG9Ow&oe=67D73E37","https://scontent.fqls3-1.fna.fbcdn.net/v/t39.30808-1/452958737_925975866233861_1316250170357088183_n.jpg?stp=dst-jpg_s200x200_tt6&_nc_cat=1&ccb=1-7&_nc_sid=2d3e12&_nc_ohc=2EReX7b7AV4Q7kNvgH1koy_&_nc_oc=Adi_wOyogFOn3fvq3CRvvA6_mAZXSU7vWtsFo8wytbLQtnEoC1AO7PhNQ-0-K1O-9rQ&_nc_zt=24&_nc_ht=scontent.fqls3-1.fna&_nc_gid=AkrousjXezaT9RYYf5f-1sS&oh=00_AYEvHczhs21Dtog3R2-UgCO396w2_Ixvw9ChKZjZ99C0Zg&oe=67D75B06","thongtinchinhphu",,false,,"1043778024453644",,14609,,,"https://scontent.fqls3-1.fna.fbcdn.net/v/t39.30808-6/472436208_1043782261119887_1880142884617389809_n.jpg?stp=dst-jpg_p180x540_tt6&_nc_cat=105&ccb=1-7&_nc_sid=127cfc&_nc_ohc=S1-LPWYMUiIQ7kNvgHUoiND&_nc_oc=Adh-8g3tGK9FtcUbwspTyFv4YmFZ8_MhbZCouFNBGdNskrVGDax1lx_oyhMVI4KKoms&_nc_zt=23&_nc_ht=scontent.fqls3-1.fna&_nc_gid=ACwcNNVGg9BZXH3ANFpfLpd&oh=00_AYHNWyMfUeJ_D0KUTley5cbbbgpuE7c9FoaAdh8ri2hXXQ&oe=67D7384C",,,,"Post",,,,,"[{""type"":""Like"",""reaction_count"":11710},{""type"":""Love"",""reaction_count"":2782},{""type"":""Care"",""reaction_count"":92},{""type"":""Haha"",""reaction_count"":19},{""type"":""Wow"",""reaction_count"":3},{""type"":""Sad"",""reaction_count"":2},{""type"":""Angry"",""reaction_count"":1}]",true,,,,"2015-10-01T00:00:00.000Z",,,,"2025-03-12T11:26:55.013Z","{""url"":""https://www.facebook.com/thongtinchinhphu"",""num_of_posts"":"""",""start_date"":""2025-01-01T12:47:57.000Z"",""end_date"":""2025-01-03T12:47:57.000Z""}",,,,
"https://www.facebook.com/thongtinchinhphu/posts/pfbid02SoA7eXiBkZNMhpWhnpMNrHgX52kKoJuViALUcuBt5HH3dPNxquR6ropFPNWbuyF3l","1043764344455012","https://www.facebook.com/thongtinchinhphu","Thông tin Chính phủ","🫡 🛑","2025-01-03T08:14:42.000Z",,0,778,"{""type"":""Like"",""num"":7701}","Thông tin Chính phủ","100064643681682","Cập nhật tới đồng bào về hoạt động, chỉ đạo điều hành của Chính phủ, Thủ tướng Chính phủ và các thông tin quan trọng khác","Government organization","https://scontent.fqls3-1.fna.fbcdn.net/v/t39.30808-1/452958737_925975866233861_1316250170357088183_n.jpg?stp=dst-jpg_s200x200_tt6&_nc_cat=1&ccb=1-7&_nc_sid=2d3e12&_nc_ohc=2EReX7b7AV4Q7kNvgH1koy_&_nc_oc=Adi_wOyogFOn3fvq3CRvvA6_mAZXSU7vWtsFo8wytbLQtnEoC1AO7PhNQ-0-K1O-9rQ&_nc_zt=24&_nc_ht=scontent.fqls3-1.fna&_nc_gid=AkrousjXezaT9RYYf5f-1sS&oh=00_AYEvHczhs21Dtog3R2-UgCO396w2_Ixvw9ChKZjZ99C0Zg&oe=67D75B06",,,6200000,false,,"[{""id"":""1043763997788380"",""type"":""Photo"",""url"":""https://scontent.fqls3-1.fna.fbcdn.net/v/t39.30808-6/472086650_1043764001121713_4973316812185346272_n.jpg?stp=dst-jpg_p180x540_tt6&_nc_cat=110&ccb=1-7&_nc_sid=127cfc&_nc_ohc=e9i4tYYKaycQ7kNvgEbLMhP&_nc_oc=AdjjYu346lPOcFO4h-Nv_J40GEBBydiPN-jZxt4Hm81XBR2cSYetqiitwFqaoBQqJ9U&_nc_zt=23&_nc_ht=scontent.fqls3-1.fna&_nc_gid=AWRPq8m7-myPqtJJw2DsBys&oh=00_AYHg7q-vkxBTbRsm06KVOUAYKWOoY3bqmEiCAWCqtbPExw&oe=67D75CDE"",""video_url"":null}]",,,,,"https://www.facebook.com/thongtinchinhphu","https://scontent.fqls3-1.fna.fbcdn.net/v/t39.30808-6/459177468_957930123038435_2430169465116552305_n.jpg?stp=dst-jpg_s960x960_tt6&_nc_cat=111&ccb=1-7&_nc_sid=cc71e4&_nc_ohc=CysjJ0ZKmr4Q7kNvgEtdIkw&_nc_oc=AdhLlxIWEGBit_NNds8vyqrMlT3LwQKtKvD9tw5kzy_vEIRPGuNqj-byjyQWpmu-5Ek&_nc_zt=23&_nc_ht=scontent.fqls3-1.fna&_nc_gid=AkrousjXezaT9RYYf5f-1sS&oh=00_AYEz35sy2SOMas_5_1RT4mkA4VXvsQ8ZpCaczsWRMuG9Ow&oe=67D73E37","https://scontent.fqls3-1.fna.fbcdn.net/v/t39.30808-1/452958737_925975866233861_1316250170357088183_n.jpg?stp=dst-jpg_s200x200_tt6&_nc_cat=1&ccb=1-7&_nc_sid=2d3e12&_nc_ohc=2EReX7b7AV4Q7kNvgH1koy_&_nc_oc=Adi_wOyogFOn3fvq3CRvvA6_mAZXSU7vWtsFo8wytbLQtnEoC1AO7PhNQ-0-K1O-9rQ&_nc_zt=24&_nc_ht=scontent.fqls3-1.fna&_nc_gid=AkrousjXezaT9RYYf5f-1sS&oh=00_AYEvHczhs21Dtog3R2-UgCO396w2_Ixvw9ChKZjZ99C0Zg&oe=67D75B06","thongtinchinhphu",,false,,"1043764344455012",,8383,,,"https://scontent.fqls3-1.fna.fbcdn.net/v/t39.30808-6/472086650_1043764001121713_4973316812185346272_n.jpg?stp=dst-jpg_p180x540_tt6&_nc_cat=110&ccb=1-7&_nc_sid=127cfc&_nc_ohc=e9i4tYYKaycQ7kNvgEbLMhP&_nc_oc=AdjjYu346lPOcFO4h-Nv_J40GEBBydiPN-jZxt4Hm81XBR2cSYetqiitwFqaoBQqJ9U&_nc_zt=23&_nc_ht=scontent.fqls3-1.fna&_nc_gid=AWRPq8m7-myPqtJJw2DsBys&oh=00_AYHg7q-vkxBTbRsm06KVOUAYKWOoY3bqmEiCAWCqtbPExw&oe=67D75CDE",,,,"Post",,,,,"[{""type"":""Like"",""reaction_count"":7701},{""type"":""Love"",""reaction_count"":633},{""type"":""Care"",""reaction_count"":21},{""type"":""Haha"",""reaction_count"":11},{""type"":""Wow"",""reaction_count"":8},{""type"":""Angry"",""reaction_count"":5},{""type"":""Sad"",""reaction_count"":4}]",true,,,,"2015-10-01T00:00:00.000Z",,,,"2025-03-12T11:26:55.013Z","{""url"":""https://www.facebook.com/thongtinchinhphu"",""num_of_posts"":"""",""start_date"":""2025-01-01T12:47:57.000Z"",""end_date"":""2025-01-03T12:47:57.000Z""}",,,,
